Rating,Date,Review
5.0,"May 22, 2024 5:54 PM",although outdated lga wouldnt recommend buying reason lga motherboard ready great cpu wa running year fully overclocked liquid aio upgraded im enthusiast builder cpu still work great easily year plus yet find game couldnt handle besides city skyline obvious reason pair wonderfully gigabyte gb overclocked could definitely get better graphic card thats time might want run k though looking go higher series rtx card look running k put le strain cpu eliminate gpu bottlenecki would include testbench score no longer computer
5.0,"Dec 28, 2022 10:31 AM",coming really feel difference performance chip basically night day honestly cant find reason choose k series version model
5.0,"Jan 1, 2023 3:01 AM",clearance perfect deal new mobo bb
5.0,"Feb 3, 2023 7:07 PM",pro very fast upgraded th gen processor b motherboard installation wa easy con run hot idle c hi aio cooler wo fan running stock cooler may need upgraded cpu intensive application
5.0,"Dec 5, 2022 3:20 PM",upgraded price paid would silly not buy great cpu youre upgrading older ii
5.0,"Sep 1, 2023 3:31 PM",run like champ would recommend anyone run baldurs gate relly good price point
5.0,"Nov 24, 2023 8:07 PM",perfect pc run smooth fast again came great price
3.0,"May 5, 2023 4:18 PM",purchased cpu upgrade existing system workload cpu uplift old one several compatibility issue though th gen wa new core design feature removed no longer support memory enclave feature th gen not secure anymore anyway also compatibility issue vmware esxi x using homelab virtualization box forced format change host o chip also seems unreliable xmp profile enabled bios ive tried brand ram no dice even though theyre listed motherboard compatibility list using asus tuf mb also k awesome linux desktop chip doesnt issue xmp different asus motherboard finally watch out motherboard compatibility check beforehand purchase new motherboard far performance go chip pretty fast compiling software
5.0,"Nov 20, 2023 3:11 AM",upgraded old cpu godsend im glad wa able purchase sale definitely enhanced photography videography workspace excellent gaming well again would hesitate buy total price wa definitely worth sale
5.0,"Jul 15, 2023 8:59 PM",despite chip run hot performs better game like age empire conqueror come basic cooler recommend chip someone really want intel cpu also integrated graphic basic thinking multitasking good choice
5.0,"Feb 10, 2024 7:58 AM",great product upgraded f wont disappointed even though lga getting replaced
5.0,"Aug 12, 2023 7:51 PM",got great price run game far good
4.0,"Aug 11, 2023 4:32 PM",wa very easy mount intel cpu came stock cooler bit thermal paste already cpu performance perfect gb get new cooler got aio corsair elite h wa getting around idle game mobo even turned red led saying temperature wa high corsair airflow x even without side panel wa getting hot af stock cooler youre planning getting cpu intensive task highly recommend buy extra cooler
5.0,"Jun 25, 2023 9:05 AM",work amazing easy install great cpu price
5.0,"Aug 4, 2021 10:19 PM",always loyal intel one huge upgrade make sure motherboard compatible far no problem highly recommend one trusted brand good quality control reliability
5.0,"Sep 22, 2023 8:40 PM",clearance generation back intel cpu machine cpu died popped wa great under thank best buy great staff best buy watertown
5.0,"Jun 22, 2021 12:33 PM",great processor screaming fast doesnt run hot very good price well current gen pcie well z around good value recommend
5.0,"May 5, 2024 5:14 PM",speed pc instantly feel like going hz hz not expensive every game run great
5.0,"Sep 15, 2023 11:24 AM",huge upgrade old ryzen work perfectly no issue got good price point sale
5.0,"Aug 13, 2021 7:03 PM",decided go non k cpu main reason not overclocker also not gamer also like cpu low powered even set bios impose limit cpu disabling multicore enhancement thing let run overclocked memory module even keeping cpu locked improvement previous wa significant rendering blu ray movie handbrake resulted cut time wa surprised shocked first could not believed double check setting using cpu render matter fact even added feature setting like adding audio track sub very happy processor wa contemplating amd wa always intel fan wa highly recommended low wattage usage
5.0,"Nov 19, 2023 9:46 PM",pretty good no problem good gaming
5.0,"Oct 12, 2023 7:48 PM",used build niece pc unbeatable price point
5.0,"Oct 22, 2023 3:44 PM",since processor pc ive great experience
5.0,"May 2, 2024 10:59 AM",great value worked perfectly computer would recommend
5.0,"Sep 8, 2023 12:57 AM",far ive no issue included fan suck besides no issue
5.0,"Apr 23, 2021 3:51 PM",work great no overclocking didnt want anyways ct enough power anything im long term ill put deskmini h anticipate solid tower currently didnt test integrated graphic pcie worked
5.0,"Jun 18, 2023 7:30 PM",good processor havent issue since us pc build
5.0,"Jul 6, 2021 1:35 AM",excellent processor great gaming performance very fast
5.0,"Aug 3, 2023 11:18 PM",product doe job great item would definitely buy again
5.0,"Aug 8, 2023 10:27 AM",very good performance chip good temperature
5.0,"Jun 19, 2023 8:13 AM",cooler came wa annoying otherwise wa good purchase
5.0,"Jun 16, 2023 11:23 PM",working perfectly lowpower consumption proxmox home security appliance bad last intel processor im going able buy new one inconsistent core thus nearly useless home virtualization sure cant afford xeons home use
5.0,"Apr 26, 2021 10:09 PM",last build year ago wa time upgrade went new way need hopefully last another year overkill need should last year come wa bit pricier should especially compared amd offering im intel guy went like
5.0,"Jun 9, 2021 10:58 AM",motherboard died saw two newer cpu socket type picked pricepower not disappointed really not impressed onboard graphic power motherboard automatically switched nvidia card added not able overstress cpu game play no need overclocking near future run fast cool included cooler
5.0,"Dec 22, 2023 3:49 PM",came nice quality no mark run really good
5.0,"Jul 14, 2023 8:09 PM",definitely upgrade th gen correct motherboard didnt got right one pretty quick
5.0,"May 27, 2023 7:26 AM",great cpu check make sure size fit motherboard ive noticed processor end letter f fit reno motherboard
5.0,"Jun 29, 2021 4:28 PM",sweet point price th gen intel cpu price enough get
5.0,"Aug 10, 2023 2:01 AM",pc broke bought new part happened one work good no complaint
5.0,"Aug 25, 2023 4:12 PM",run game smoothly no lag paired decent gpu great frame rate
5.0,"Jul 23, 2021 7:14 PM",great speed no slow down multitasking hope get many useful year
5.0,"Jan 23, 2023 8:14 AM",great price cpu exactly like k unlocked series work really good highly recommend
5.0,"Aug 12, 2023 2:49 AM",run well ti make sure invest liquid cooling though
5.0,"Aug 6, 2023 2:19 AM",great cpu run fast gaming good multitasking
5.0,"Sep 17, 2021 3:57 PM",excellent processor havent much chance put pace dont need overclocking doe everything need quickly using integrated graphic work well routine task pcie version hard drive fly processor
5.0,"Aug 11, 2023 3:29 PM",great cpu budget gaming build suppoted board
5.0,"Jul 14, 2023 7:36 PM",work amazingly highly recommend item youre big pc gamer
5.0,"Jul 21, 2023 7:35 PM",easy install work perfect gaming buget
5.0,"Jul 12, 2023 3:51 PM",needed wanted no issue work great
5.0,"Oct 1, 2021 4:34 PM",awesome th gen cpu usual best buy best pricing intel cpu im looking availability
3.0,"Jun 23, 2023 6:17 PM",wanted build lower spec pc lga mobos lying around surprised price th gen hasnt come going spend build better go th th gen point would not excess computer part
5.0,"Nov 13, 2021 7:58 AM",upgraded pc chose go intel previously amd cpu made big improvement overall performance very happy purchase thank best buy
5.0,"Aug 22, 2021 12:19 PM",run expected work well asus z board got
5.0,"Jan 15, 2023 4:16 PM",nice cpu doe should without heating room
5.0,"Jan 28, 2022 7:45 PM",coming old xeon v thing monster c performance however strongly recommend upgrade cooler oem one small get loud under load
4.0,"May 29, 2021 7:52 AM",intell again stepped game no ocerclcking needed
4.0,"Jan 7, 2023 12:22 PM",exactly wanted price way steep better processor out
5.0,"Mar 23, 2023 8:09 PM",work well vr rig needed low wattage tdp part mini itx vr rig fit bill nicely performance expected turbos nicely
5.0,"Oct 31, 2021 4:00 PM",excellent price service
5.0,"Jan 6, 2023 5:38 PM",work great super fast son love would recommend
3.0,"Feb 9, 2023 9:35 AM",ended returning good cpu stock cooler sucked lock w went ryzen build instead
3.0,"Dec 30, 2022 5:22 PM",processor work expected shipping using usps wa disaster least showed eventually th sereies processor issue series board turn out read documentation pcie work mine doesnt
4.0,"Jan 21, 2022 4:05 PM",intel processor else need say
5.0,"Feb 14, 2024 3:24 PM",very good th gen cpu doe everything need very well wont need upgrade
5.0,"Sep 15, 2023 5:04 PM",work pc build allows better load time loading application happy managed find lower price usual
5.0,"Aug 25, 2023 6:09 PM",definitely upgrade k computer run lot smoother im playing cod warframe
5.0,"Jan 1, 2024 10:36 PM",using cpu unraid server work like charm use intel integrated graphic plex transcoding love
5.0,"Sep 22, 2023 3:24 PM",awesome recommend anyone cant wait get everything done
3.0,"Aug 4, 2023 7:13 PM",nice cpu reasonable price quick delivery
