Rating,Date,Review
5.0,"Feb 25, 2024 10:00 PM",got first pc build work great game apps run no issue wa sale price wa lower usual
5.0,"Nov 20, 2023 4:59 PM",intel core ik desktop processor impress formidable core performance efficiency boasting speed ghz pushed limit unlocked potential treat overclocking enthusiast providing substantial performance boost demanding task gaming compatible lga socket series chipsets ensures futureproofing efficient power management however w power consumption might concern user conscious energy efficiency overall powerhouse caters productivity gaming need albeit slightly higher power draw
5.0,"Apr 28, 2024 8:33 PM",great processor reading lot negative hype internet experienced none sort processor performing expected very little issue ive experienced clock speed hold sustained overclocking wa no issue no heating issue far best cpu buck market right
5.0,"Sep 2, 2023 10:19 PM",lot money enjoy high end gaming probable need placed rtx ti build gb ddr memory never recognized particular slow performance cpu although run little hot doesnt come fan cooling device like intel processor
5.0,"Sep 10, 2023 5:02 PM",awesome cpu obviously not worth full price better option today got sale couldnt happier performance compared previous
5.0,"Apr 24, 2024 2:56 PM",great cpu processor no issue heating even under extreme long load well no thermal throttling high usage
5.0,"Apr 26, 2024 3:26 PM",making pc run smooth butter issue streaming anymore gamers recommend getting
5.0,"Sep 29, 2023 5:59 PM",wow power house great game rig fps acc
5.0,"Aug 17, 2023 2:30 PM",extremely fast there reason intel highly regarded
5.0,"Feb 14, 2022 10:50 AM",absolute powerhouse outstanding performance impressed cool run paired mm aio everything gaming rendering process intel hit back hard new th generation intel core ik processor lightning fast speed remarkable performance easy use overclocking capability make processor champ among mass thank intel
5.0,"May 11, 2022 4:59 PM",cpu great best bang buck opinion cant go wrong core stay cool corsair icue h elite capellix mm ill post pic playing fortnite stay around c idle c recommended atleast many core newest gaming console out p core wan na future proof system bit id go really wan na save money perfect since core
5.0,"Dec 8, 2023 11:58 PM",great cpu put new build work amazing easy oc
5.0,"Dec 20, 2023 5:52 PM",really good cpu highly recommend modern game out
5.0,"Feb 6, 2022 2:35 PM",thing absolute beast cpu great gaming everyday work also wa not very hot hitting c cinebench r cyberpunk mm aio
5.0,"Jul 8, 2022 2:22 PM",honestly much better buy k unless ton cpu intensive work thing complete beast
5.0,"Aug 17, 2023 10:28 PM",great cpu paired ti best cpu out
5.0,"Aug 25, 2023 12:01 PM",very good chip wa best one ive bought far
5.0,"Jan 7, 2023 10:05 AM",fast cpu destroys anything throw love speed run cool
5.0,"Mar 11, 2022 12:51 PM",processor beast yes not top line youre reading youre likely sensible person realizes top line doesnt mean best out period actually use k k separate build barely feel difference two k give virtually performance lower temp much lower price id say like unless already know specific task would benefit k perfect cpu plus seems always sale should nobrainer doe benefit youre choosing two read review product page
5.0,"Jan 17, 2023 10:56 AM",im coming year cpu solid plan upgrading again though paired xfx merc xtx p creating bottleneck lower gpu isnt issue still very solid cpu
5.0,"Dec 24, 2021 5:27 PM",fastupgraded ik put asus zp hi aio sabrent pci rw ti vertical mount w pci extention tforce ddr phanteks eclipse pa drgb
5.0,"Dec 25, 2022 7:47 AM",processor bee knee personal pc dad pc run everything super fast good gpu itll run game fps
5.0,"Dec 2, 2022 9:51 PM",doe designed small clock still stay fairly cool paired nzxt z aio yet see get
5.0,"Jan 13, 2023 11:44 PM",ive no issue amazing processor money best buy made easy overclocking mhz
5.0,"Jan 29, 2023 7:43 PM",fantastic cpu working wonder far no complains good price
5.0,"Aug 29, 2022 10:32 PM",powerful enough need paired asus strix z however run memory mhz max speed
5.0,"Feb 4, 2023 4:15 AM",run like dream thing doesnt get past c anything
5.0,"Apr 12, 2022 12:57 AM",performed better expected much welcomed upgrade
5.0,"May 26, 2022 3:12 AM",amazing product performed well k would purchase again
5.0,"Apr 9, 2022 12:26 AM",vary fast cpu wa huge upgrade old fx
5.0,"Nov 15, 2022 11:43 AM",big fan intel product computer run like champ never disappointed
5.0,"Jan 7, 2023 7:35 AM",nice high end intel processor working great
5.0,"Dec 6, 2022 4:20 PM",beast im running ti no trouble keeping
5.0,"Sep 9, 2022 6:28 AM",didnt fit socket wa confused store representative
5.0,"Feb 24, 2022 2:50 PM",power need overclocked mhz running stable
1.0,"Feb 22, 2022 4:21 PM",not good experience cpu new build doe not make full contact cold plate cooler fact around ihs not contact cooler cold plate almost entire right side may cpu bent socket intel socket motherboard msi unify x cost dollar very upset try get resolved blame intelnot best buy best buy wa great always maybe help getting resolved way much money waste
5.0,"Feb 18, 2024 2:56 AM",intel older bought k wa pinch fit budget read wa good gaming took home installed never issue probably never untill becomes outdated run computer pretty good seems run pretty cool temp well intel cpu else say know good work great video game im sure would anything
5.0,"Mar 7, 2024 3:36 PM",amazing cpu price tag wa cpu got computer back running month almost nonstop work still fast first bought
5.0,"Mar 6, 2024 1:00 AM",great processor mm aio cooling stay nice cool gaming would definitely recommend anyone looking build pc
1.0,"Mar 17, 2023 7:39 PM",came broken best buy wouldnt let return blamed
5.0,"Jan 1, 2024 2:00 PM",love paired evga ftw mm aio never break c w power set previous cpu wa r x blow out water no doubt
5.0,"Nov 8, 2021 10:01 AM",first best buy rock marking msrp retailer started big name place shady still sold out also got birthday discount wa even happier bestbuy allowing preorder chip msi ddr board memory amazing much better performs compared k actually cpu bottleneck game rtx ti mobo ram cpu gpu hard find build awesome system know overpaid gpu markup msrp ddr crash price soon dont like waiting enjoy thing life
5.0,"Jan 30, 2024 7:42 AM",got couldnt say no upgraded ik k couldnt happier
5.0,"Jan 19, 2024 4:44 PM",product wa affordable price also work wonder game perfect cpu gamers
5.0,"Feb 23, 2024 4:45 PM",absolutely love productit performs very well cooler
5.0,"Feb 15, 2024 6:29 PM",powerhouse cpu handle anything throw whether gaming transcoding medium editing photovideo cpu doesnt break sweat paired adequate cooler cpu never issue keeping modern gaming system
5.0,"Nov 15, 2023 6:45 PM",overral real good perfomance very easy installation great price also
5.0,"Nov 19, 2023 9:12 PM",very fast reliable paired forna fast gaming pc
5.0,"Jun 12, 2023 11:55 AM",powerhouse cpu wont need upgrade quite time stay cool decent cooler make sure properly apply thermal paste
5.0,"Dec 5, 2021 11:41 PM",originally bought k replace k decided exchange instead ik offered practically performance p gaming k yet come cheaper also consumes le power generates le heat percore performance new chip addition ecores background program superb window must getting processor window not utilize core correctly use ddr ddr ram new generation processor depends motherboard use ddr much harder get right cost seems way go looking best performance longterm compatibility
5.0,"Mar 10, 2024 6:51 PM",cpu awesome gon na get need play lot videogames
5.0,"Apr 8, 2024 6:18 PM",twelve core whitelie technically eight one want everyday task effeciency core shouldnt disparaged although im sure people would prefer full twelve cored k variant overclockableboostable shine gaming multicore workload get pay
5.0,"Nov 13, 2021 3:53 AM",stumbled upon best buy searching processor new could upgrade k happened day bad boy came out got super fast ive received never slow aspect life definitely blown away happy scored one sold out
5.0,"Mar 15, 2024 4:01 PM",work well mid level build wa upgrade great
5.0,"Oct 25, 2022 10:50 PM",swapped back forth intel amd since honestly state intel pc laptop ran smooth butter amd always seemed glitchy slow load mundane task granted least year since last amd device alder lake cpu amazing fast overcockable face shoot first gaming dont blow amd
5.0,"Mar 8, 2024 5:22 AM",great intel chip speed great get best bang buck
5.0,"Feb 19, 2022 3:47 AM",wa originally going get watching several review comparing didnt make sense spend twice money gain plus us way power ive gotten comfortably overclocked ghz z kraken aio even voltage cpu temp dont really get above cc far performance outstanding along ddr mhz ram really isnt anything cant run max setting run buttery smooth samsung oddyssey neo g
5.0,"Apr 29, 2024 12:06 PM",ive running computer processor full year powerhouse havent trouble running anything no desire upgrade intels th th generation chip moment
5.0,"Jun 23, 2023 2:28 PM",great cpu great preformemce price great gaming
5.0,"May 27, 2024 10:25 PM",very happy cpu ran couple benchmark test saw performance wa pretty consistent others build
5.0,"Apr 13, 2024 11:03 AM",great product rd one ive bought pc fiance got best friend run game great top out c high end game
5.0,"Dec 15, 2023 12:58 PM",boosted pc speed wa looking keep gaming worth every penny
4.0,"Oct 13, 2023 4:58 PM",work great really brought build life run game
5.0,"May 5, 2024 9:06 PM",team wa great very friendly prompt look forward seeing next project computer update future
5.0,"Nov 2, 2023 10:20 AM",son pc love price cant beat price compared price micro center save huge
5.0,"Nov 3, 2023 3:29 PM",processor very good price performs very well great experience installing
5.0,"May 3, 2024 9:47 PM",bought pc younger brother pc recommended said work great
5.0,"Jan 16, 2022 11:16 AM",wow replaced ryzen x part performance wa equivalent not little better cpu nearly le x paired msi tomahawk z ddr board total platform cost wa nearly spent ryzen side granted ryzen motherboard wa premium board wa intel board wa midrange board wa worried cooling since thing run hotter ryzen utilizing mm arctic liquid freezer ii hade one core hit minute stress test everything else stayed high under normal circumstance gaming session sometimes hit mid acceptablenormal intel since socket fairly new sure check whatever cooler getting lga bracket downside chip productivity work youre software developer youre going want core youre running lot background service going lot virtualization architecture really not conducive specific use case though cant think reason go cpu
5.0,"Dec 22, 2023 4:23 PM",building gaming computer cant go wrong one
5.0,"Dec 25, 2023 10:26 PM",work well third one used fot gaming pc
5.0,"Jan 29, 2022 10:39 AM",wa originally going buy ryzen cpu specifically x wasnt even considering intel since chip very clearly inferior started reading new series chip intel finally like two year started innovating again wa going release chip better amd offering ill honest wa still bit hesitant since chip use new architecture core slower rest called efficiency core kinda sound bit sus turn out method better core handle stuff dont need lot muscle like browsing web watching youtube mean le power consumed core really need still waiting used far gaming go cpu excellent paired handle everything perfectly zero stutter zero issue also run significantly cooler previous cpu k pretty great amazing cpu
5.0,"Nov 4, 2023 10:46 PM",great price match excellent buy get price match amazon
5.0,"Mar 1, 2024 3:22 PM",performs awesome great product bad thing wa shipt never showedup day get deliver didnt contact either go get next day
5.0,"Nov 17, 2023 9:56 AM",good quality no problem using far would recommend
5.0,"Apr 12, 2022 6:40 PM",upgraded ik performance difference wa immense game run cpu usage very manageable temperature much better value practical user ik
5.0,"Jul 10, 2023 2:26 PM",perfect upgrade k fast good gaming also ready window make sure right motherboard
5.0,"Feb 9, 2024 5:06 PM",great midupper range cpu paired tuf gaming z motherboard rtx play every game thrown using aio water cooler stay cool no issue whatsoever
5.0,"Mar 22, 2024 3:19 PM",great cpu machine need used work gaming use great chip would definitely recommend
5.0,"Jul 28, 2023 7:59 AM",one powerful proccessor price perfect pc upgrade build irs ready window
5.0,"May 3, 2024 5:12 PM",work well havent issue would recommend
5.0,"Apr 13, 2024 9:07 PM",processor handle very difficult task ease due core
5.0,"Mar 22, 2024 6:05 PM",ever since bought cpu ive no issue gaming even high strenuous game like cyberpunk
5.0,"Oct 7, 2023 6:17 PM",processor very fast compared old laptop
5.0,"Apr 18, 2024 11:54 PM",really great even play powerfull videogames
5.0,"Apr 26, 2024 3:38 PM",work amazing handle anything throw
5.0,"Apr 2, 2022 10:04 PM",upgraded gen really loving speed performance matched msi motherboard really happy overall kudos local best buy part needed store
5.0,"Mar 9, 2022 5:36 PM",always buy series chip always buy k version chip proven very stable fast every task throw clocked stable teating purpose standard boost clock hit instance awsome chip making really want try ik
5.0,"Apr 12, 2024 3:49 PM",way better much little
5.0,"Apr 23, 2022 10:52 AM",got cpu killer sale best buy chip performance incredible run game ease highly recommend gpu gaming
5.0,"Jun 28, 2023 1:48 PM",great power custom pc built would buy again due insane value provides
5.0,"Aug 31, 2022 9:01 PM",incredible performance includes modern warfare ii run cooler f got increase fps warzone im very happy
5.0,"Aug 27, 2023 2:50 PM",went man man upgrade
5.0,"May 20, 2023 5:15 PM",rock solid ever since bought would recommend especially get sale
5.0,"Mar 13, 2024 9:49 AM",work great havent issue since bought overall great mid range cpu
5.0,"Mar 26, 2024 3:27 PM",work wonderful wa best edition add computer
5.0,"Mar 22, 2024 12:34 PM",needed replace cpu wa going harvest job
5.0,"Aug 2, 2023 2:08 PM",amazing processer use game rendering game
5.0,"Mar 29, 2024 4:29 PM",excellent processor gaming wa massive upgrade
5.0,"May 21, 2023 7:40 AM",very fast reliable far no issue installation wa fast easy
5.0,"Jul 4, 2023 5:02 PM",good processor price dont need faster not
5.0,"Mar 24, 2024 3:05 PM",excellence power cpu quite crafter
5.0,"Jan 5, 2024 5:54 PM",very tense lever lock lga socket no complaint run everything girlfriend put great gift
5.0,"Jun 8, 2023 6:52 PM",bought new pc build work great every game play
5.0,"Mar 10, 2024 9:49 AM",great cpu need good cooler keep temp low
5.0,"Jun 2, 2023 8:53 PM",great cpu heat okay still great performance
5.0,"Mar 3, 2024 3:04 PM",amazing chip still strong
5.0,"Jan 14, 2024 7:07 AM",amazing cpu work very well hand year would recommend building new pc
5.0,"May 11, 2022 9:27 PM",trust not need ik well wish could afford one cpu beast overclocked msi za mother board basic stuff cpu not full potential run game dc flight simulator smoothly no crash idle run cc radiator fan running overall wonderful cpu especially sale get k
5.0,"Jan 27, 2024 1:49 PM",purchasing cpu wa able install complete build new gaming pc
5.0,"Jan 19, 2024 3:55 PM",smooth running quick responding wa compatible mai z pro ddr motherboard
5.0,"May 29, 2022 12:59 AM",always affinity amd intel last several year really good amd wa planning continue building cpu however found needing system not able wait new chipset come out definitely not want buy setup last run intel really well alder lake cpu fact support ddr newer standard wa better prospect say very glad went intel build singlecore performance general responsiveness application noticeably better high end amd build seen boot time improved quite bit surprised run miniitx board tiny case lian li dan ah bound get bit hot nothing outrageous overall performance excellent price really good comparing higher end amd cpu moment still give amd love going xt instead higher end nvidia gpu wa also great call year nvidia worth great time go intel nothing disappointed chip full build spec lian li dan ah case intel core ik nzxt kraken x mm aio msi meg zi unify gb kingston fury beast ddr mhz cl powercolor radeon xt red devil silverstone sx w platinum sfxl psu
5.0,"Dec 7, 2023 11:25 AM",great cpu work well vr new triple game get fps vr really good purchase doesnt get hot
5.0,"Jan 11, 2022 10:05 PM",finally upgraded ik wa getting bit long tooth today aaa gaming title alder lake ik paired nvidias ti double frame rate ease staying below c via noctua cooling sure processor insanely fast future told maintain strong running sandy bridge attained verdict buy intel beast right right
5.0,"Dec 19, 2023 4:16 PM",utterly fantastic cant speak enough best buy associate incredible
5.0,"Jan 21, 2024 12:17 AM",grandson put together gaming very happy
5.0,"Apr 24, 2022 9:46 AM",wanted switch amd ryzen decided give team blue one last chance reluctantly upgraded core k ik thinking wouldnt notice difference previous generation wa proven wrong k absolute performance beast kill k doesnt even break sweat no matter task whether video encoding heavy multitasking running numerous program video editing k absolute breeze gamer cpu u need rtx super wa considering upgrading due market held cpu extended life game play feel smoother never dropping below fps ultra setting p example would batman arkham knight notoriously stutter fest much smoother immersive dont know upgrade made game look better responsive cpu game changer commend amd also didnt challenge intel ryzen intel would never stepped game k best cpu intel made year product incredible highly recommend also amd need supported also thing dont return way year ago buy cpu
5.0,"Jan 26, 2024 7:39 PM",great processor very good thermal doesnt overheat
5.0,"Sep 28, 2023 8:34 PM",processor amazing noticed dramatic improvement compared last cpu ordered online wa ready under minute best buy never let
5.0,"Jan 26, 2024 4:33 PM",run perfectly im really enjoying use out
5.0,"Jan 17, 2024 6:05 PM",amazing run little hot fine fan cooling
5.0,"Dec 22, 2023 3:43 PM",work amazing zero issue far would absolutely recommend price
5.0,"Dec 27, 2022 3:02 PM",got sale dollar came very fast wa said shipping wa great im paring love great pick good pick price december good deal
4.0,"May 27, 2023 7:58 AM",doe need guess get dont go ddr save future hassle upgrading ddr
5.0,"Nov 21, 2021 1:40 AM",processor great run cooler series amd gaming least get very hot mce enabled multitasking benchmark play game dont like amd very well
4.0,"Jul 12, 2023 10:08 PM",work expected pretty good doe run little hot would recommend one cooler water cooled
5.0,"Aug 5, 2022 4:34 PM",fast paired msi z processor really incredible issue corsair mhz ram use pair stick system posted bet judge improvement k run msfs lot power great buy
5.0,"Jan 24, 2022 12:48 PM",great cpu single threaded multithreaded doe definitely sweet spot alder lake term wellrounded performance youre gaming definitely check out k production workload benefit extra thread incredibly close k far le money
5.0,"Apr 1, 2022 4:22 PM",purchased part new build replace four year old intel based pc paired asus prime get job done quarter time havent tried overclocking mode yet still setting system running cooler master hyper cpu cooler seems stay cool
5.0,"Dec 15, 2023 4:56 PM",great processor fantastic merchant thanks best buy
5.0,"Nov 17, 2023 4:57 PM",best pricequality processor store apart grabbing sale
5.0,"Sep 13, 2023 6:55 AM",give no problem far ive seen since installed computer never run faster since upgrade
4.0,"Sep 1, 2023 5:36 PM",great processor run nice cool tt aio
5.0,"Nov 17, 2023 3:36 PM",very good intel cpu im amd fanboy good cpu
3.0,"Sep 13, 2023 10:19 AM",cpu exactly advertised no graphic powerful little tool star didnt come cpu fan never ever received cpu without matching fan not sure wouldnt include one
5.0,"Jul 15, 2023 7:30 PM",great cpu intel exactly needed latest gamingstreaming pc build definitely would recommend
5.0,"Oct 6, 2023 3:26 PM",best cpu around cant find anything negative say
5.0,"Dec 30, 2022 5:45 PM",say hold every game ive thrown far pair rtx nicely never get above c under load
5.0,"Jan 21, 2022 6:11 PM",great cpu much better value k gaming would probably suggest k maybe even productivity gaming wanted something pcores without paying full price k
5.0,"Jan 21, 2022 7:12 PM",good value pair motherboard wont break bank performs spec hold boost clock indefinitely sure would good overclocking sure run window full performance
5.0,"Sep 17, 2022 4:27 PM",intel stay king gaming still fall behind multithreaded performance no complaint worked right out box nice competitive price
5.0,"Jul 4, 2023 3:14 AM",solid cpu no problem far definitely would recommend high performance build isnt expensive
5.0,"Aug 1, 2023 11:31 AM",got sale early july wa able pick store week purchase working great
5.0,"Apr 22, 2022 10:32 PM",processor great run cooler series amd gaming least get very hot mce enabled multitasking benchmark play game dont like amd very well
5.0,"Oct 4, 2023 2:53 AM",bought brother pretty awesome speedy
5.0,"Aug 5, 2023 5:41 PM",work great havent problem havent run game couldnt run
5.0,"Jul 22, 2023 12:54 AM",intel processor top tier plenty juice overclocked plenty juice
5.0,"May 6, 2022 3:59 PM",great product got sale made purchase even worth havent problem havent gotten near cpu usage even using high demanding game
5.0,"Apr 22, 2022 5:18 PM",bought new pc build easy install making sure motherboard pin order able apply thermal paste cooling easily nice gaming work need
5.0,"Dec 2, 2022 4:25 AM",fast work great lot speed test comparison th gen definitely out performs
5.0,"Nov 13, 2022 3:45 PM",fast reliable run cool performance needed relatively cheap definitely must buy
4.0,"Feb 7, 2024 10:46 AM",work great
5.0,"Sep 10, 2022 5:25 PM",cpu work great super fast didnt really want pay latest greatest mainly found increase add price cpu one thing watch out no cooling fan package buy one get cpu fan different part number personally even though cost buy fan separately believe noctua cooler got work much better anything intel provides
5.0,"Sep 9, 2022 11:18 PM",great performance price point always try go chip right below top chip great bang buck
5.0,"Jan 22, 2022 12:34 PM",first time long history building computer year decided brave jump new platform right launch didnt get ddr motherboard pair dont feel like spending stupid amount very iffy increase performance think truly massive step forward intel first time long time good ol processor war going amd intel came x cinebench r score nearly doubled saw decent increase fps cpu limited game dont real production work cant speak aspect sure chip sufficient whatever may throw honest gaming thing lot overkill would rolled k managed get good deal sale elephant room thing powerful power hungry well running synthetic benchmark cpu pull easily w make sure running mm aio very good air cooler keep cool plan hitting core power efficient under max load chip not gaming load much reasonable wa seeing le half wattage playing halo infinite forza horizon excellent time pc enthusiast chip shortage gpu pricing not withstanding alder lake intel need pathetic showing rocket lake life long amd guy k move amd
5.0,"Jan 28, 2022 4:20 PM",great processor price performs good k would recommend flagship k since sizing money onpar performance
5.0,"Jul 6, 2023 10:07 AM",becasue dont crap around fantastic dependable cpu
5.0,"May 30, 2023 11:58 PM",best cpu ive used type money super stable comparison red team
5.0,"Jul 31, 2023 2:45 PM",solid beast great cpu series gpu
5.0,"Oct 21, 2022 3:20 PM",k powerhouse allaround great chip huge upgrade previous thgen chip
5.0,"Jul 8, 2023 3:20 AM",very reasonable price ik very easy install
5.0,"Feb 8, 2023 7:27 PM",good value got price match super fast
5.0,"Oct 24, 2022 11:56 PM",good cpu price got mine sale completed computer run amazing
5.0,"Jan 14, 2022 6:16 PM",buy cheaper majority predecessor out performs th significant margin buy already
5.0,"May 11, 2023 1:27 PM",product work perfect no problem packaging ship
5.0,"May 12, 2023 4:04 PM",currently running pc ive no issue great cpu
5.0,"Aug 12, 2022 3:55 PM",great price very fast cpu would recommend family member friend
5.0,"Aug 5, 2022 7:04 PM",excellent processor scheduler compatible best choice
5.0,"Nov 30, 2022 7:26 PM",good deal work exceptionally well super fast
5.0,"Jun 10, 2022 3:38 PM",really good cpu money got sale overall value great performance
5.0,"Dec 19, 2021 2:42 PM",k intels comeback perfect choice gaming no need get expensive k either
3.0,"Jan 25, 2024 8:33 AM",overpriced th gen support ddr speed mediocre value ddr future therefore get th gen bit money much better performance
5.0,"Jul 30, 2022 10:59 AM",very fast worked perfectly great value price matching
5.0,"Mar 25, 2022 4:23 PM",think might best value cpu intel right gaming least better value compared ik delivers comparable performance le doesnt heat much cpu im cooling ik noctua nhd chromaxblack paired cpu nvidia rtx fe combination fantastic highly recommend cpu
5.0,"Feb 16, 2022 10:40 AM",smokin fast lil chip unlike th gen guy handle overclocking didnt get deep core running ghz mm aio couldnt handle long throttling started expect increase performance feasible single thread score passmark wa thats increase k mm cooler recommended overclocking
5.0,"Dec 9, 2021 7:50 AM",wanting upgrade k amazing cpu intel managed make cpu worth upgrading finally assumption th bottlenecking rtx right ive managed get average fps warzone sometimes even see fps ive never seen
5.0,"Jun 10, 2022 4:19 PM",happy speed run cool not overclocked yet
