Rating,Date,Review
5.0,"May 13, 2022 3:33 PM",great value performance get out purchased discounted price bestbuy highly recommended
4.0,"Sep 6, 2022 1:18 PM",integrated graphic useful troubleshootin pc core unlike amd counterpart run faster old ryzen use perfomance matched exceeds especially great sale got
5.0,"Nov 7, 2021 1:11 PM",got super happy monster im lucky lot lot lol
4.0,"Dec 23, 2022 10:13 AM",unfortunately bought right th gen release paired ti performance great right out box added benefit integrated graphic bios pricey id probably go amd value
5.0,"Oct 10, 2022 11:02 AM",installation wa flawless fired new build ran beautifully
5.0,"Dec 25, 2022 8:40 PM",doe come cpu cooler no couldnt see
5.0,"Feb 12, 2022 9:28 PM",intel ik not make disoppointed very smooth running intel one favorite band
