Rating,Date,Review
5.0,"Nov 21, 2022 12:00 PM",chip good run like champ god bless
5.0,"Feb 6, 2024 7:34 AM",intel core iks powerhouse boasting core thread speed ranging ghz impressive ghz turbo installation straightforward making accessible even new building pc performancewise incredibly fast handling demanding application multitasking ease ideal gamers professional looking toptier performance
3.0,"May 2, 2022 9:51 PM",pricey best performance out wa lucky enough get sp asus silicon rating system above average chip compared k already wasnt enough justify cost achieved exactly bin better mhz overall using arctic liquid freezer ii mm aio sp k day day use core v core thermal throttled oblivion core stage need custom water potential delid tame heat output say core clock single cb run gaming wa nice see really made no real world difference gaming slight benefit versus k compile time chip youre new buyer want absolute best best cost no object dont mind lot power consumption heat potentially manage one youre benching overclocking proper cooling tame least try monster chip definitely cutting edge state art fastest consumer cpu market hand want save little coin give cooler fan break quieter running system run cooler get thing running slightly slower get k even better k game
5.0,"Dec 29, 2023 8:13 PM",fast reliable love playing game awesome graphic
5.0,"Jun 16, 2022 11:44 AM",sample asus sp score p core e core using ai overclock aio core ghz core ghz temp stay within intel spec mhz cl ram overclock going buy k mine well get good sample k none close k term ks mid range fastest chip next month dont buy cant easily afford especially come computer part
5.0,"Sep 9, 2023 8:44 AM",run need exceptionally well got sale
5.0,"Jun 16, 2023 8:58 PM",excellent performance however need watercooler least one mm radiator
5.0,"Aug 18, 2023 9:58 PM",great item bit overkill youre going gaming however someone spends lot time thing like adobe creative cloud general lot different thing happening computer very powerful chip testify regular person going need heatwise very good average degree celsius normal use reference corsair aio cooler might get hotter standard fan speaking fan doe not come stock cooler youre building pc dont cooler youll probably shell out little installation simple get
5.0,"Jan 29, 2023 9:54 PM",very happy speed turned voltage cpu wa able keep unit cooler degree celsius not suffer blue screen issue full load playing game frame per second believe stock setting wa volt reduced volt understand safely modify also suggest not clock cpu even though plenty educational video available youtube topic intel model cpu
5.0,"May 26, 2023 1:20 PM",go well asus motherboard overall happy
5.0,"Nov 8, 2023 12:52 AM",use pc digital art rendering work flawlessly
5.0,"Oct 8, 2023 12:39 PM",easy install very fast great product got sale
1.0,"Nov 16, 2023 8:54 AM",bought received march opened box pc build month later november instead k box celeron g never even heard processor google box appeared factory sealed cant tell item wa tampered previously sold returned resold new open everything buy best buy immediately dont get scammed
5.0,"Feb 27, 2024 11:45 AM",revitalized computer night day difference
5.0,"Jan 19, 2024 5:07 PM",top tier central processing unit high end gaming requirement
5.0,"Dec 9, 2023 7:33 AM",great value great performance sale price bought
4.0,"Feb 13, 2023 8:03 PM",great leo wa money pared hard drive
5.0,"May 27, 2022 3:37 PM",awesome processor
5.0,"Jan 22, 2023 2:32 PM",no issue visible problem processor run computer advertised
5.0,"Jun 10, 2022 4:15 AM",good price described easy overclock easy installation work expected
5.0,"Jul 15, 2022 3:49 PM",good product exactly im acostumes nothing alarmed
1.0,"Dec 21, 2022 1:16 AM",switch out th gen due overheating
5.0,"Jul 29, 2023 3:41 PM",intel core iks th generation processor excellent addition system remarkable performance gaming productivity task exceeded expectation youre power user looking uncompromising performance futureproofing core iks definitely worth considering
