Rating,Date,Review
5.0,"Oct 28, 2022 11:27 AM",purchased processor build new pc wife currently ik setup issue running hot custom cooling almost par no overheating issue standard aio
5.0,"May 13, 2022 5:43 PM",blazing speed dirt cheap price hot fire
4.0,"Sep 3, 2023 10:22 AM",good cpu cost good overclock performance value cost
5.0,"Dec 16, 2022 9:38 PM",one best processor ever made fast reliable sharp image excellent color system never heat very reliable processormy computer operates higher level exspected life hype
4.0,"May 7, 2022 3:25 PM",superb fast cpu reasonable pricebut puppy run warm trade blow x amd cpu feel faster even though benchmark say otherwise
5.0,"Nov 9, 2021 12:56 PM",came k ran battery test converting k cinebnech r gave percent increase k doe run hot though watt tdp level noctua u correct mounting hit c cinebench test said doe run around c game mm aio waiting bracket advise get very good cooler enjoy beast
5.0,"Jul 11, 2022 7:03 PM",best cpu ive owned date sure k wa better price k difficult beat should get long time out one reminiscent old k long term value keep cpu long time
5.0,"Jul 8, 2022 12:47 PM",one best cpu buy time lot performance paired bad boy no performance issue whatsover cpu power hungry tho suggest undervolting sure get hot
5.0,"Jun 24, 2022 4:09 PM",looking perfect cpu intense gaming dabbling multithreaded apps every cpu way le close performance overclocks easy get little toasty
5.0,"Dec 24, 2021 5:06 PM",very powerful cpu money especially get one sale havent built new system ten year difference massive get everything together brings ddr fact still can not find also z motherboards expensive
5.0,"Aug 26, 2022 4:31 PM",thing absolute beast thermal really arent bad people say th gen mm aio mine cap out around running kombustor usually low game depending cpuheavy idle typically low granted dont truly overclocked yet xtus auto overclock added mhz still next nothing make thing even begin break sweat usage game max around game thatd put old kf start causing frame drop overall cpu monster mine passmarked k out box frame drop overloaded cpu since ive made upgrade absolutely recommend
5.0,"Feb 5, 2023 4:11 PM",great cpu higher end pc perfect match rtx great temp using cpu contact frame top c intel etu max stress test
5.0,"Mar 3, 2023 10:45 PM",got decent price since th gen processor come out beast processor great price
5.0,"Jul 25, 2022 5:16 PM",nice update th gen core processor even though base clock speed not much different boosted photoshop performance close time dont get brush lag big file anymore
5.0,"Nov 2, 2022 1:39 PM",wa able puck day csme out got cheaper price listed run game super smooth issue doe lile get hot time
5.0,"Mar 17, 2022 1:31 AM",k very impressed glad made choice not gaming seemed get enough help dont think game utilize core hope silicon lottery luck prime
5.0,"Nov 11, 2022 5:38 PM",great processor upgraded ik definitely noticed performance boost game rust pubg minecraft would definitely recommend
5.0,"Nov 29, 2022 10:30 AM",great reliable cpu wa first time building pc year using apple computer performance out world
5.0,"May 7, 2022 3:01 AM",purchase online didnt come time went big box store purchase one best processor made intel decent price super fast lot processing core ghz
5.0,"Nov 26, 2021 12:45 AM",first time building pc cpu run game program really well performance core handle game really well efficiency core handle background task
5.0,"Sep 13, 2022 9:48 PM",great chip great price wa able price match thanks helpful rep loved since installed pc recommend decent price
5.0,"Jun 18, 2022 1:56 PM",awesome product easy overclock want left mine standard clock end low end gaming play game cpu rock
5.0,"Oct 15, 2022 9:39 AM",since ik desktop running well without issue powerful enough support gaming day out
5.0,"Dec 17, 2021 4:23 PM",significant performance jump single core due new architecture multi core thanks extra e core no need get gaming general use even productivity unless specific requirement
5.0,"Nov 21, 2021 3:04 PM",intel back tech behind cpu first time desktop world intel changed since show finally intel back top chart again hope trend continues intel amd alderlake cpu one buy right dont need ddr board looking top tier gamingworkstation pc might change future right cpu get
5.0,"Feb 16, 2022 11:47 AM",great cpu price waiting year upgrade k finally good reason go generation jump people wanted see great work intel
5.0,"Aug 24, 2022 7:10 PM",great cpu absolute gaming beast plan streaming cpu great plan gaming save buck get
5.0,"Jan 27, 2023 10:56 AM",gaiming chip pretty awesome amd time got price wa even better
5.0,"Nov 17, 2021 3:13 PM",coming gen amazing upgrade
5.0,"May 4, 2022 7:27 PM",great processor chomp anything throw max thread score dmark cpu profile test old k score comparison
5.0,"Mar 21, 2022 7:07 AM",great processor provided intel originally opted get best buy wa able price match competitor got no issue far run very fast
5.0,"Feb 23, 2022 5:41 PM",great value th gen lineup k faster also much hotter running expensive get performance want better value
5.0,"Oct 29, 2022 8:36 AM",good processor gaming want intel not feel like paying premium k k
5.0,"May 20, 2022 4:28 PM",work advertised great cpu very small performance increase almost markup youre fence gaming go one
5.0,"Apr 17, 2022 9:37 AM",performance fantastic upgraded ryzen x multithreading performance cpuintensive task video transcoding awesome
5.0,"Mar 24, 2022 4:33 PM",processor cool efficient using simple air cooling noctua dh very large air cooler know temperature tend stay maybe low under very heavy load cpu done everything ive asked without issue without need overclock real downside new form factor compatible motherboards fewer therefore expensive also sure cooler necessary part fit new form factor not may purchase conversion kit cooler ensure fit properly
5.0,"Apr 29, 2022 7:31 PM",went wa hard find k enough anything getting fps csgo valorant p impressive cpu
5.0,"Apr 26, 2022 12:36 PM",wow cant believe performance uplift k can not wait get faster ram see far really go im stuck mhz right
5.0,"Nov 20, 2022 6:55 PM",work amazing new gaming computer build pair asus z tuf gaming motherboard
5.0,"Mar 7, 2023 6:58 PM",very powerful cpu price point definitely recommend
5.0,"Mar 4, 2022 7:34 PM",insanely fast eats anything feed keep going definitely feel able use cpu quite time without needing upgrade
5.0,"Feb 21, 2023 7:53 AM",super fast powerful use aio cooler though get hot
5.0,"Apr 25, 2022 4:39 PM",upgrading f great extra performance really useful very fast run game alot fps
5.0,"Feb 12, 2023 2:06 PM",fast efficient cpu easy install performs expected
5.0,"Nov 13, 2021 2:18 AM",excellent pricing comparison website anybody building new rig option buy intel series amd series term cost performance intels new alderlake cpu much better wait bit longer wait cheaper motherboard option
5.0,"Sep 28, 2022 5:19 PM",decent chip no complaint im able play pretty much new released game out right
5.0,"Jan 20, 2023 5:20 PM",son wa happy improved gaming pc smile day
5.0,"Feb 4, 2022 4:09 PM",hit sweet spot th gen sure run window win doesnt recognize power core efficiency core
5.0,"Dec 11, 2021 9:24 AM",best bang buck thing beast make sure buy plan upgrade window way use new scheduler
5.0,"Jan 29, 2023 8:39 AM",very powerful ive no issue intel cpu
5.0,"Dec 5, 2021 12:26 PM",fitnessgram pacer test multistage aerobic capacity test progressively get difficult continues meter pacer test begin second line start running speed start slowly get faster minute hear signal beep single lap should completed time hear sound ding remember run straight line run long possible second time fail complete lap sound test test begin word start mark get ready start
5.0,"Mar 30, 2022 9:57 AM",great upgrade compared previous ik extra sweet got great deal due price match microcenter
5.0,"May 4, 2022 4:39 AM",intel great job gen core processor codenamed alder lake improvement front energy efficiency single multi thread performance pcores ecores nicest feature laptop desktop bit controversial need switch window ecores work properly particular k best solution gamers content creator really impressed performance boost th gen comet lake
5.0,"May 1, 2022 11:33 AM",fantastic processor would say worth price k least goal gaming
5.0,"May 29, 2022 8:20 PM",great speed light gaming upgraded wa choked out gpu maxed out
5.0,"Apr 18, 2022 7:52 AM",great cpu very fast gaming production work load k bumped fps game
5.0,"Nov 11, 2022 5:36 PM",built first pc price wa get
5.0,"Jun 17, 2022 8:30 PM",great chip worked great advertised speed opinion much better option
5.0,"Oct 29, 2022 7:58 AM",perfect pretty much game relese nowadays
5.0,"Apr 23, 2022 11:23 AM",great cpu blazing fast gaming highly recommend kf switched k added feature
5.0,"Oct 14, 2022 6:02 PM",would recommend great value doe suppose no complaint
5.0,"Jun 3, 2022 3:41 PM",great purchase love far good wish didnt minimum amount letter review
5.0,"Aug 19, 2022 7:52 PM",killer performance turned still keep reasonable temp aio cooler
5.0,"Mar 4, 2022 9:45 PM",really solid option wa running ik wanted switch z no need doe job
5.0,"Aug 21, 2022 11:45 AM",say cpu definitely powerful previous
5.0,"May 9, 2022 1:01 AM",great poweful cpu plenty room overclocking supporting latest generation technology
5.0,"Sep 4, 2022 3:17 PM",fast work great packaging wa bit messed product wa fine
5.0,"Mar 8, 2022 6:17 PM",fantastic cpu thats balanced price v performance processing bandwidth work play
5.0,"Oct 2, 2022 3:40 AM",amazing product exactly needed great
5.0,"Mar 23, 2022 9:11 AM",thing nice happy went item instead step back intel keep getting better
5.0,"Mar 27, 2022 8:02 AM",absolutely great processor definitely handle older game majority newer one
5.0,"Apr 10, 2022 11:25 AM",chose amd due compatibility program good cpu cant go wrong
5.0,"Aug 5, 2022 5:27 PM",make computer faster expected unless going another upgrade
5.0,"Sep 17, 2022 12:15 PM",purchased sale best bang buck processor
5.0,"Apr 29, 2022 5:48 PM",intel finally fighting back amd cpu monster eats everything throw fast
5.0,"Sep 12, 2022 9:11 PM",upgraded k major improvement p gaming
5.0,"Feb 11, 2022 7:41 PM",wa upgrade finally k wa waiting part returned got instead
5.0,"Oct 23, 2022 12:09 AM",processor fast like
5.0,"Aug 13, 2022 12:02 AM",great cpu gaming paired ti gb ram
5.0,"Mar 11, 2022 3:56 PM",k beast price point pair ddr ram youll running
5.0,"May 28, 2022 10:49 AM",love cpu got oc cooler temp even under load stay under c
5.0,"Jul 29, 2022 4:36 PM",awesome processor gaming disabled ecores reduce heat output
5.0,"Apr 9, 2022 4:51 PM",upgraded pc run lot faster old x even limited lower wattage
5.0,"Mar 2, 2022 9:02 PM",powerful run low temp custom watercooling loop overall im happy purchase
5.0,"Jan 21, 2022 4:10 PM",work extremely well gaming streaming well photo editing need beefy cooler though
5.0,"Dec 4, 2021 1:39 PM",amazing ipc improvement blow ryzen x out water really amazing streaming x
5.0,"Jul 1, 2022 4:21 PM",doe job even smoothly editing p resolve rtx
5.0,"Mar 25, 2022 4:11 PM",pc gaming processor king need pc gaming year come
5.0,"Sep 11, 2022 8:25 AM",coming k cpu beast upgraded due lagging modeling watching cpu spike usage wa not fun never see cpu utilize temp stay good even air cooling anything bmw bench doe stress temp mc attached though
5.0,"Sep 7, 2022 8:24 AM",great processor performs well met bneeds
5.0,"Jun 18, 2022 10:27 PM",lot faster old surprised stock
5.0,"Feb 4, 2022 5:00 PM",core ik sweet spot cpu plus best buy price matched keep shopping
5.0,"Jul 2, 2022 6:13 PM",wa originally going get w version timing convince out grabbed usual upgrade process take month cpu along upgraded mobo ram noticeable speed increase previous system surprised even old performance game apps roof
5.0,"Feb 15, 2022 10:00 PM",great processor money turbos ghz capability great playing game
5.0,"Sep 5, 2022 1:17 PM",incredible performance highly recommend cpu
5.0,"Apr 25, 2022 1:20 PM",intel thing buy fantastic speed run colder thought
5.0,"Jun 4, 2022 6:59 AM",love fast lightning doesnt overheat like big brother
5.0,"Aug 19, 2022 3:32 PM",amazing intel product recommend gaming
5.0,"Apr 6, 2022 10:50 PM",recommend liked product lot cant wait test out even
5.0,"Apr 4, 2022 5:24 PM",thing thump super fast responsive really like lot
5.0,"Jul 15, 2022 6:16 PM",fast overclock make computer run very nice
5.0,"Jun 14, 2022 6:37 PM",processor fast work stated shipping wa fast well
5.0,"Jun 14, 2022 11:48 AM",perfect mi need game pc cpu job
5.0,"Jun 28, 2022 11:47 PM",got processor sale work perfect gaming
5.0,"Jul 8, 2022 8:03 PM",quite honestly similar ik performancewise
5.0,"Apr 29, 2022 3:37 PM",build new pc work went processor speed
5.0,"Apr 14, 2022 1:22 AM",awesome product built gaming pc addition excellent
5.0,"Jul 20, 2022 6:07 PM",great new build perfect gaming
4.0,"Apr 15, 2022 4:33 PM",little pricey under synthetic load render very well paired corsair hi elite caplelex idle degree under load doesnt break easily get ghz out chip cooling right
4.0,"Jan 27, 2022 10:49 PM",planned getting ryzen next build reading review fact integrated graphic convinced otherwise system booted no issue fun definitely can not go wrong processor
5.0,"Jun 1, 2022 11:10 AM",almost bought amd processor im glad not
5.0,"Dec 4, 2021 1:45 PM",solid great not care power consumption win
5.0,"Apr 4, 2022 3:29 PM",upgraded k difference shocking
5.0,"May 6, 2022 3:31 PM",k super fast intel th gen worth buying
5.0,"Mar 26, 2022 6:15 PM",provides top notch performance without maximum heat load
5.0,"Jul 29, 2022 5:46 PM",k althought wa still good performing cpu could tell wa aging little window know not everyones cup tea requiring modern cpu decided upgrade performance boost wa extremely noticeable actually enjoy running window
5.0,"Jan 28, 2022 4:46 PM",great processor work great price compared k
5.0,"Apr 15, 2022 7:57 PM",cpu idk say doe job fast ball
5.0,"Dec 17, 2021 8:36 PM",coming th gen processor one heck upgrade
5.0,"Nov 12, 2021 4:33 PM",intels th gen huge improvement previous th gen offer core literally msrp plus support new connectivity like pcie ddr cant wait complete build rtx
5.0,"Jan 16, 2023 10:49 AM",mean intel know youre getting obviously comparable r make sure know type motherboard may need term cpu
5.0,"Feb 12, 2022 4:42 AM",beast make x look stupidly overpriced
5.0,"Jan 10, 2022 3:22 PM",great product fair price very use learn use
5.0,"Jan 26, 2023 5:55 PM",initially wa going purchase th gen seeing price drop buy super fast cpu allows video editing game no issue
4.0,"Feb 26, 2022 7:54 AM",super fast cost much th gen however finding part cooler troublesome somewhat expensive still great overall well worth price
5.0,"Sep 25, 2022 5:33 PM",great cpu far doesnt get hot build aio cooler could probably gotten away k figured buy extra year need upgrade
5.0,"Feb 13, 2023 12:59 AM",paired processor quite pro resulting super combo handle running multiple heavy apps ease
5.0,"Dec 6, 2021 4:51 PM",upgrading youll need new mobo maybe heatsink use win best performance due different type core power efficiency like phone p e k win doe not support intel thread director
5.0,"Feb 8, 2023 7:34 AM",wa brother computer assume working well doe yell play game
5.0,"Feb 17, 2023 11:39 PM",worked fine out box existing pc used work game steadily no issue
5.0,"Nov 7, 2022 11:25 PM",really good cpu ended buyin gthe ikf bottlenecking gpu thing great
5.0,"Jan 30, 2022 11:29 PM",upgrading skylake ik alder lake wonder although z motherboard expensive cpu still worth considering amount feature available
4.0,"Jul 20, 2022 2:23 PM",work well gaming very pleased glad got sale
5.0,"Jul 8, 2022 2:02 PM",new computer running smooth cpu run many application including several instance visual studio no issue
5.0,"Oct 22, 2022 12:26 PM",cpu load wa idle upgraded th gen cpu load k idle
5.0,"Mar 10, 2022 11:58 PM",super easy install didnt worry bending pin wa used first pc build ever huge improvement old used
5.0,"Feb 4, 2023 9:08 AM",work perfect rtx ti youre worried bottlenecking wont
5.0,"Sep 4, 2022 2:34 PM",monstrous performing cpu easy install run well aio cooler simple install forget
5.0,"Apr 12, 2022 4:46 PM",paired asus z rtxti pc disturbingly fast fantastic fps gaming stay nice cool thanks corsair hi capellix
4.0,"Mar 11, 2022 5:23 PM",very good far go ultimately went alder lake model
5.0,"Dec 31, 2022 1:19 PM",easily oc doesnt get hot pair artic freeze cooler enjoy gaming
5.0,"Feb 4, 2023 10:07 PM",cpu probably enough havent problem
5.0,"Dec 24, 2021 8:58 PM",th gen intel desktop processor fast make th gen intel desktop processor not worth trouble purchase no problem noted th gen intel desktop processor
5.0,"Jan 6, 2023 4:30 PM",bought son love work advertised satisfied gamer
5.0,"Jan 4, 2022 6:44 PM",awesome cpu needed new heatsink shape new th gen cpu different previous generation cpu overall im happy purchase
5.0,"Feb 25, 2023 8:24 AM",great tv money fast setup time easy use
5.0,"Feb 24, 2023 5:04 PM",work great get quality expect intel
5.0,"Dec 22, 2022 12:19 PM",ive cpu month gladly say satisfied
5.0,"Dec 23, 2022 4:05 PM",intel processor wa best selection cost saving processor
5.0,"Jan 21, 2023 2:27 PM",work great id buy again another build east install
5.0,"Jan 1, 2023 9:41 PM",great item approved grandson received christmas
5.0,"Jan 4, 2023 6:48 AM",yay son love impressed no complaint yet
5.0,"Sep 30, 2022 3:48 PM",cpu very fast single core performance decent multicore performance well
5.0,"Apr 8, 2022 4:05 PM",great purchase bought boyfriend he enjoying benefit nice upgrade chip used last year
5.0,"Mar 11, 2022 8:18 PM",intel back again getting beat amd past two year intel finally showing u great cpu competing price
5.0,"Dec 14, 2022 11:21 AM",purchased holiday got great deal great processor
5.0,"Feb 8, 2023 9:09 PM",no issue huge upgrade
5.0,"Dec 18, 2022 2:32 AM",super fast above ghz allcore aircooler thing fly
5.0,"Dec 10, 2022 12:15 PM",best processor ive owned awesome future proof worth every penny
5.0,"Jul 11, 2022 7:42 PM",great cpu option want build great pc strict budget definitely worth buying
5.0,"Aug 8, 2022 7:58 AM",cpu sweet right out gate couple switch flipped bios good go
5.0,"May 12, 2022 12:10 AM",must anyone looking build new gaming computer intel nailed relelase
5.0,"Nov 2, 2022 8:53 PM",cant wait build new pc cpu new ti
5.0,"May 13, 2022 3:50 PM",havent build pc yet soooo excited everything out stock wa happy find part
5.0,"Aug 27, 2022 6:47 AM",great cpu work well application not gaming flight sims
5.0,"Apr 16, 2022 2:47 AM",new intel cpu nice upgrade previous generation although chip run bit hotter time around
5.0,"Dec 14, 2022 8:38 AM",nothing time im well please item
5.0,"Apr 10, 2022 12:46 AM",price good difference k almost half price no brainer imo
4.0,"Nov 19, 2021 12:16 PM",excellent performance huge upgrade old processor
5.0,"Oct 8, 2022 7:13 AM",used workgaming pc handle everything need quickly
5.0,"Dec 16, 2022 10:49 PM",upgraded absolutely love new cpu
5.0,"Aug 27, 2022 11:18 PM",cpu used go task manager playing game doesnt
5.0,"Oct 28, 2022 5:39 AM",grest cpuvery powerfullpair rth work great
5.0,"Sep 9, 2022 12:26 PM",intel out box still make super user friendly good
5.0,"Feb 9, 2022 7:53 AM",th gen much better th faster run cooler need window get cors work probably
5.0,"Jun 17, 2022 3:54 PM",easy install work fantasticly custom setupcan run elden ring soo woot woot
5.0,"Mar 18, 2022 3:42 PM",solid processor everyday use work play highly recommend using window th gen
5.0,"May 31, 2022 2:32 PM",work much better mac glad built computer blindingly fast
5.0,"Apr 17, 2022 10:47 AM",would recommend anyone building pc make sure get right motherboard lga
5.0,"Jul 3, 2022 12:48 PM",no problem far installation operation first two month use
5.0,"Feb 24, 2022 7:09 PM",good cpu avoid paying one out budget consider k
5.0,"Jan 23, 2022 11:20 AM",great cpu easily run doe tend heat buy good air cooler aio liquid cooler
5.0,"Jul 1, 2022 10:14 PM",great cpu fast power boost needed exceeded expectation
5.0,"Dec 3, 2021 3:45 PM",thing awesome ready new size lot current part no longer compatible research
5.0,"Mar 18, 2022 10:22 PM",wanted cpu gaming exceeded expectation run cool isa overclockable
4.0,"Sep 24, 2022 10:42 AM",built workstation pc cpu typically keep multitasking sometimes cause awful latency problem plan building rendering workstation go k least
5.0,"Oct 2, 2022 3:40 PM",best bang buck moment writing review
5.0,"May 4, 2022 2:50 PM",upgraded k much much better paired asus prime z
5.0,"Oct 22, 2022 1:11 AM",great price awesome speed overall great quality
5.0,"Sep 21, 2022 3:26 PM",great processor mid tier gaming pc recommend
5.0,"Jan 2, 2022 10:39 PM",definitely good price per performance v k get extremely hot not much better
5.0,"Apr 16, 2022 10:15 AM",easy install no issue far definitely outperforms adm processor replaced
5.0,"Sep 30, 2022 4:14 PM",exactly needed least afford
5.0,"Feb 11, 2022 4:54 PM",great processor honestly intel kinda snuck out really under appreciated
5.0,"May 28, 2022 1:22 PM",wait time wa good decision great performance
5.0,"May 23, 2022 8:32 PM",not top top line pretty good bang buck rec
5.0,"Sep 20, 2022 2:06 AM",no issue would purchase again needed
5.0,"Aug 2, 2022 12:02 PM",amazing product exactly needed super great
5.0,"May 23, 2022 3:41 AM",th gen intel enough core allow smaller productivity work
5.0,"Mar 3, 2022 4:01 AM",glad could take time look everything got help get product
5.0,"Jul 29, 2022 4:10 PM",bruah best storage gaming rig hand awesome
5.0,"Apr 29, 2022 3:59 PM",k great processor hopefully future proofing built
4.0,"Jan 20, 2023 7:28 AM",alot trouble trying price match product went price day bought best buy very disappointing
5.0,"Mar 2, 2022 4:06 PM",great product super fast core no issue would recommend anyone
5.0,"Mar 6, 2022 8:50 AM",great product upgrading k smoother overall experience
5.0,"Jun 8, 2022 4:09 AM",doe thing ive never problem intel
5.0,"Jan 14, 2022 4:54 PM",newest latest greatest thing havent got alot play time love far
5.0,"May 13, 2022 7:37 PM",excellent price performance ratio run great no complaint
5.0,"Apr 8, 2022 7:42 PM",good product meet expectation advertised specification
5.0,"May 23, 2022 2:07 PM",great cpu best kind run like beast every game
5.0,"Mar 25, 2022 4:39 PM",top line cant get better one right
5.0,"Jun 14, 2022 8:13 PM",cpu crazy get youre building pc
5.0,"May 27, 2022 3:48 PM",awesome no issue highly recommend
5.0,"Feb 12, 2022 7:40 AM",work excellent love product no problem oc easy
5.0,"May 1, 2022 2:55 AM",fast reliable installation wa easier amd
5.0,"Jan 19, 2022 12:14 PM",built first ever gaming computer wa backbone
5.0,"May 7, 2022 9:35 AM",great product work great new pc build
5.0,"Nov 5, 2021 8:14 AM",cant beliebve wa able buy online release date very happy
4.0,"Mar 9, 2022 11:22 PM",good cpu didnt notice much difference switching ryzen x not much upgrade returning chip
5.0,"Feb 5, 2022 3:13 PM",love far first pc build im glad booted
5.0,"Mar 3, 2022 6:17 PM",overclocked cpu deliver power need
5.0,"Jan 16, 2022 2:36 PM",very good worth price much better amd x
5.0,"Dec 31, 2021 5:03 PM",got item good discount using code gift card
5.0,"Jan 7, 2022 10:44 PM",havent used yet came fast good shipping box
5.0,"Feb 11, 2022 4:21 PM",best processor intel made long long time
5.0,"Feb 5, 2022 10:41 AM",great cpu overclocked running stable
5.0,"Dec 23, 2021 5:07 PM",great no issue cant wait use recommend
5.0,"Dec 5, 2021 4:36 PM",love intel better amd buy love love
4.0,"Aug 30, 2022 3:46 PM",loving honestly no complains although make sure great good power supply power hungry
4.0,"Feb 3, 2023 3:35 PM",very good very very nice very easy no problem good day
4.0,"Feb 7, 2023 2:05 AM",first chip dont know difference
4.0,"Jan 23, 2023 10:01 AM",good product quality beyond expectation
4.0,"Jan 27, 2022 8:39 AM",returned mobo got couldnt get ddr ram want cpu get mobo take ddr ram goodluck
4.0,"Sep 23, 2022 3:55 PM",intel core processor great star not fast enough
4.0,"Mar 5, 2022 11:43 AM",wow thats lot core four previous one should four time fast
4.0,"Nov 21, 2021 11:35 AM",process excellent everything else needed expensive motherboard ram
4.0,"Mar 12, 2022 7:30 AM",wa looking new cpu one wa great
4.0,"Dec 26, 2021 8:45 AM",bought wrong product needed another processor
1.0,"Dec 3, 2021 3:54 PM",gave one star can not find ddr memory go best buy wa caught supply problem lot cpu chip no memory board can not evaluate right delivery price exceptional
1.0,"May 22, 2022 9:48 PM",cpu went out week shouldve invested amd
2.0,"Feb 25, 2022 4:59 PM",bought accident wa wrong place store sure work fine didnt fit computer returned got full refund allowing buy right one instead
2.0,"Jan 5, 2022 9:44 PM",run extremely hot compared amd setup intel need efficient design
5.0,"Jun 25, 2023 12:03 PM",today lineup tad better still good option want save buck k much k no need keep jones buy
1.0,"May 22, 2022 3:28 AM",received empty package no one handled
5.0,"Mar 29, 2024 4:24 PM",even without graphic card could play game fps
5.0,"Feb 1, 2024 9:38 PM",got processer best buy right time best price work excellent asus sonic motherboard build
5.0,"Mar 15, 2024 4:53 PM",price performance good get latest gen leap minimal
5.0,"Jun 28, 2023 9:53 AM",handle streaming gaming very well easy install
5.0,"Dec 15, 2023 4:17 PM",work good easy install truly pinnacle engineering design
5.0,"Jun 30, 2023 6:56 PM",easy install great value still great option gen processer super smooth
5.0,"Jun 24, 2022 4:04 PM",paired evga z classified board noctua nhds ran evga stress test hour temperature never exceeded degree purpose air good enough keep chip stable
