Product,Rating,Date,Source,Review
intel-i7-11700k,5.0,"December 18, 2023",amazon,benchmarked paired evga geoforce rtx ti score beat rig gpu later series cpu idle rig air cooling doesnt go beyond stress tested ive read people concerned idling rated withstand little warm high performing definitely worth sale price especially youre used spending around new cpu
intel-i7-11700k,5.0,"April 14, 2024",amazon,used ik cougar mx meshx case msi za pro atx motherboard didnt like price very satisfied
intel-i7-11700k,5.0,"April 11, 2023",amazon,great cpu computer boot faster monitor wake program open immediately run well side cpu eats watt produce quite bit heat case exhaust fan make noticeable noise keeping case cool said proper cooling easy keep cpu under c under heavy load mine run
intel-i7-11700k,5.0,"January 27, 2024",amazon,decided upgrade motherboard th generation k cpu kf bump overall performance well gen nvme ssd support took le time thought remove aio water cooling swap out gb ddr gb well installing tb gen ssd reassembled disconnected component powered back bios everything wa recognized playing nicely performed clean o install quite pleased outcome would definitely recommend motherboard upgrade path think happy
intel-i7-11700k,5.0,"April 1, 2021",amazon,k th gen sits well reviewed poorly priced k think price got prelaunch sale good product cheaper x performs very close lot fun overclock rocket lake th gen support specific core overclocks dial ratio two best core le hot core also take tad bit voltage skylake v load voltage supposedly safe according reddit ama although running slightly lower core clock comet lake improved ipc actually seems run slightly cooler power draw pretty nut stress test gaming load not bad wa seeing around w horizon zero dawnunless want highest overclocks still get pretty close above stock clock manual tuning without price premium similar real world performance coming ik gaming fps pretty similar uw p rocket lake seems much stable overclocking get watch dog bsod error dont not whea stuff ram gear stuff little overblown performance penalty running not bad see ryzen run very high speed ram looser timing get ton performance chip im enthusiast ive ryzen intel system enjoy tuning intel cpu glad one first review came day delivery happy overclocking everyone
intel-i7-11700k,5.0,"March 6, 2024",amazon,very good processor nothing wa wrong pc stronger
intel-i7-11700k,4.0,"April 25, 2022",amazon,draw back basically run very hot even idle compared generation stay c c ambient temp concede think may need adjust case fan speed get aggressively positive pressure airflow case however barely get much hotter under full load perhaps tuned fairly wellvalue ok bit lower th gen counterpart continually getting bit cheaper time still close enough price go th gen intel build would gone route wa pretty much limited choice mobo could go high th gen intel gen mbut amazing far term performance under load see build carrying year hope
intel-i7-11700k,5.0,"August 10, 2023",amazon,work well super blazing fast work internet dutiesgood value
intel-i7-11700k,5.0,"January 29, 2024",amazon,happy purchase
intel-i7-11700k,5.0,"April 14, 2021",amazon,medium could not loaded rate ufo user benchmark very good cpu anyone might wonder though not good gaming unless dedicated graphic card person answered question said wa great no video card gaming p lied way running rx gb right uhd tv low setting unless video card come back reasonable price again work fine game play not game need use powerful graphic great surfing web watching video stream otherwise advise find video card want game evergreat cpuupdate currently run cpu gb ddr rtx ti gb gb wdblack o drive tb game kw psu x cfm fan others cool system none ever need run air flow
intel-i7-11700k,5.0,"October 5, 2023",amazon,easy install msi motherboardand good money spent work great far no issue yet
intel-i7-11700k,5.0,"September 10, 2021",amazon,know lot negative review th gen intel chip far needed computer wa dying put chip asus board zero problem old graphic card dying week laterintel saved day cant play full steam library use good everything else normally without overheating slowdownsnow wait see graphic card go saleupdate ive going game far play name grim dawndivinity original sin trial mana book demon no separate graphic card far im concerned processor well worth moneya big thank intel helping u regular folk beat scalper let em choke triple priced card
intel-i7-11700k,5.0,"April 5, 2021",amazon,may sometime decided processor dont recommend required oven lot patience long story short delidding applying liquid metal dropped temp c ran way month selling friend hasnt issue yet eitherapril reason cpu shooting c moment stress test within le second causing throttle tremendously changed nothing reseated cooler thinking maybe shifted still didnt fix going check everything today maybe something changed bios reason cant fixed ill sending back warrantying itso far good ive able run ghz core quite get little warm nothing isnt manageable seems like star review people like comment thing dont
intel-i7-11700k,5.0,"April 10, 2023",amazon,great cpu using intended intel everything stock running watt use auto oc first used almost watt wa hotter disabling case asus motherboard asus performance enhancement temp under load c enabled hit mid didnt notice difference performance good cpuall core boost core ghz running advertised
intel-i7-11700k,5.0,"June 9, 2022",amazon,dont listen review youtube cu legendary cpu th gen k wa fastest gaming cpu market intel top impressive cpu pair right motherboard ram see full potential k month decided go back gen even though alder lake powerful since very new way many drawback high latency ram main reason decided sell think raptor lake would cpu gen tweak outperform alder lake
intel-i7-11700k,4.0,"May 19, 2023",amazon,must say might not high end cpu doe job pretty damn fine
intel-i7-11700k,5.0,"October 8, 2022",amazon,series coming out two step top procesor market wa published new line wa tested gh line becomes third choice poor cousinsthis processor still computes fine used need save money speed really not issue
intel-i7-11700k,4.0,"May 6, 2021",amazon,great gaming even tho amd beat multi core workload doesnt mean not good processor stable reliable processor best stock gaming trade blow ryzen x havent run bug glitch thats get intel stability gaming id say isnt way go wife doe work station application extra core reduce time id say niche processor very people would actually benefit extra core gaming go k daughter build running overclocked k trade blow one
intel-i7-11700k,5.0,"June 22, 2023",amazon,beast top hardware moment see true power processor
intel-i7-11700k,5.0,"July 19, 2023",amazon,cpu absolutely amazing yet get bog
intel-i7-11700k,3.0,"November 16, 2023",amazon,like product system half together others put together
intel-i7-11700k,5.0,"March 28, 2023",amazon,need use water aio least pc become oven timesbut plenty fast enough whatever need price finally started drop th gen
intel-i7-11700k,5.0,"May 21, 2021",amazon,first upgrade since generation ik fantastic chose asus z prime corsair capallex rm w psu learning curve overclocking since spent equally much ram mobo cooling worth every cent youll still need graphic running under geforce series perfermance gtx phenomenal intel entusiasts dream agree ignore one star review wont make ryzen comparison title believe amd le change opinion thread core nanometer winning doubt nonetheless intel back game
intel-i7-11700k,5.0,"May 21, 2021",amazon,wonderfully designed cpu want low power consumption low temp leave stock ghz boost designed make processor swiss army knife cpu overclocks allcore easily z motherboards yes run warm wanted excuse buy mm aio two core overclock desired probably could get pretty close open loop system score userbenchmarks like amd dont overclock well plus processor readily available retail price hate surrounding offering extremely misguided
intel-i7-11700k,5.0,"June 26, 2023",amazon,got discounted great upgrade
intel-i7-11700k,5.0,"March 8, 2022",amazon,rebuilding failed desktop computer buy new motherboard would not accomodate previous cpu chip researched core really wasnt faster enough spend extra cash onethis work great mostly photo editing video editing game run microsoft flight simulator run almost maximum setting
intel-i7-11700k,5.0,"August 23, 2022",amazon,despite stigma th gen cpu performance k definitely worth going scenario would say not recommended kk available close price case one would account additional cost z motherboards well ddr thats choice
intel-i7-11700k,5.0,"June 13, 2023",amazon,medium could not loaded no picture actual cpu build running great
intel-i7-11700k,5.0,"July 30, 2023",amazon,work expected
intel-i7-11700k,5.0,"June 8, 2021",amazon,love cpu paired z motherboard gen support must cpu also doe not sacrifice performance well also paired rtx system could not happier pinged ghz not let definitely much room overclock want nice cpu very stable think best value term price performance intel th gen lineup
intel-i7-11700k,4.0,"April 30, 2022",amazon,reason wouldnt allow unlock raid capability motherboard since model wa made tested someone el raid could enabled wouldnt buy look elsewhere expensive risk something like
intel-i7-11700k,5.0,"July 7, 2022",amazon,excelente cpu estaba preocupado por los comentarios en internet acerca de que calienta mucho pero casi lo tengo un me su temperatura base e de c c realizando tareas ni tan pesadas ni tan basicas nota no lo uso para jugar ni le hecho overclock pero va de maravilla
intel-i7-11700k,4.0,"February 3, 2022",amazon,lga platform recommendation high performance gaming cpu th gen essentially binned expensive version otherwise go k slightly lower single core performance physical core
intel-i7-11700k,5.0,"February 23, 2023",amazon,good product work perfectly build powerful enough probably needed want pc
intel-i7-11700k,5.0,"May 4, 2022",amazon,transport went okay wa afraid dent package cpu wa intact without damage seemscpu plugged working giving day warm want clock okay performanceall star
intel-i7-11700k,5.0,"April 9, 2023",amazon,kept game
intel-i7-11700k,5.0,"June 25, 2021",amazon,compared ik one provides much value integrated graphic decent enough light gaming game league legend provides nice backup graphic event gpu fails would definitely appreciate core pretty good upgrade previous th gen intel pc
intel-i7-11700k,5.0,"July 16, 2021",amazon,muy buen procesador quera esperar la generacin pero seria lo mismo porque despus querra esperar la generacin nunca comprare ninguno este para los juegos va de lujo por mucho tiempo le hice una prueba de esfuerzo multi core la temperatura maximo e de grados si eres una persona que le gusta jugar recomiendo este cpu
intel-i7-11700k,5.0,"July 14, 2021",amazon,bought k gaming rig water cooling ive got overclocked ghz core totally stable never get hotter c ti run game ive played max setting minimum fps k ultrawide much higher game including cyberpunk assassin creed valhalla
intel-i7-11700k,5.0,"October 19, 2021",amazon,price couldnt happier cpu absolute mammoth research spec order confidence cooled water pumpheat sync temp stay c idle increase steady c constant load great product great value
intel-i7-11700k,3.0,"June 6, 2022",amazon,supposedly brand new cpu saw orange scratch mark likely whatever plating wa slightly scratched expose copper surface dont think thats acceptable dollar cpu could buy xbox series x price got wa maybe used cpu wa run around ring time work disappointed quality thought mightve bought used cpu dollar
intel-i7-11700k,5.0,"September 12, 2021",amazon,core price amazing cpu without breaking wallet price used price quad core cpu want best bang buck not go amd ocs well run reasonable temperature excellent processor
intel-i7-11700k,5.0,"April 27, 2022",amazon,massive improvement ik run faster celsius lower temperature higher overclock additional core make useful productivity well gaming
intel-i7-11700k,4.0,"June 4, 2021",amazon,watched lot review chip say trash mean maybe older gen chip work well cheaper im averaging ghz playing warzone
intel-i7-11700k,4.0,"February 28, 2022",amazon,sure adequate cooling plan clocking nuf said
intel-i7-11700k,5.0,"May 2, 2022",amazon,e un procesador de nucleos el cual cumple en con diversas tareas yo lo compre para trabajar autocad revit dsmax
intel-i7-11700k,5.0,"July 21, 2021",amazon,great cpu work gaming need processor one top rated reason th gen paired drive unmistakably best youre looking great cpu function quickly
intel-i7-11700k,5.0,"May 27, 2021",amazon,installation wa breeze first place month not yet able get decent graphic card running old card doe not come close pushing cpu limit
intel-i7-11700k,5.0,"September 20, 2022",amazon,very fast response definitely worth
intel-i7-11700k,5.0,"February 13, 2022",amazon,quick little chip run little warm even mm aio watt good value sale since series launched
intel-i7-11700k,3.0,"April 4, 2021",amazon,cant say much better series smooth systembut major problem bought integrated graphic audio not get driver install intelits very annoying not graphic audiothanks intel screwing thing upediti ended getting old graphic card audio videoso probably wont trying integrated againeverything smooth system
intel-i7-11700k,5.0,"June 20, 2022",amazon,todo llego segn la compra en tiempo forma recomendable muchas gracias
intel-i7-11700k,5.0,"June 3, 2022",amazon,very nice cpu no problem whatsoever whether gaming everyday life use
intel-i7-11700k,5.0,"December 5, 2021",amazon,ill able use next year likely like k bought year ago still use today
intel-i7-11700k,4.0,"March 14, 2022",amazon,good cpu general desktop use
intel-i7-11700k,5.0,"April 9, 2021",amazon,solid single multicore gain previous generation no regret upgrading k due motherboard crash wait alder lake time otherwise good choice amd better stuff moment theyre unavailable andor sold way overpriced
intel-i7-11700k,5.0,"July 7, 2021",amazon,running cpu part complete system upgrade very happy overall performance graphic performance feature set add value great product
intel-i7-11700k,4.0,"March 6, 2022",amazon,work exactly expected
intel-i7-11700k,5.0,"June 15, 2021",amazon,bought minus gift card bank point wa around single core almost fast littler brother multithread appa running amazin around point cinebench r
intel-i7-11700k,3.0,"May 3, 2021",amazon,intel not much need said thermal good even standard air cooler im using coolermaster evo problem im onboard graphic get ton tearing graphical glitch web browsing never gaming overall small upgrade much cheaper th gen doesnt really give much upgrade
intel-i7-11700k,5.0,"December 20, 2021",amazon,cpu beast mode gaming performance high end computing reasonable price
intel-i7-11700k,3.0,"November 28, 2021",amazon,should stayed k dont see difference two dont waste money would return dont want take pc apart again thanks intel ripping
intel-i7-11700k,5.0,"August 1, 2021",amazon,replacing fourth generation cpu run much faster no problem installing running
intel-i7-11700k,2.0,"February 17, 2022",amazon,processor running hot cant cool even cooler master masterliquid ml mirror argb cpu liquid cooler rd gen tdp watt processor getting sometime watt passed test running hot celsius wa forced under clocking im frustrated without turbo running cool get ghz thats ive decided under clocking product review course not seller
intel-i7-11700k,5.0,"May 13, 2021",amazon,cpu work great super fast wa quite easy install highly recommend would not hesitate buying again
intel-i7-11700k,5.0,"May 19, 2021",amazon,upgraded k k average fps playing cold war warzone feel way smoother
intel-i7-11700k,5.0,"April 15, 2022",amazon,good processor no problem
intel-i7-11700k,5.0,"June 25, 2021",amazon,havent able test max pottential doe job least working better
intel-i7-11700k,5.0,"February 8, 2022",amazon,very good power house
intel-i7-11700k,3.0,"May 13, 2021",amazon,replaced year old doesnt seam much speed change joke year small improvement every day use ok user bench mark test show good improvement dont notice itso worth price no
intel-i7-11700k,5.0,"August 20, 2021",amazon,work well clocking wa learn go would recommend cpu though
intel-i7-11700k,5.0,"June 30, 2021",amazon,price went since purchased would still consider new cost
intel-i7-11700k,5.0,"September 9, 2021",amazon,amazing boost pc speed work very well msfs
intel-i7-11700k,2.0,"May 22, 2021",amazon,looking review please exit page look ryzens cpu bought k play around oc x gaming performance well low heat also le price side ryzen little harder put motherboard since pin not motherboard cpu not biggy buying product make sure overclock dont expect performance cheaper ryzen cpu
intel-i7-11700k,4.0,"June 13, 2021",amazon,better k
intel-i7-11700k,5.0,"July 8, 2021",amazon,fast reliable got ghz out box no oc
intel-i7-11700k,5.0,"August 10, 2021",amazon,value money general computer gaming
intel-i7-11700k,5.0,"May 22, 2021",amazon,todo bien por el momento espero que siga futuro
intel-i7-11700k,5.0,"May 8, 2021",amazon,plain outstanding easy overclocking rub exceptionally cool
intel-i7-11700k,5.0,"September 5, 2021",amazon,overkill processor gaming
intel-i7-11700k,5.0,"October 24, 2021",amazon,
intel-i7-11700k,5.0,"July 30, 2021",amazon,buen producto buena entrega
intel-i7-11700k,5.0,"July 12, 2021",amazon,fantastic chip
intel-i7-11700k,5.0,"June 9, 2021",amazon,item described
intel-i7-11700k,3.0,"August 3, 2021",amazon,benchmark run well ryzen x wellthe downside temperature
intel-i7-11700k,5.0,"May 30, 2021",amazon,work great
intel-i7-11700k,5.0,"May 2, 2021",amazon,work great
intel-i7-11700k,3.0,"April 27, 2021",amazon,work decently graphic godawful artifacting box showing randomly even updated driver
intel-i7-11700k,1.0,"February 11, 2022",amazon,got mine out go push power button nothingabsolutelynothingput old cpu back start like champtf even checked compatibility buyingi sure hope get money back
intel-i7-11700k,1.0,"September 8, 2021",amazon,returned intel k ran hot rd party seller charged restockingfee wa not mentioned return documentation stay away rd party sale
intel-i7-11700k,1.0,"August 3, 2022",amazon,wa open box wa dead arrival still waiting refund july th
intel-i7-11700k,5.0,"April 14, 2021",amazon,really dont get people arent hyping fact get almost triple readwrite speed new chip gen reason upgradeddowngraded cpu specifically gen slot trust invest pro samsung configure raid make boot drive bam dont say didnt tell ya avoid hassle make sure motherboard least pcei gen slot otherwise may share bandwidth slot regard rest feature cpu intel opinion still top dawg come gaming overclocking ive enjoyed intels ik like want best intel offer pocket like pocket youll follow someway plan right ik sold out importantly wayyyyy pricey no prob go local retailer buy ik make sure spend extra dough retailer year year warranty intel stop temper tantrum rising ryzens lower ik considerably come even better cpu purchased warranty basically trade no extra cost even lower paid got cash still wan na save buck highly recommend method besides got ta stay loyal intel boy not switch dark side threadskipper hahahah
intel-i7-11700k,4.0,"April 30, 2021",amazon,got mine bh doesnt matter anyways bad bought mine like release day lol cpu very solid keep mind thing nm core architecture backported nm like call disaster k better igpu good processor not worth price tag
intel-i7-11700k,5.0,"December 17, 2021",amazon,upgraded mother board processor k k asus rog ze gaming wifi also installed gen nvme drive oppose gen nvme drive k say speed operation window noticeably faster extremely satisfied stability speed system
intel-i7-11700k,5.0,"June 24, 2022",amazon,ive watching price processor several week saving discretionary fund upgrade k new one came along well know auction site made offer snagged ran pace life expectation went high ghz turbo boost didnt disappoint although get rather warm backed ghz run couple degree warmer k setting outperforms trial highly recommended
intel-i7-11700k,5.0,"July 30, 2022",amazon,medium could not loaded built pc virtual pinball cpu plenty power smooth game play monitor rtx gb ram along tb ssd
intel-i7-11700k,5.0,"April 1, 2021",amazon,closely match x across synthetic benchmark according indep reviewer meaningful lead others lower price inclusion igpu better reliability availability also longterm power draw better temperature x well excellent product youre not waiting alder lake later year
intel-i7-11700k,5.0,"April 5, 2021",amazon,cpu performance great price also come igpu great medium display support av bit decode bit hevc hdmi great work
intel-i7-11700k,5.0,"April 15, 2021",amazon,asus prime zp motherboard im looking buy cpu ok
intel-i7-11700k,1.0,"March 30, 2021",amazon,thing performs worse series still nm good heating small room quickly
intel-i7-11700k,5.0,24 July 2021,amazon,cpu fast run cool im glad chose expensive th gen find barely break sweat running latest game run mid degree celsius noctua air cooler auto overclock asus motherboard increased speed know plenty headroom future didnt like presentation box original intel label serial number covered amazon label not able see batch serial number wa annoying managed peel eventually read serial number seller explained wa amazon label think amazon should choose different placement great chip overall
intel-i7-11700k,5.0,29 May 2022,amazon,always use ik build never really probs change stick worksthe price would good stay mark instead going again day whats point
intel-i7-11700k,5.0,13 October 2022,amazon,processor absolutely insane
intel-i7-11700k,5.0,7 August 2021,amazon,amd dominating moment intel still good either cpu going fine k wa bit cheaper plenty fast enough easy install
intel-i7-11700k,5.0,30 October 2021,amazon,bought amazon repackaged cpu work perfect no problem love got good discount
intel-i7-11700k,4.0,21 April 2024,amazon,buying lot research would best quietest cpu cooler generates almost two amount heat using two month improvement th gen significant reliable farone star marked chip overpriced fair not fault amazon supplier seem overpricing day th gen
intel-i7-11700k,5.0,19 August 2021,amazon,arrived quicker expected look brand new no damage pinsscratches
intel-i7-11700k,5.0,24 October 2021,amazon,beat
intel-i7-11700k,5.0,8 October 2021,amazon,
intel-i7-11700k,5.0,31 July 2022,amazon,great cpu much needed improvement old nd gen
intel-i7-11700k,5.0,20 December 2021,amazon,bring power
intel-i7-11700k,5.0,"June 22, 2022",amazon,blazing fast gaming workflow easy overclock out performs mid range amd mile saving hundred compared higher range amd processor needed competemotherboard choice slightly expensive already spend processor whats another v benchmark higher equivalent ryzen league faster ryzen sweet spot cpu demanding game not enough overclocking thread ripping queen though
intel-i7-11700k,5.0,"July 26, 2022",amazon,motherboard mag z tomahawk doesnt support pcie x take fully advantage ssd pro drive nvme interface gpu intel core ik doe therefore wa no brainer purchase specific cpu msi updated motherboard bios support intel gen intel core ik come integrated graphic use advantage run certain program run gpu intel integrated graphic msfs wa concern cpu heat turn out run normal load water cooler running under heavy stress load very happy satisficed purchase recommended
intel-i7-11700k,5.0,"May 16, 2024",amazon,replaced core made cadworkx bricscad respond much faster
intel-i7-11700k,5.0,"December 11, 2023",amazon,work well nice fast
intel-i7-11700k,5.0,"May 24, 2024",amazon,bon processeur sans plus qui fait la job
intel-i7-11700k,5.0,"August 23, 2023",amazon,excellent cpu handle latest game kid play design work throw doe not overheat need use quality io
intel-i7-11700k,4.0,"July 12, 2021",amazon,there no denying strong processor want buy something intel core k way gobut money consideration power bill much need spend cooling amd offer well better similar amd core bit expensive cheaper motherboards draw far le power mean smaller power bill smaller power supply cheaper cooling solutionsso yes processor strong wanted go intel needed processor right away thats one feel like offering bridge gap next generation
intel-i7-11700k,5.0,"September 10, 2023",amazon,really like overclock cpu find stability could realize improvement one went smooth stable better year zero hiccup
intel-i7-11700k,5.0,"March 17, 2024",amazon,trs satisfait
intel-i7-11700k,5.0,"October 5, 2023",amazon,jai achet ce processeur car il supporte pcie achetez avec ce processeur un bon refroidisseur de cpu car lors de mi jour le cpu montait jusqu celsius jai donc chang mon refroidisseur pour un quiet dark rock pro sur amazone et maintenant mon cpu intel affiche degr celsius
intel-i7-11700k,5.0,"July 19, 2023",amazon,im quite happy cpu im not computer person built gaming pc arrived fast wa well packaged
intel-i7-11700k,4.0,"May 19, 2022",amazon,recently upgraded intel k wa starting bottleneck playing newer game huge difference love processor
intel-i7-11700k,5.0,"December 15, 2022",amazon,je suis partie dun k sur ce k pour pouvoir jouer et stream sur un pc trs bonne upgrade
intel-i7-11700k,5.0,"March 23, 2023",amazon,working fine right see
intel-i7-11700k,5.0,"September 23, 2022",amazon,good cpu
intel-i7-11700k,5.0,"October 2, 2021",amazon,love ik fast not play game rendering graphic card
intel-i7-11700k,5.0,"September 29, 2021",amazon,worked like charm asus gen motherbaord extreme option enabled
intel-i7-11700k,5.0,"February 9, 2022",amazon,steady powerfull
intel-i7-11700k,5.0,"November 14, 2021",amazon,bon service pour mon ordinateur
intel-i7-11700k,5.0,"October 31, 2021",amazon,very good price
intel-i7-11700k,5.0,"September 4, 2021",amazon,super trs rapide
intel-i7-11700k,5.0,"June 2, 2022",amazon,wa solid upgrade pc nice speed improvement day day use paired ti gaming framerates went roof
