Product,Rating,Date,Source,Review
intel-i7-11700k,5.0,"August 12, 2022",amazon,good product work fine
intel-i7-11700k,5.0,"September 20, 2021",amazon,na
intel-i7-11700k,5.0,"January 29, 2022",amazon,fonctionne trs bien et cest exactement ce que je mattendais
intel-i7-11700k,5.0,27 September 2021,amazon,upgraded th gen th gen superfast processor got fps cod warzone k gtx
intel-i7-11700k,5.0,1 August 2021,amazon,working perfectly gaming
intel-i7-11700k,4.0,1 August 2021,amazon,processor awesome value money overpriced shouldnt above k retail price le mentioned
intel-i7-11700k,1.0,3 December 2021,amazon,dislike
intel-i7-11700k,1.0,7 February 2023,amazon,bought chip unfortunately got ill couldnt use return policy expiredwhen went use found wa dud chipthe computer would not boot investigating found wa faulty company would not exchange good one very disappointed supplier
intel-i7-11700k,5.0,2023年8月27日に日本でレビュー済み,amazon,初期不良もなく正常稼働しております。
intel-i7-11700k,5.0,2021年7月16日に日本でレビュー済み,amazon,10年前に第2世代インテル Core i7でPCを組み、現状でも特に問題なく使用していましたが、突如PC（たぶんマザー）が故障してしまいやむなく、久々にPCを自作することにしました。（コストを抑えるため！）昔は多少、知識がありましたが、ブランクが長く時代に取り残され何もわからず誰かと同じ構成でいいと思い、調べましたが情報が少なく、構成の相性問題等でだいぶ悩みました。今後組まれる方、お役に立てばご参考にしてください。マザーボード ASUS GAMING H570-PROメモリ　CFD販売 PC4-25600(DDR4-3200) 16GB×2枚　W4U3200PS-16GATX電源 シルバーストーン 750W SST-ET750-HG-RevUFCPUクーラー 虎徹 Mark II内蔵 SSD　サムスン 980 1TB PCIe Gen 3.0 ×4 NVMe M.2  MZ-V8V1T0B/EC以上の組み合わせで特に問題なし。一発でバッチリ起動。OSインストールまでうまくいきました。その他、DVD、HDDドライブ、PCケース等は手持ちを流用。メモリはネイティブで3200で作動しています。現状、設定はデフォルトのままですが、温度も予想より十分低く、起動スピード、動作も激速、安定度も十分です。おすすめの組み合わせとしておきます。
intel-i7-11700k,5.0,2022年5月22日に日本でレビュー済み,amazon,初期不良も無く、安定して動作してくれてます。
intel-i7-11700k,5.0,2021年7月4日に日本でレビュー済み,amazon,i7-4790搭載PCからi7-11700K搭載PCへ初めての11世代CPUをROG STRIX Z590Fへ搭載しPCを初自作！熱を持ちやすいと聞いたので水冷で組んでみましたが今のところ45℃を超える事が無いので、高負荷作業をする人では無ければ空冷でもいいのかな？何もしてなければ現状36℃程ですメモリ32GBで処理速度はかなり速く感じます外箱は傷み等無く購入して良かったと思う商品です
intel-i7-11700k,5.0,2023年4月23日に日本でレビュー済み,amazon,元々ついていたものがハズレ個体（初期不良対応すぎてからの発覚でした）でしたが、問題が顕著に表れだしたため交換用に手配いたしました。11700Kと11700 は別物なのでこのあたりがわかりにくかったですな。一旦キャンセルしてしまいましたが問い合わせとか見ていたら目的の商品というのが分かり、再度オーダー入れました。商品自体は 11700Kのほうが届きましたので、問題ありませんが、商品名のわかりにくさで★4とさせていただきました。
intel-i7-11700k,5.0,2021年10月10日に日本でレビュー済み,amazon,スペックと値段の完璧な商品だと思います。
intel-i7-11700k,5.0,2021年5月4日に日本でレビュー済み,amazon,安定していて、使いやすいです。
intel-i7-11700k,5.0,2022年8月15日に日本でレビュー済み,amazon,これ買うなら12世代の下位のCPUのほうが性能上で安いですよ。
intel-i7-11700k,5.0,2021年7月13日に日本でレビュー済み,amazon,M/B　３枚交換して上手く動かなくて、cpu交換したら無事に起動出来た、ｍ/ｂとの相性があるようです。
intel-i7-11700k,5.0,2021年9月13日に日本でレビュー済み,amazon,４世代からの入れ替えですが、１１世代ともなると同時に処理してくれる速度が違いますね。今までフリーズしていたものが、ストレスなく動作してます。交換してよかったね。
intel-i7-11700k,5.0,5 May 2022,amazon,bought replace f even thought w cpu run cooler f motherboard using heatsink overall good buy price cheaper shopeelazadasim lim shop
intel-i7-11700k,4.0,30 December 2021,amazon,zufrieden
intel-i7-11700k,1.0,15 July 2023,amazon,video player loadingplay videoplaymutecurrent time duration loaded stream type liveseek live currently behind liveliveremaining time xplayback ratechapterschaptersdescriptionsdescriptions selectedcaptionscaptions subtitle selectedaudio trackfullscreenthis modal window ich habe die cpu al gebraucht ware erhaltennach dem einbau pc schaltet nur ein und au und die cpu led leuchtet rothabe den prozessor wieder retour gesendet
intel-i7-11700k,1.0,26 September 2022,amazon,medium could not loaded original packaging unsealed processor missing
intel-i7-11700k,5.0,24 February 2022,amazon,ich komme von eine und alles ist besser ich verwende mit eine corsair hydro hx wasserkhlung und die temperatur ist normaleweisse niedrig von grad bi
intel-i7-11700k,5.0,31 October 2021,amazon,obwohl die cpu au den usa versendet wurde und ich etwas zeitnot war haben die esgeschafft der prozessor tagen hier abgeliefert wurde natrlich ohne jegliche probleme
intel-i7-11700k,5.0,24 June 2021,amazon,also eigentlich wollte ich einen neuen amd kaufen da die uvp preise einfach super waren fr die leistungenals ich dann gesehen habe ein amd prozessor mit einer uvp von jenseits von gut und bse erst zu haben zwischen niemals eine preispolitik untersttze ich nicht und e ist wieder ein intel gewordenhabe einen k und einen k und beide sind preis technisch klasse auch wenn die mehr strom ziehen al die amd smein k kriege ich nicht dauerhaft ber w geprgelt luft sehr khl und fr mich die vernunft cpuder k ist da ein bisschen anders er gnnt sich bei mir bi zu w selbstverstndlich einem stress test beim tube schauen zieht der im schnitt wbei spielen logischer weise etwas mehr und je nach spiel auch mal gerne w bleibt bei guten grad ca grad wrmer al der kgekhlt werden beide mit noctua khler die sind einfach klassebei der performance macht e kaum einen merklichen unterschied beim gaming ich spiele auf k leider mit einer rtx dank der bescheidenen gpu wirtschaft sollte eigentlich eine rtx werdenmerklichen unterschied zwischen den beiden cpu merkt man schon bei bild bearbeitung oder video bearbeitung da rate ich jedem zum k wenn man nur spielen mchte und etwas geld sparen dann reicht locker ein k oder k
intel-i7-11700k,5.0,6 May 2021,amazon,auch fr mich war e nach fnf jahren der zeit meinen alten intel ik core jetzt mal durch etwas neueres zu ersetzen da dieser einfach schon die jahre gekommen ist immerhin ist fnf jahren viel passiert und ein core ist eigentlich gar nicht mehr zeitgem nach langem hin und habe ich mich dann doch gegen amd und wieder fr ein intel entschieden auch wenn die meinungen darber wohl weit auseinandergehen warum der ik und nicht kein amd ryzen nun ja da thema amdintel ist gar nicht mehr wie e noch vor einigen jahren der fall war frher war intel immer premium und die amd eben die gnstigere alternative wenn auch oft mit mehr performance heute hat sich diesis blatt irgendwie gewendet amd hat den markt komplett auf den kopf gestellt und intel war daraufhin gezwungen die preise auch mal angemessen zu senken heute knnte man sagen amd htte die nase vorne fertigungstechnik leistung etc und intel wrde etwas hinterher rennen dy kann man nun sehen wie man mchte ich fr meinen teil habe mich jedoch bewusst wieder fr einen entschieden sicherlich wre vergleichsweise zum ik ein ryzen xx ebenso angebracht wenn nicht sogar mancher hinsicht sogar noch besser bzw leistungsstrker aber da alles sind nur zahlen von irgendwelchen benchmark und spielen mir al endverbraucher ist auch die fertigungstechnik ob nm oder nm vollkommen egal wa juckt mich da einzig und alleine ein vorteil sehe ich bei amd die leistungsaufnahme und somit den stromverbrauch sowie die damit eher niedrige hitzeentwicklung wozu dann letztendlich eine geringeren khlung notwenig ist und ich persnlich da kann nun jeder sehen wie er mchte habe die erfahrung gemacht das die kombination von cpugpu eben intelnvidia undoder amdradeon heute ja auch amd eben besten harmonieren hab da oft experimentiert und landete ende immer wieder bei einem intelsystem mit einer nvidia grafikkarte punktnun ja dann kommt e eben auch noch darauf wa ich denn mit meinem computer berhaupt mache der anwendungsbereich ist ja bei jedem anders somit auch die anforderungen ich zb nutze meinen pc zu zum arbeiten verdiene also mein geld damit mir ist dabei zuverlssigkeit stabilitt sowie leistung im gesamten wichtigsten die restlichen der nutzung verbringe ich privat damit unter anderem auch hin und wieder zum zocken alles allem brauche ich also ein zuverlssiges arbeitstier und den jahren seitdem ich intelcpus nutze wie zuletzt den k hatte ich noch nicht einmal probleme damit vom ersten bi zum letzten tag schnurrte mein system vor sich hin ohne auch nur einen einzigen absturz oder konflikte irgendeiner artob man dasselbe nun auch mit einem amd system haben kann ich nicht abstreiten mit sicherheit aber ich habe keine zeit und lust auf experimente und vertraue daher auf die erfahrung welche ich bislang im positiven mit intel und negative mit amd gemacht habe preisleistung und der ganze hype um die detail ist mir dabei doch wirklich egal kann ich mir wenigstens sicher sein das ich wei wa ich fr mein geld bekomme aber da kann und soll ja auch jeder fr sich selbst entscheiden warum jetzt genau der ik der ik hat derzeit fr mich da beste preisleistungsverhltnis vermutlich htte ich auch zur generation gegriffen wenn ich nicht unbedingt fr die zukunft auch pci profitieren wollen wrde alleine da sorgt bereits fr einen meilensprung im vergleich zu meinem alten k daher habe ich mir auch nicht nur die neue cpu und da mainboard sondern auch direkt noch eine ssd mit pci anbindung zugelegt und die neue grafikkarte derzeit noch eine rtx super wird dann wohl auch irgendwann eine mit pcie sein bin damit also vorerst zukunftssicher wer da nicht zwingend braucht oder mchte kann auch zur generation greifen viel unterschied macht da nichtansonsten bietet mir der ik ganze kerne und thread wa fr mich allemal ausreicht al upgrade zu meinem k mit kernen und thread ein deutlicher zuwachs leistung da merkt man sofort und genau da ist e doch worauf e ende ankommt das man die mehrleistung auch bemerkt statt durch irgendwelche benchmark zu scrollen und sich zahlen den kopf zu hmmernbesonders bei der adobe creative cloud photoshop indesign lightroom etc und hinsichtlich videoschnitt handbrake davinci resolve adobe premiere habe ich eine deutliche verbesserung gemerkt und genau da habe ich davon erwartet window x verbindung mit der samsung ssd pro pcie rennt jedenfalls wie sau dafr musste ich nicht mal meinen ram derzeit noch gb upgraden verbindung mit der nvidia rtx super habe ich nun wirklich ein tolles system welches erst mal wieder keine wnsche offen lsst e mus sich halt einfach lohnen wie bereits erwhnt einziger nachteil den ich persnlich hingegen amd sehe ist der etwas hhere verbrauch vergisst die zahlen von irgendwelchen benchmark und vertraut auf eure erfahrung und auf den sprbaren leistungszuwachswenn sich von euch auch jemand fr den ik entscheidet rate ich euch auf jedem fall vom boxedlfter ab also der lfter der beim kauf eventuell ggf dabei ist sofern ihr euch die boxedversion bestellt greift lieber zur retailvariante und kauft euch einen ordentlichen cpukhler separat eure ohren und auch eure cpu wird e euch danken ich zb verwende den alpenfhn ben nevis advanced und kann ihn wrmstens empfehlen der ist nicht nur super leise im betrieb er hat auch eine wirklich enorm gute khlleistung kein vergleich zu den mistdingern die man bei der cpu mit dazu bekommt fazit also ich kann den ik absolut empfehlen fr alle die sich dem budget einen neuen pc zusammenstellen mchten oder eben wie ich eine etwas die jahre gekommene cpu damit ablsen mchten ihr werdet diese entscheidung definitiv nicht bereuen und habt mit dem ik sicherlich ein sehr stabile leistungsstarkes system fr die nchsten jahre der zukunft er eignet sich super fr allerlei aufgaben und meistert bei mir alle aufgaben tadellos und ohne problemevon mir gibts daher auch sternenkonnte ich dir mit der rezension helfen und zur kaufentscheidung beitragen bedanke dich gerne mit einem klick auf ntzlich soda auch anderen damit geholfen wird
intel-i7-11700k,5.0,22 febbraio 2023,amazon,articolo arrivato sbagliato fatto il reso tutto ok
intel-i7-11700k,5.0,7 gennaio 2022,amazon,molto veloce
intel-i7-11700k,5.0,marzo de 2022,amazon,va de lujo
intel-i7-11700k,5.0,março de 2024,amazon,excelente recomendo
intel-i7-11700k,5.0,abril de 2023,amazon,muito bom ate momento superando expectativas
intel-i7-11700k,5.0,janeiro de 2023,amazon,em uso por enquanto funcionando contento
intel-i7-11700k,5.0,fevereiro de 2023,amazon,top
intel-i7-11700k,5.0,4/26/2023 1:06,bestbuy,got back sep built new pc rtx gb ram tb pf storage nzxt kraken z lem me tell one heck build cpu handle literally game except crysis hahaha real really good no issue still till day
intel-i7-11700k,5.0,8/21/2023 8:19,bestbuy,work great gaming rig run game ti k no bottleneck
intel-i7-11700k,5.0,5/27/2023 17:18,bestbuy,upgraded havent looked back
intel-i7-11700k,4.0,5/18/2023 10:35,bestbuy,solid no issue work great very little no bottle neck would recommend
intel-i7-11700k,5.0,9/17/2021 7:33,bestbuy,amazing processor faster th gen switched pcie gen super fast go well asus mother board
intel-i7-11700k,5.0,12/29/2022 15:34,bestbuy,building pc scratch always bug bios setting adjust optimal performance get bug out performs expected ghz core load temp never above c v team blue way
intel-i7-11700k,5.0,2/23/2022 10:25,bestbuy,cpu score nd percentile cpu mark performance test very fast reliable wa first time installing intel cpu bit trickier amd cpu wa still easy using hyper cooler thing stay nice cool pricier amd counterpart
intel-i7-11700k,5.0,10/21/2021 13:32,bestbuy,super fast make sure proper cooling thing run hot set get temp
intel-i7-11700k,5.0,12/14/2021 7:50,bestbuy,great processor chip get fps chip last next year least able play triple game near max setting
intel-i7-11700k,5.0,11/10/2022 1:28,bestbuy,great cpu perfect pair gtx ti doe not include cpu fan thats perfectly fine buy separate maybe even better cpu fan
intel-i7-11700k,5.0,11/25/2022 11:50,bestbuy,coming k huge difference slowly upgrading pc little little
intel-i7-11700k,4.0,3/4/2022 22:05,bestbuy,clear marking chip make easy install used z motherboard gen capabilites not quite fast rysen x close never problem intel
intel-i7-11700k,5.0,2/18/2022 15:57,bestbuy,work great newest build cant go wrong intel
intel-i7-11700k,4.0,4/21/2021 12:25,bestbuy,wanted give th gen try not break bank decided go k msi za pro already x coupled x tomahawk thats running fine except dreaded usb port issue out box yes x run faster tweak msi bios im currently running ghz core passed cbcbcb aida realbench prime small fft anyone tell chip doesnt run hot hasnt run meaningful stress test chip stock close tweaked beating x even pbo curve optimization manually overclock x using ryzen master bios somewhat take lead again show th gen chip compete youre intel fan viable cpu downside wa routinely pulling w hitting c top even running cb evga aio pull lot run sub even under heavy load core ghz bonus gaming better low higher resolution equally important high solid chip psu cooling tame price le x
intel-i7-11700k,4.0,6/23/2021 22:18,bestbuy,hot boy thats sure great performance gaming though would make great heater cold winter month decided give intel another chance even though many people given intel cause well youre building computer probably know amd better efficient theyre moving forward also didnt cut core thread say processor faster last gen cpu probably switching amd also dont get wrong cpu great get job done long way cool youre still intel fan still cheaper amd would probably good honestly cheaper reason got
intel-i7-11700k,5.0,4/14/2024 21:54,bestbuy,two year pushing intel core ik limit confidently say absolute powerhouse core thread configuration handled everything ive thrown intensive gaming session demanding productivity task performance k consistently delivered topnotch performance whether im editing video compiling code running complex simulation cpu not skipped beat also kept latest game providing smooth immersive experience overclocking enthusiast like overclocking potential delight ive able safely push frequency achieve even better performance k remained stable reliable throughout durability two year processor still running smoothly day one testament build quality engineering went chip value initially price point seemed bit steep given longevity unwavering performance proven worthwhile investment final thought intel core ik crucial part setup no regret purchase product stood test time would highly recommend anyone looking highperformance reliable cpu
intel-i7-11700k,5.0,12/16/2023 12:09,bestbuy,wasnt sure expect purchased item upgraded core product changed lot running frame well normal apps running faster usual highly recommend upgrading
intel-i7-11700k,5.0,4/26/2023 11:17,bestbuy,work faster easy swap out get going got sale wa worth
intel-i7-11700k,5.0,10/31/2023 23:01,bestbuy,built pc wa one wanted wa sale time run incredible able play star citizen huge upgrade would recommend anyone get chip
intel-i7-11700k,5.0,12/4/2023 6:56,bestbuy,work amazing great performance come handling load processing data gaming
intel-i7-11700k,5.0,6/19/2023 19:19,bestbuy,wa purchased th gen release wa still sufficient great middleoftheroad processor enough core multitask still great clock speed game budget intermediate gaming set
intel-i7-11700k,5.0,4/14/2023 17:32,bestbuy,worked fine preformance expected not come cooler immediately thermal throttled stock cooler rec buying good air cooler small aio overclocks well enough
intel-i7-11700k,5.0,10/18/2023 22:08,bestbuy,purchased server pc th gen good bang buck going th gen ik virtualization server pc host game consistency core higher clock rate typical server processor also important youre not looking spend thousand modern scalable processor intel
intel-i7-11700k,5.0,3/5/2024 15:13,bestbuy,excellent cpu good price core thread would buy again would also recommend buying
intel-i7-11700k,4.0,7/16/2023 12:09,bestbuy,really pretty good contends xd motherboards cheaper get non k around go dont buy k
intel-i7-11700k,5.0,12/22/2023 8:24,bestbuy,needed replace old processor price wa right one great service bb easy swap would get again
intel-i7-11700k,5.0,7/3/2023 21:21,bestbuy,processor excellent almost computer application think use conjunction rendering autodesk fusion blender design work processor perform numerous iteration fraction time previuos processor excellent result
intel-i7-11700k,5.0,1/31/2024 10:06,bestbuy,very great product recommended gaming wa bought no issue damage
intel-i7-11700k,5.0,7/21/2021 13:28,bestbuy,there no denying strong processor want buy something intel core k way go money consideration power bill much need spend cooling
intel-i7-11700k,5.0,4/11/2021 12:06,bestbuy,not expensive k available benchmark ahead amd x pcie support winner doesnt run hot x game like crazy get z chipset mb want cpu even though z work support pcie z chipset upped benchmark score
intel-i7-11700k,5.0,6/30/2023 13:15,bestbuy,work like intended upgrade old cpu ik since not many motherboard option wa looking wa worth upgrade z wifi gundam edition motherboard
intel-i7-11700k,5.0,5/7/2021 1:06,bestbuy,lot research went basically thing not worth extra money cant go wrong great value price
intel-i7-11700k,5.0,12/16/2023 16:22,bestbuy,one best performance gotten using gamma
intel-i7-11700k,5.0,7/9/2023 21:04,bestbuy,decently fast not hugely faster th gen gaming faster early review indicated due microcode update came initial review
intel-i7-11700k,4.0,8/6/2021 21:34,bestbuy,despite bad review youtube cpu working really good need good cooling run kinda hot oc out box run again good cooling wont go higher pair good graphic card resizeable bar enable doe great job reason give star price
intel-i7-11700k,5.0,11/24/2023 23:11,bestbuy,holding strong everyday use hardcore gaming
intel-i7-11700k,5.0,10/27/2023 16:17,bestbuy,excellent processor money handle gaming video editing
intel-i7-11700k,5.0,7/16/2021 18:23,bestbuy,th generation rock great performance extra speed gen speed channel awesome
intel-i7-11700k,5.0,4/26/2024 21:09,bestbuy,amazing work well totally worth money would recommend
intel-i7-11700k,5.0,6/9/2023 13:18,bestbuy,worked well need probably could push without issue would recommend gamingschoolworkphotoshop
intel-i7-11700k,5.0,8/10/2023 15:24,bestbuy,took advantage deal samsung pro slot forgot wa th generation cpu ik wa great sale figured gain pci chip would worth without major system upgrade th gen equivalent seemed like overkill went wa recommended difference significant
intel-i7-11700k,5.0,7/24/2023 20:55,bestbuy,awesome cpu bought one gave issue happy
intel-i7-11700k,5.0,8/26/2021 3:57,bestbuy,new tech th gen processor overkill perhaps rocket lake blazing fast sure cpu limelight dont think notice besides people say going processor say surf internetblazing fast desire future proof computer build get excellent cpu
intel-i7-11700k,5.0,5/15/2021 16:35,bestbuy,very nice processor wa readily stock correct pricing wa easy install asus ze board no issue processor allow gen ssd connection gen ssds z motherboards cooling using corsair aio mm essentially match speed k replaced thing
intel-i7-11700k,5.0,3/5/2024 17:43,bestbuy,great product very pleased highly recommend item purchase again future
intel-i7-11700k,5.0,7/30/2023 22:38,bestbuy,nice like old need new one love
intel-i7-11700k,5.0,5/20/2023 17:36,bestbuy,great processor mainly use computer gaming thing wonderful
intel-i7-11700k,4.0,9/9/2023 7:22,bestbuy,got sale yes newer processor available time price work fine multipurpose pc
intel-i7-11700k,5.0,2/25/2024 11:35,bestbuy,great cpu powerful fast help lot blenderunity work
intel-i7-11700k,5.0,10/8/2021 17:06,bestbuy,youre debating get ik save extra get instead core thread benchmark basically overclock friendly wel
intel-i7-11700k,5.0,5/23/2023 9:47,bestbuy,love piece equipment handle call duty very well
intel-i7-11700k,5.0,5/22/2023 10:20,bestbuy,better upgrade faster well
intel-i7-11700k,5.0,5/22/2023 9:55,bestbuy,mug slap go vary fast really good price
intel-i7-11700k,4.0,7/21/2023 19:08,bestbuy,work great pc began use lot power usual probably need better fan planning upgrading cpu
intel-i7-11700k,5.0,3/31/2021 22:24,bestbuy,nice chip decent jump performance k know ryzen chip currently better buy lifetime failure doesnt get cured one generation good cpu amd released year worth good cpu maybe ill switch
intel-i7-11700k,4.0,8/25/2023 12:45,bestbuy,amazing processor havent slow issue run top tier game without issue definitely recommend
intel-i7-11700k,5.0,6/12/2021 22:39,bestbuy,superb piece silicon despite basement dwelling youtube reviewer might tell integrated graphic work well doe run hotter th gen th gen processor recommend getting good clc air cooler
intel-i7-11700k,5.0,4/10/2021 23:22,bestbuy,far work great heating issue first very good good thing integrated graphic current gpu shortage
intel-i7-11700k,5.0,12/13/2023 9:50,bestbuy,say processor bought lasted long time no issue dont drop
intel-i7-11700k,5.0,6/5/2023 9:23,bestbuy,actually returned processor wa right socket lga reason not work lga motherboards staff very helpful getting correct processor appreciate help very much
intel-i7-11700k,5.0,10/10/2022 16:43,bestbuy,intel core ik offer excellent performance eightcore chip solid gaming application performance overclockable price dropped below good value building budget system
intel-i7-11700k,5.0,6/12/2021 11:07,bestbuy,originally installed cpu z motherboard order test out pcie gen speed bios update configuring gpus pcie slot run x width wa able achieve pcie speed wa disappointed find out motherboard didnt support gen onboard slot wa able upgrade z motherboard wa very happy gpu ssd running pcie gen x pcie gen x width respectively overclocking max turbo frequency ghz using intel performance maximizer tool wa quick easy making single bios change
intel-i7-11700k,4.0,12/18/2023 15:27,bestbuy,cpu served well last couple year however seen cpu model price rangecheaper seem better performance gaming thats youre buying
intel-i7-11700k,5.0,7/23/2023 7:40,bestbuy,upgraded th gen wa massive improvement ive no issue anything running processor everything run super fastcod lol rocket league
intel-i7-11700k,5.0,7/23/2021 16:22,bestbuy,great cpu far kinda wishing got core though gaming should need year
