Product,Rating,Date,Source,Review
intel-i5-12400f,4.0,2 months ago,flipkart,original
intel-i5-12400f,5.0,2 months ago,flipkart,super
intel-i5-12400f,4.0,2 months ago,flipkart,good product
intel-i5-12400f,5.0,3 months ago,flipkart,nice product offer
intel-i5-12400f,5.0,3 months ago,flipkart,good
intel-i5-12400f,5.0,4 months ago,flipkart,love intel
intel-i5-12400f,5.0,4 months ago,flipkart,excellent product
intel-i5-12400f,5.0,4 months ago,flipkart,great performance processor nicely packed delivered
intel-i5-12400f,5.0,4 months ago,flipkart,very good product game work flawlessly processor
intel-i5-12400f,4.0,5 months ago,flipkart,good processor ideal
intel-i5-12400f,5.0,5 months ago,flipkart,excellent flawless packaging shipping very good service immensely happy product
intel-i5-12400f,5.0,5 months ago,flipkart,great
intel-i5-12400f,5.0,5 months ago,flipkart,good product
intel-i5-12400f,5.0,6 months ago,flipkart,got th gen processor under k bbd sale paired msi pro hm e ddr performing like beast day day task casual mid casual gaming one thing take note stock intel cooler doesnt perform good better go another third party cpu cooler using deep cool ag cpu temp never go above degree great product
intel-i5-12400f,5.0,6 months ago,flipkart,best cpu budget love product time delivery delivery boy behaviour goodthanks flipkart
intel-i5-12400f,3.0,7 months ago,flipkart,superb
intel-i5-12400f,5.0,7 months ago,flipkart,good balanced cpu gaming
intel-i5-12400f,5.0,7 months ago,flipkart,thnks flipkart
intel-i5-12400f,5.0,7 months ago,flipkart,sealed package working well
intel-i5-12400f,5.0,7 months ago,flipkart,best budget cpu got open delivery good condition product
intel-i5-12400f,5.0,7 months ago,flipkart,great cpu work okish cpu cooler involved
intel-i5-12400f,5.0,7 months ago,flipkart,good
intel-i5-12400f,5.0,7 months ago,flipkart,great purchase
intel-i5-12400f,5.0,7 months ago,flipkart,good
intel-i5-12400f,5.0,8 months ago,flipkart,intel processor f
intel-i5-12400f,5.0,9 months ago,flipkart,nice
intel-i5-12400f,5.0,9 months ago,flipkart,impressive
intel-i5-12400f,5.0,9 months ago,flipkart,superb quality
intel-i5-12400f,4.0,9 months ago,flipkart,good
intel-i5-12400f,5.0,9 months ago,flipkart,value money processor great performance
intel-i5-12400f,5.0,10 months ago,flipkart,good quality work great
intel-i5-12400f,3.0,10 months ago,flipkart,nice product
intel-i5-12400f,5.0,11 months ago,flipkart,good processor
intel-i5-12400f,5.0,11 months ago,flipkart,perfect thanks
intel-i5-12400f,4.0,11 months ago,flipkart,good described
intel-i5-12400f,5.0,11 months ago,flipkart,great
intel-i5-12400f,5.0,11 months ago,flipkart,high performance
intel-i5-12400f,5.0,"May, 2023",flipkart,super
intel-i5-12400f,5.0,"May, 2023",flipkart,nice
intel-i5-12400f,5.0,"Apr, 2023",flipkart,excellent
intel-i5-12400f,4.0,"Mar, 2023",flipkart,packaging wa bad product good thanks flipkart amazing deal loved
intel-i5-12400f,5.0,"Mar, 2023",flipkart,super
intel-i5-12400f,5.0,"Feb, 2023",flipkart,building pc game need dont overexpand high end cpu
intel-i5-12400f,5.0,"Feb, 2023",flipkart,very good
intel-i5-12400f,4.0,"Feb, 2023",flipkart,nice product
intel-i5-12400f,5.0,"Feb, 2023",flipkart,overall good deal
intel-i5-12400f,4.0,"Jan, 2023",flipkart,best gaming processor budget
intel-i5-12400f,5.0,"Jan, 2023",flipkart,very good
intel-i5-12400f,5.0,"Jan, 2023",flipkart,good processor
intel-i5-12400f,5.0,"Jan, 2023",flipkart,super
intel-i5-12400f,5.0,2/10/2024 9:04,bestbuy,pretty good cpu youre like mid range build would get easy install no problem
intel-i5-12400f,5.0,11/27/2022 14:35,bestbuy,lot research son said wa best speed price
intel-i5-12400f,5.0,2/18/2024 7:54,bestbuy,perfect regular gaming dont need much value
intel-i5-12400f,5.0,9/30/2023 1:50,bestbuy,smaller brother k also cost decent amount le k maintaining close performance pair something like ti well balanced build
intel-i5-12400f,5.0,7/10/2023 13:17,bestbuy,overall great gpu budget want build pc paired ti got good amount fps game like fornite mw
intel-i5-12400f,5.0,5/31/2024 22:50,bestbuy,decent processor dont mind lack igpu core youre considering build would reccomend going core cpu instead
intel-i5-12400f,5.0,1/13/2024 11:16,bestbuy,need game solid sweet spot even high end
intel-i5-12400f,5.0,6/19/2023 22:22,bestbuy,very good p gaming performance doesnt run hot equipped good air cooler get framerates above high setting warzone also play overwatch max out monitor fps
intel-i5-12400f,5.0,12/31/2023 15:01,bestbuy,easy install work perfect run system smooth
intel-i5-12400f,5.0,10/15/2023 10:39,bestbuy,work perfect daughter new computer doe gaming college work no complaint
intel-i5-12400f,5.0,7/27/2023 3:20,bestbuy,decent midrange cpu fairly easy install fan preapplied thermal paste run well cooler keep temp low isnt loud
intel-i5-12400f,5.0,6/30/2023 20:18,bestbuy,fast value cpu no integrated graphic pair nicely rx p gaming
intel-i5-12400f,5.0,1/15/2024 21:37,bestbuy,happy product built computer researched component needed meet gaming need computer happy result highly recommend
intel-i5-12400f,5.0,10/6/2023 15:35,bestbuy,cpu fast reliable great price
intel-i5-12400f,5.0,4/19/2024 14:49,bestbuy,good processor midranges pc affordable price
intel-i5-12400f,5.0,7/22/2023 1:37,bestbuy,bought one bad mobo bought different one work fine
intel-i5-12400f,5.0,5/13/2023 17:00,bestbuy,very good value not fastest cpu market anymore still heavy lifting nice price
intel-i5-12400f,5.0,5/21/2023 10:10,bestbuy,bought product year old building gaming system perfect purpose
intel-i5-12400f,5.0,11/10/2023 15:21,bestbuy,ive no problem good speed dont work computer very careful installing learn exactly first also make sure get graphic card doe not built graphic
intel-i5-12400f,5.0,8/4/2023 20:32,bestbuy,work expected great value money not much say
intel-i5-12400f,5.0,10/31/2022 10:05,bestbuy,picked sale great price paired rtx k gaming right amount cpu k since game gpu bound cpu doe not bottleneck very often used id se cpu cooler cpu temp dont exceed c load fractal torrent nano case
intel-i5-12400f,5.0,7/28/2023 18:46,bestbuy,cpu run better g super
intel-i5-12400f,5.0,10/7/2023 11:20,bestbuy,excellent entry level cpu wont bottleneck many gpus allowing stream multiple application running intend watch video listen soemthing gaming
intel-i5-12400f,5.0,12/6/2022 0:33,bestbuy,currently paired zero bottleneck easily get fps majority game medhigh setting get average warzone mw destint capped siege very strong budget cpu gaming
intel-i5-12400f,5.0,1/20/2024 11:13,bestbuy,loive item look good pc verymgood
intel-i5-12400f,4.0,5/18/2023 11:09,bestbuy,best value cpu lga starting brand new build would check price ryzen
intel-i5-12400f,5.0,11/3/2023 16:39,bestbuy,nice smooth cpu installed son new gaming pc love
intel-i5-12400f,4.0,6/10/2023 0:33,bestbuy,came perfect flaw installation wa pretty easy
intel-i5-12400f,5.0,6/5/2023 20:39,bestbuy,perfect price paired cpu xt worked amazingly not single problem
intel-i5-12400f,5.0,9/3/2023 19:54,bestbuy,ease use dy exactly want thanks
intel-i5-12400f,5.0,5/21/2023 20:22,bestbuy,great first build never failed worth buying building first computer
intel-i5-12400f,5.0,1/2/2023 15:39,bestbuy,perfect processor price used build son first gaming rig
intel-i5-12400f,5.0,11/6/2022 18:37,bestbuy,cost performance still cant beat paired could not happier gaming power recommendation pick aftermarket cooler stock one get loudaudible under load ran stock cooler week switched out dark rock
intel-i5-12400f,5.0,7/19/2023 1:53,bestbuy,amazing hoping win lol review yea
intel-i5-12400f,5.0,6/17/2023 19:39,bestbuy,work very well system xt perfect budget build
intel-i5-12400f,5.0,12/30/2022 16:00,bestbuy,one best budget option gaming highly recommended
intel-i5-12400f,5.0,11/10/2022 22:40,bestbuy,good price good performance light work gaming should not problem
intel-i5-12400f,5.0,4/9/2022 8:08,bestbuy,cpu work fast best bang buck get better cpu cooler possible not necessary
intel-i5-12400f,5.0,5/6/2022 20:24,bestbuy,amazing new technology intel almost beat x almost cheaper
intel-i5-12400f,4.0,8/12/2023 23:43,bestbuy,very fast music production see difference loading sample plugins daw
intel-i5-12400f,5.0,1/28/2023 17:59,bestbuy,son wa building first gaming pc wa looking good midrange cpu cpu wa perfect fit paired nicely ti
intel-i5-12400f,5.0,1/27/2023 15:41,bestbuy,doe job well built computer christmas gaming wa choose
intel-i5-12400f,5.0,5/10/2022 20:47,bestbuy,solid performance unreal engine somewhat decent render time arnold maya rather difficult install cpu cooler refer youtube video
intel-i5-12400f,5.0,7/26/2022 15:14,bestbuy,incredible value money price can not beaten ryzen also steal get good deal
intel-i5-12400f,5.0,11/1/2022 12:54,bestbuy,work great should bigger sale wouldve nice
intel-i5-12400f,5.0,11/19/2022 5:45,bestbuy,very good cpu work really well gaming word
intel-i5-12400f,5.0,9/30/2022 13:21,bestbuy,good cpu price match save couple extra buck
intel-i5-12400f,5.0,5/7/2022 0:51,bestbuy,lot better past cpu absolutely love performance give
intel-i5-12400f,5.0,5/6/2022 15:39,bestbuy,crazy fast efficient cpu use gaming machine ti
intel-i5-12400f,5.0,11/4/2022 1:07,bestbuy,ended cancelling order came no longer needed review saw appears excellent cpu
intel-i5-12400f,3.0,11/24/2022 8:28,bestbuy,built new pc ordered processor fan came very little thermal paste bottom didnt come extra figured would fine put still soon start pc state cpu getting hot c
intel-i5-12400f,5.0,2/3/2023 10:07,bestbuy,honestly budget cpu wonder highly recommend
intel-i5-12400f,5.0,8/19/2022 8:57,bestbuy,very nice budget cpu paired b motherboard rtx ti fe really performs well
intel-i5-12400f,5.0,8/26/2022 14:00,bestbuy,great cpu very good price like
intel-i5-12400f,5.0,9/15/2023 5:30,bestbuy,firts wa considering ryzen testing fir relized intel wa way go run queit good quality
intel-i5-12400f,5.0,1/5/2022 9:51,bestbuy,absolute price performance budget gaming cpu
intel-i5-12400f,5.0,1/10/2022 23:31,bestbuy,best valueperformance available right installed mine run c idle c gaming using mm water cooler
intel-i5-12400f,4.0,12/31/2022 20:59,bestbuy,work well cpu pretty slow start ups general use
intel-i5-12400f,5.0,6/14/2023 16:21,bestbuy,far best bang bucket midtier cpu get worth paying little integrated graphic need add aftermarket gpu
intel-i5-12400f,5.0,1/3/2023 23:33,bestbuy,might better processor th gen time wa best speed per dollar value performs like champ aaa game ive thrown
intel-i5-12400f,5.0,5/15/2023 8:28,bestbuy,play game want cant complain
intel-i5-12400f,5.0,8/25/2022 13:09,bestbuy,really good cpu gaming also very good play video game temporarily dont graphic card moment youre playing game dont require much power
intel-i5-12400f,5.0,6/20/2022 13:51,bestbuy,awesome budget chip preforms great mini itx build aio run cool cc
intel-i5-12400f,5.0,5/13/2022 18:29,bestbuy,excellent value th generation processor great playing game heavy desktop work great performance lower price cant wait install new system
intel-i5-12400f,1.0,4/23/2022 5:08,bestbuy,requested price match bestbuy matched price received item building pc bought many item out travel bag wa going overseas took part technician assemble item wa used seal wa broken sign thermal paste removal overseas cant return product not get away cheating sold used item price new item
intel-i5-12400f,5.0,7/14/2023 12:23,bestbuy,run everything perfectly shipping wa amazing couldnt asked better product
intel-i5-12400f,5.0,9/7/2023 15:45,bestbuy,awesome budget cpu low wattage le heat gaming
intel-i5-12400f,5.0,5/28/2023 3:57,bestbuy,great chip money built computer friend very happy fast
intel-i5-12400f,5.0,11/3/2022 17:13,bestbuy,drive street would able realize power race car would rather get something get job done drive slightly above speed limit never below speed limit analogously would price economical cpu efficient take le watt produce le heat slightly faster need aaa game fps bottlenecked rtx ti gpu esports title get fps importantly fast enough feel snappy hate something freeze even split second
intel-i5-12400f,5.0,6/3/2022 17:33,bestbuy,good price better value amd counterpart time purchase run game very well gpu also bought great lowerend budget build
intel-i5-12400f,5.0,5/20/2022 15:27,bestbuy,great chip great price good thermal great low sale price conveniently compatible lower tier motherboards like b
intel-i5-12400f,5.0,2/18/2024 9:41,bestbuy,very fast responsive processor no complaint perfect very productive computer
intel-i5-12400f,5.0,5/22/2023 11:28,bestbuy,processor scream speed make applacations run quicker
intel-i5-12400f,4.0,8/1/2023 12:02,bestbuy,wa worth price run smoothly doe work without lag
intel-i5-12400f,4.0,11/20/2022 0:40,bestbuy,intel f great value however barely miss mark value get realm good budget hedge anyone trying decently fast computer upgrade potential probably good enough people anyone already amd series upgrade using motherboard probably good enough building new computer trying hedge potential reuse motherboard th gen also good enough prosumer use gpu wa getting old computer didnt really need one moment decided get nonf version reason bad value though f series command much premium cooler useless spent literally hour trying get cooler fit motherboard fastener wouldnt work fastener permanently attached impossible use screw salvage cooler dont rely cooler thankfully spare cooler wa really trying use one build
intel-i5-12400f,5.0,11/12/2023 16:05,bestbuy,run fast cool enough cpu gamers whats not love
intel-i5-12400f,4.0,2/3/2023 22:36,bestbuy,processor very good turbo speed depend largely board memory quality speed heatsink fan somewhat loose leg reason star heavy gamer go built pc going medium server mostly music enough
intel-i5-12400f,5.0,10/27/2023 16:55,bestbuy,great product would recommend ever need upgrade cpu
intel-i5-12400f,5.0,5/3/2023 16:24,bestbuy,great price speed son enjoying gaming machine
intel-i5-12400f,5.0,4/23/2022 19:14,bestbuy,great cpu very fast doe job bought build window system
intel-i5-12400f,5.0,2/22/2022 0:37,bestbuy,perfect gaming great price would wait sale ive seen
intel-i5-12400f,5.0,3/29/2022 10:39,bestbuy,upgraded amd ryzen thing absolutely demolishes wa using make wish sooner got vetroo heat pipe cooler idle c cant believe temp performance
intel-i5-12400f,5.0,5/13/2022 17:18,bestbuy,benchmark place chip faster k gaming fraction power sale chip perfect basic build
intel-i5-12400f,5.0,3/30/2022 13:29,bestbuy,seem find best price quality product without worry price drop buy not best quality thank staying business shutdown others closed good
intel-i5-12400f,5.0,4/9/2022 0:24,bestbuy,great chip high efficiency good clock reasonable price
intel-i5-12400f,5.0,4/22/2022 11:03,bestbuy,cpu wont win speed competition sufficient task paired dedicated gpu play game quite well dont even think using integrated gpu anything light task not good
intel-i5-12400f,5.0,6/5/2022 6:28,bestbuy,work great no issue installation wa easy stock cooler actually look decent little heft using market cooler make sure support socket
intel-i5-12400f,5.0,11/18/2022 16:30,bestbuy,excellent value processor gaming productivity task
intel-i5-12400f,5.0,5/17/2022 9:59,bestbuy,great nasa build allows plenty headroom vms docker container
intel-i5-12400f,5.0,8/4/2022 22:47,bestbuy,best value price performance core thread process
intel-i5-12400f,5.0,4/11/2022 6:05,bestbuy,great processor wa looking work great
