Product,Rating,Date,Source,Review
intel-i7-11700k,5.0,4/1/2021 9:08,bestbuy,no review processor first very surprised anyways recently bought msi z mb k quickly noticed primary slot no function research th gen intel cpu doe not support pcie th gen slot th gen doe said screw th gen going unlock mb im buying even k benchmark program turn out faster run tad bit hotter k faster cheaper ryzen x series chipset motherboard th gen cpu must support feature
intel-i7-11700k,5.0,11/3/2023 15:29,bestbuy,currently using faster anything ive used best
intel-i7-11700k,5.0,7/14/2023 19:49,bestbuy,work expected no problem far good buy may say best buy
intel-i7-11700k,5.0,6/2/2023 22:44,bestbuy,realllllllllllllllllllllllllly like product
intel-i7-11700k,5.0,12/2/2022 19:09,bestbuy,good processor gaming reasonable price highly recommended
intel-i7-11700k,5.0,5/22/2024 17:54,bestbuy,although outdated lga wouldnt recommend buying reason lga motherboard ready great cpu wa running year fully overclocked liquid aio upgraded im enthusiast builder cpu still work great easily year plus yet find game couldnt handle besides city skyline obvious reason pair wonderfully gigabyte gb overclocked could definitely get better graphic card thats time might want run k though looking go higher series rtx card look running k put le strain cpu eliminate gpu bottlenecki would include testbench score no longer computer
intel-i7-11700k,5.0,12/28/2022 10:31,bestbuy,coming really feel difference performance chip basically night day honestly cant find reason choose k series version model
intel-i7-11700k,5.0,1/1/2023 3:01,bestbuy,clearance perfect deal new mobo bb
intel-i7-11700k,5.0,2/3/2023 19:07,bestbuy,pro very fast upgraded th gen processor b motherboard installation wa easy con run hot idle c hi aio cooler wo fan running stock cooler may need upgraded cpu intensive application
intel-i7-11700k,5.0,12/5/2022 15:20,bestbuy,upgraded price paid would silly not buy great cpu youre upgrading older ii
intel-i7-11700k,5.0,9/1/2023 15:31,bestbuy,run like champ would recommend anyone run baldurs gate relly good price point
intel-i7-11700k,5.0,11/24/2023 20:07,bestbuy,perfect pc run smooth fast again came great price
intel-i7-11700k,3.0,5/5/2023 16:18,bestbuy,purchased cpu upgrade existing system workload cpu uplift old one several compatibility issue though th gen wa new core design feature removed no longer support memory enclave feature th gen not secure anymore anyway also compatibility issue vmware esxi x using homelab virtualization box forced format change host o chip also seems unreliable xmp profile enabled bios ive tried brand ram no dice even though theyre listed motherboard compatibility list using asus tuf mb also k awesome linux desktop chip doesnt issue xmp different asus motherboard finally watch out motherboard compatibility check beforehand purchase new motherboard far performance go chip pretty fast compiling software
intel-i7-11700k,5.0,11/20/2023 3:11,bestbuy,upgraded old cpu godsend im glad wa able purchase sale definitely enhanced photography videography workspace excellent gaming well again would hesitate buy total price wa definitely worth sale
intel-i7-11700k,5.0,7/15/2023 20:59,bestbuy,despite chip run hot performs better game like age empire conqueror come basic cooler recommend chip someone really want intel cpu also integrated graphic basic thinking multitasking good choice
intel-i7-11700k,5.0,2/10/2024 7:58,bestbuy,great product upgraded f wont disappointed even though lga getting replaced
intel-i7-11700k,5.0,8/12/2023 19:51,bestbuy,got great price run game far good
intel-i7-11700k,4.0,8/11/2023 16:32,bestbuy,wa very easy mount intel cpu came stock cooler bit thermal paste already cpu performance perfect gb get new cooler got aio corsair elite h wa getting around idle game mobo even turned red led saying temperature wa high corsair airflow x even without side panel wa getting hot af stock cooler youre planning getting cpu intensive task highly recommend buy extra cooler
intel-i7-11700k,5.0,6/25/2023 9:05,bestbuy,work amazing easy install great cpu price
intel-i7-11700k,5.0,8/4/2021 22:19,bestbuy,always loyal intel one huge upgrade make sure motherboard compatible far no problem highly recommend one trusted brand good quality control reliability
intel-i7-11700k,5.0,9/22/2023 20:40,bestbuy,clearance generation back intel cpu machine cpu died popped wa great under thank best buy great staff best buy watertown
intel-i7-11700k,5.0,6/22/2021 12:33,bestbuy,great processor screaming fast doesnt run hot very good price well current gen pcie well z around good value recommend
intel-i7-11700k,5.0,5/5/2024 17:14,bestbuy,speed pc instantly feel like going hz hz not expensive every game run great
intel-i7-11700k,5.0,9/15/2023 11:24,bestbuy,huge upgrade old ryzen work perfectly no issue got good price point sale
intel-i7-11700k,5.0,8/13/2021 19:03,bestbuy,decided go non k cpu main reason not overclocker also not gamer also like cpu low powered even set bios impose limit cpu disabling multicore enhancement thing let run overclocked memory module even keeping cpu locked improvement previous wa significant rendering blu ray movie handbrake resulted cut time wa surprised shocked first could not believed double check setting using cpu render matter fact even added feature setting like adding audio track sub very happy processor wa contemplating amd wa always intel fan wa highly recommended low wattage usage
intel-i7-11700k,5.0,11/19/2023 21:46,bestbuy,pretty good no problem good gaming
intel-i7-11700k,5.0,10/12/2023 19:48,bestbuy,used build niece pc unbeatable price point
intel-i7-11700k,5.0,10/22/2023 15:44,bestbuy,since processor pc ive great experience
intel-i7-11700k,5.0,5/2/2024 10:59,bestbuy,great value worked perfectly computer would recommend
intel-i7-11700k,5.0,9/8/2023 0:57,bestbuy,far ive no issue included fan suck besides no issue
intel-i7-11700k,5.0,4/23/2021 15:51,bestbuy,work great no overclocking didnt want anyways ct enough power anything im long term ill put deskmini h anticipate solid tower currently didnt test integrated graphic pcie worked
intel-i7-11700k,5.0,6/18/2023 19:30,bestbuy,good processor havent issue since us pc build
intel-i7-11700k,5.0,7/6/2021 1:35,bestbuy,excellent processor great gaming performance very fast
intel-i7-11700k,5.0,8/3/2023 23:18,bestbuy,product doe job great item would definitely buy again
intel-i7-11700k,5.0,8/8/2023 10:27,bestbuy,very good performance chip good temperature
intel-i7-11700k,5.0,6/19/2023 8:13,bestbuy,cooler came wa annoying otherwise wa good purchase
intel-i7-11700k,5.0,6/16/2023 23:23,bestbuy,working perfectly lowpower consumption proxmox home security appliance bad last intel processor im going able buy new one inconsistent core thus nearly useless home virtualization sure cant afford xeons home use
intel-i7-11700k,5.0,4/26/2021 22:09,bestbuy,last build year ago wa time upgrade went new way need hopefully last another year overkill need should last year come wa bit pricier should especially compared amd offering im intel guy went like
intel-i7-11700k,5.0,6/9/2021 10:58,bestbuy,motherboard died saw two newer cpu socket type picked pricepower not disappointed really not impressed onboard graphic power motherboard automatically switched nvidia card added not able overstress cpu game play no need overclocking near future run fast cool included cooler
intel-i7-11700k,5.0,12/22/2023 15:49,bestbuy,came nice quality no mark run really good
intel-i7-11700k,5.0,7/14/2023 20:09,bestbuy,definitely upgrade th gen correct motherboard didnt got right one pretty quick
intel-i7-11700k,5.0,5/27/2023 7:26,bestbuy,great cpu check make sure size fit motherboard ive noticed processor end letter f fit reno motherboard
intel-i7-11700k,5.0,6/29/2021 16:28,bestbuy,sweet point price th gen intel cpu price enough get
intel-i7-11700k,5.0,8/10/2023 2:01,bestbuy,pc broke bought new part happened one work good no complaint
intel-i7-11700k,5.0,8/25/2023 16:12,bestbuy,run game smoothly no lag paired decent gpu great frame rate
intel-i7-11700k,5.0,7/23/2021 19:14,bestbuy,great speed no slow down multitasking hope get many useful year
intel-i7-11700k,5.0,1/23/2023 8:14,bestbuy,great price cpu exactly like k unlocked series work really good highly recommend
intel-i7-11700k,5.0,8/12/2023 2:49,bestbuy,run well ti make sure invest liquid cooling though
intel-i7-11700k,5.0,8/6/2023 2:19,bestbuy,great cpu run fast gaming good multitasking
intel-i7-11700k,5.0,9/17/2021 15:57,bestbuy,excellent processor havent much chance put pace dont need overclocking doe everything need quickly using integrated graphic work well routine task pcie version hard drive fly processor
intel-i7-11700k,5.0,8/11/2023 15:29,bestbuy,great cpu budget gaming build suppoted board
intel-i7-11700k,5.0,7/14/2023 19:36,bestbuy,work amazingly highly recommend item youre big pc gamer
intel-i7-11700k,5.0,7/21/2023 19:35,bestbuy,easy install work perfect gaming buget
intel-i7-11700k,5.0,7/12/2023 15:51,bestbuy,needed wanted no issue work great
intel-i7-11700k,5.0,10/1/2021 16:34,bestbuy,awesome th gen cpu usual best buy best pricing intel cpu im looking availability
intel-i7-11700k,3.0,6/23/2023 18:17,bestbuy,wanted build lower spec pc lga mobos lying around surprised price th gen hasnt come going spend build better go th th gen point would not excess computer part
intel-i7-11700k,5.0,11/13/2021 7:58,bestbuy,upgraded pc chose go intel previously amd cpu made big improvement overall performance very happy purchase thank best buy
intel-i7-11700k,5.0,8/22/2021 12:19,bestbuy,run expected work well asus z board got
intel-i7-11700k,5.0,1/15/2023 16:16,bestbuy,nice cpu doe should without heating room
intel-i7-11700k,5.0,1/28/2022 19:45,bestbuy,coming old xeon v thing monster c performance however strongly recommend upgrade cooler oem one small get loud under load
intel-i7-11700k,4.0,5/29/2021 7:52,bestbuy,intell again stepped game no ocerclcking needed
intel-i7-11700k,4.0,1/7/2023 12:22,bestbuy,exactly wanted price way steep better processor out
intel-i7-11700k,5.0,3/23/2023 20:09,bestbuy,work well vr rig needed low wattage tdp part mini itx vr rig fit bill nicely performance expected turbos nicely
intel-i7-11700k,5.0,10/31/2021 16:00,bestbuy,excellent price service
intel-i7-11700k,5.0,1/6/2023 17:38,bestbuy,work great super fast son love would recommend
intel-i7-11700k,3.0,2/9/2023 9:35,bestbuy,ended returning good cpu stock cooler sucked lock w went ryzen build instead
intel-i7-11700k,3.0,12/30/2022 17:22,bestbuy,processor work expected shipping using usps wa disaster least showed eventually th sereies processor issue series board turn out read documentation pcie work mine doesnt
intel-i7-11700k,4.0,1/21/2022 16:05,bestbuy,intel processor else need say
intel-i7-11700k,5.0,2/14/2024 15:24,bestbuy,very good th gen cpu doe everything need very well wont need upgrade
intel-i7-11700k,5.0,9/15/2023 17:04,bestbuy,work pc build allows better load time loading application happy managed find lower price usual
intel-i7-11700k,5.0,8/25/2023 18:09,bestbuy,definitely upgrade k computer run lot smoother im playing cod warframe
intel-i7-11700k,5.0,1/1/2024 22:36,bestbuy,using cpu unraid server work like charm use intel integrated graphic plex transcoding love
intel-i7-11700k,5.0,9/22/2023 15:24,bestbuy,awesome recommend anyone cant wait get everything done
intel-i7-11700k,3.0,8/4/2023 19:13,bestbuy,nice cpu reasonable price quick delivery
