Product,Rating,Date,Source,Review
intel-i7-11700k,5.0,8/9/2022 20:19,bestbuy,went new build wa replace another prebuilt pc obvious wa recommended site wa comparing whether wa worth forking extra v v leap forward efficiency processing record workflow involves lot high quality audiovideo creation processing including p live stream multiple source software use either leverage software tap onboard graphic use nvidia card old pc lessthanoptimal wasnt going cut new pc rtx nvenc should doable also wanted able offload onboard interchangeably whenever made sense needed cpu able thread efficiently previous serf very well
intel-i7-11700k,5.0,10/27/2023 19:53,bestbuy,price worth performance work well first day almost year later
intel-i7-11700k,5.0,4/15/2021 21:44,bestbuy,cpu performance great powerful fast everything perfect plus widely available
intel-i7-11700k,5.0,5/29/2022 14:36,bestbuy,wa marked easy install everything working great ive read run hot im using kraken x cooling not issue temp not mention see sale pretty regularly definitely worth money
intel-i7-11700k,5.0,4/24/2021 10:19,bestbuy,yet another homerun hit out park intel nice cool running cpu excellent multitasking gaming areal workhorse
intel-i7-11700k,5.0,4/23/2021 17:06,bestbuy,upgraded k k performance increase dramatic pcie fantastic
intel-i7-11700k,4.0,8/14/2021 14:58,bestbuy,good cpu intel core ik offer excellent performance eightcore chip pricing make last resort should buy competing chip out stock need eightcore chip specifically productivity
intel-i7-11700k,5.0,10/2/2023 13:49,bestbuy,always intel fan even gen processor still beast
intel-i7-11700k,5.0,7/7/2021 17:34,bestbuy,amazing performance great value ghz overclock not problem very happy processor
intel-i7-11700k,5.0,5/14/2021 21:38,bestbuy,never seen speed like building pc year
intel-i7-11700k,5.0,10/2/2023 13:31,bestbuy,great cpu buy got lightning fast
intel-i7-11700k,5.0,9/20/2023 3:56,bestbuy,fast cpu around spec cpu no gpu
intel-i7-11700k,5.0,7/16/2021 15:37,bestbuy,great performing processor no complaint get pay
intel-i7-11700k,5.0,8/4/2023 18:40,bestbuy,building new computer beast can not happy
intel-i7-11700k,5.0,8/28/2021 18:21,bestbuy,feel power intel great gaming easy install
intel-i7-11700k,5.0,5/14/2021 16:39,bestbuy,love run great dont overclock run warm not hot
intel-i7-11700k,5.0,3/4/2022 9:43,bestbuy,great gaming got sale wa perfect upgrade super fast good opinion
intel-i7-11700k,5.0,4/19/2021 20:27,bestbuy,fast processor quite upgrade year old processor
intel-i7-11700k,5.0,2/25/2023 8:25,bestbuy,great cpu easy installation work great would recommend
intel-i7-11700k,5.0,7/7/2023 18:44,bestbuy,love work amazing finally getting pc built way wanted
intel-i7-11700k,5.0,10/6/2021 14:00,bestbuy,chip shortage going unfortunate increasing price computer component even increased cost chip msrp think cpu worth upgrading k ran very hot performance increase well temperature decrease noticed new chip astounding one thing wanting get wa p emulation rpcs k computer really struggled emulation giving low framerates high temperature could possibly damaged motherboard noticed new cpu game want play much higher fps compile much quicker addition program computer addition o running much quicker very happy added benefit k wa little bit old support window new k doe support window wa able install launch day
intel-i7-11700k,4.0,5/11/2021 19:44,bestbuy,fast cpu gamers decent price doe not come cooler need pick one fit lga wa able hit ghz stable cooling corsair aio
intel-i7-11700k,5.0,8/12/2022 16:31,bestbuy,processor great upgrade paired gaming motherboard video card amazing computer
intel-i7-11700k,4.0,8/13/2021 23:18,bestbuy,overall great buy looking extra speed nvme x motherboards upgraded th generation simply factor
intel-i7-11700k,5.0,7/7/2023 15:39,bestbuy,worked wonderfully would absolutely recommend anyone
intel-i7-11700k,5.0,6/10/2023 1:18,bestbuy,run better old didnt change cooler
intel-i7-11700k,5.0,7/14/2023 20:07,bestbuy,good work great no issus ever
intel-i7-11700k,5.0,5/27/2023 16:07,bestbuy,far good no problem yet good performance happy packaging
intel-i7-11700k,5.0,6/9/2023 5:59,bestbuy,cpu personally wish waited week k series
intel-i7-11700k,5.0,6/2/2023 15:21,bestbuy,product work fit perfectly havent issue far
intel-i7-11700k,5.0,6/24/2023 19:48,bestbuy,perfect perfect perfect perfect perfect perfect perfect
intel-i7-11700k,5.0,11/19/2021 17:08,bestbuy,no trouble installing intel ik processor asus z wifi motherboard processor extremely fast stable
intel-i7-11700k,5.0,5/17/2023 16:26,bestbuy,wa nice cpu upgraded faster thought
intel-i7-11700k,4.0,11/30/2023 11:18,bestbuy,great cpu beginner build doe job well
intel-i7-11700k,4.0,9/18/2023 2:51,bestbuy,pretty good processor time came out would recommend build requiring th gen
intel-i7-11700k,4.0,5/14/2022 7:39,bestbuy,power hungry le performant latest th generation core processor intel not worth cost unless stuck intels lga platform said beastly processor very capable handling workload brings gen pcie connectivity compatible nvme ssds gpus best option want unlocked processor lga platform th gen also core thread cost lot dont z series motherboard make sure support cpu not series board support th gen processor even expensive z series board looking asus check motherboard manufacturer cpu compatibility list first
intel-i7-11700k,5.0,11/25/2021 18:42,bestbuy,computer run fast love new processor much open want run perfectly
intel-i7-11700k,5.0,12/11/2021 15:02,bestbuy,very nice cpu run fast work great gaming no problem
intel-i7-11700k,5.0,5/2/2022 12:35,bestbuy,working great love processor fastest one ive ever used
intel-i7-11700k,5.0,2/22/2022 22:27,bestbuy,paired msi za pro board wa able easily quickly achieve ghz core overclock mm aio cooling rock solid stable xmp profile ram thing absolutely crush previous ik cpu noticed big difference fps overall strongly recommend good outofthebox processor fantastic overclocking price point
intel-i7-11700k,5.0,2/18/2022 15:38,bestbuy,good processor powerful need decent air cooler stay cool
intel-i7-11700k,5.0,10/27/2021 9:37,bestbuy,got sale great performance almost fast k much better price
intel-i7-11700k,4.0,4/21/2022 14:04,bestbuy,amazing cpu bur run very hot regular cm hyper not enough core monster ended getting aio make sure enough cooling card
intel-i7-11700k,5.0,1/27/2022 13:18,bestbuy,no complaint doe supposed pretty big jump
intel-i7-11700k,5.0,5/15/2022 8:48,bestbuy,wa easy install work great very fast
intel-i7-11700k,5.0,8/6/2021 17:36,bestbuy,excellent cpu wa sceptacle negative review glad purchased overclocked ghz core v highest temp c well below normal
intel-i7-11700k,5.0,6/1/2021 9:51,bestbuy,good processor out box already strong personally didnt feel need oc w heat good cooling ventilation no problem
intel-i7-11700k,4.0,6/24/2023 19:09,bestbuy,bought nephew pc far not complained assume good
intel-i7-11700k,5.0,6/3/2022 14:36,bestbuy,love k thing even minor overclock beat very good gaming super framerates right gpu cool mine cooler master air doe great need gaming even though newer better cpu
intel-i7-11700k,5.0,5/28/2021 16:13,bestbuy,paired correct mb ram hell cpu very fast easy overclock really dont need fast right out box
intel-i7-11700k,5.0,5/7/2021 22:16,bestbuy,easily overclocked ghz rock solid even under constant load doe make heat put mm water cooler system no issue
intel-i7-11700k,5.0,5/21/2021 19:11,bestbuy,got upgrade f bottle necking gpu none plus best buy price match made even better
intel-i7-11700k,5.0,11/14/2022 22:21,bestbuy,great processor price run super smooth run game play without worrying lag play valorant cod minecraft game
intel-i7-11700k,5.0,12/8/2021 0:06,bestbuy,fast powerfulit run pretty warm without semiaggressive cooling though thats par course th gen core especially put water cooler under maximum load never stutter exceeds c definitely nice little chip
intel-i7-11700k,5.0,10/17/2021 0:01,bestbuy,go ahead buy already know youve probably looking cpu comparing ik ik right buy one spend extra cash saved preferred method cooling mkay
intel-i7-11700k,5.0,9/27/2021 13:04,bestbuy,bought new build definitely feel im set quite upgrade again good feeling
intel-i7-11700k,5.0,1/16/2023 9:07,bestbuy,great power great price upgraded changed entire experience pc better
intel-i7-11700k,4.0,5/19/2021 3:28,bestbuy,great cpu plenty headroombut say chip tendency run hot time testing got almost c wa minimal load may due overclocking still something keep mind
intel-i7-11700k,5.0,8/27/2022 5:16,bestbuy,fast wonderful quick loading definite good investment youre not wanting front dough great processor im glad picked
intel-i7-11700k,5.0,5/19/2021 14:10,bestbuy,im very happy performance processor doe not run nearly hot k
intel-i7-11700k,5.0,1/27/2023 16:26,bestbuy,great not best deal wa good product though doe th series
intel-i7-11700k,5.0,4/23/2021 16:11,bestbuy,work great run cool pcie gen nice along rebar dont regret going
intel-i7-11700k,5.0,4/30/2021 17:39,bestbuy,first time useing love use gaming comp no graphic card
intel-i7-11700k,5.0,3/22/2022 14:36,bestbuy,work benchmark expected intel extreme tuning utility many overclock setting way head very happy purchase would highly reccomend
intel-i7-11700k,5.0,1/17/2023 3:22,bestbuy,absolutely love cpu monster chewed everything thrown
intel-i7-11700k,5.0,6/30/2022 14:10,bestbuy,very powerful cpu installed application server small business company report no slowness using new application server
intel-i7-11700k,5.0,3/11/2023 15:57,bestbuy,needed new cpu support pcie work great fast
intel-i7-11700k,5.0,1/2/2023 5:35,bestbuy,powerful cpu amazing gaming performance paired kraken z keep thing check
intel-i7-11700k,5.0,9/24/2022 21:42,bestbuy,amazing cpu th gen misunderstood want upgrade older gen cant go wrong cpu
intel-i7-11700k,5.0,3/16/2022 9:08,bestbuy,extraordinarily fast paired mm aio cpu chew spit out anything throw great value v ryzen dollar amount
intel-i7-11700k,5.0,2/4/2023 10:08,bestbuy,build far good running game p no problem
intel-i7-11700k,5.0,11/23/2021 22:19,bestbuy,good gaming good browsing good everything plan using desktop setup sure get dedicated gpu integrated graphic bad
intel-i7-11700k,5.0,7/9/2022 21:41,bestbuy,great item great power price came quick wa perfect condition upon arrival couldnt easier transaction
intel-i7-11700k,5.0,2/18/2023 10:06,bestbuy,work almost fast didnt even noticed difference
intel-i7-11700k,5.0,5/6/2022 16:02,bestbuy,looking cpu th gen intel board one get slower k cost le time purchase also not hot k wa able reuse cpu cooler saved money performance wise nothing cant handle unless running something application specific reliability far rock solid paired z aorus master however looking upgrade today may want look k
intel-i7-11700k,5.0,2/10/2023 15:31,bestbuy,awesome cpu even today gaming still play modern gaming
intel-i7-11700k,5.0,6/17/2022 15:47,bestbuy,great cpu price doesnt run hot dont overclock mine run mhz ram gear amazingly lucky
intel-i7-11700k,5.0,12/11/2021 16:27,bestbuy,fast processor work great put asus z pro wifi g ram g ssds g hard drive fast easy window running hour
intel-i7-11700k,5.0,12/9/2022 16:26,bestbuy,built friend mine boy happy performance
intel-i7-11700k,5.0,11/24/2021 6:52,bestbuy,upgraded home na server th gen absolutely notice increased performance better transcoding video newer integrated graphic
intel-i7-11700k,5.0,2/6/2023 0:10,bestbuy,cpu good run smoothly excellent
intel-i7-11700k,4.0,8/3/2022 22:03,bestbuy,work great get little hot clocking large fan rad still ran hot reason wa two core would heat past crash pc running cnc application create path
intel-i7-11700k,5.0,12/10/2021 13:00,bestbuy,know th gen new hotness dont regret built good luck finding ddr ram board get ready pay scalper price world doesnt end pandemic ddr carry still fast anything need unless youre weird nasa research mad scientist stuff even maybe onboard graphic need say gpu market way uhd k hz monitor breeze almost gt especially since theyre using ddr seems
intel-i7-11700k,3.0,4/24/2023 11:53,bestbuy,ordered processor picked waldorf store well got home opened box low behold wa processor box
intel-i7-11700k,5.0,11/29/2022 19:20,bestbuy,upgraded easy swap work great gaming pc
intel-i7-11700k,5.0,11/26/2022 18:21,bestbuy,great processor love work great pc
intel-i7-11700k,5.0,12/27/2022 17:16,bestbuy,cpu nice overclock got resonable price
intel-i7-11700k,5.0,1/28/2022 16:38,bestbuy,excellent processor wanted k motherboard didnt support chipset recommend processor gaming
intel-i7-11700k,5.0,12/5/2022 0:09,bestbuy,great value money great upgrade modern game
intel-i7-11700k,5.0,3/11/2022 17:58,bestbuy,geek squad computer system running smoothly intel core upgrade loving performance
intel-i7-11700k,5.0,8/16/2022 20:43,bestbuy,really good cpu best buy price matched got le love price match
intel-i7-11700k,5.0,12/3/2022 6:50,bestbuy,easy install unbelievably doe not get hot
intel-i7-11700k,3.0,7/7/2023 18:35,bestbuy,bought new build review again finished needed nvme ssd slot work
intel-i7-11700k,5.0,4/15/2022 11:07,bestbuy,good mid range cpu gaming work get pcie happy
intel-i7-11700k,5.0,12/11/2021 10:44,bestbuy,work well easily overclockable needed cpu upgrade old boring definitely trick
intel-i7-11700k,5.0,4/10/2022 17:03,bestbuy,amazing cpu especially price point used cpu gaming pc build
intel-i7-11700k,5.0,1/25/2022 20:07,bestbuy,kid very happy fast new computer installed easily work great
intel-i7-11700k,5.0,2/9/2023 13:29,bestbuy,certainly higher clocked newer generation processor available cpu no slouch plenty everything youd want personal productivity gaming rig highly recommended
intel-i7-11700k,5.0,2/12/2022 5:11,bestbuy,great processor love intel brand right speed latest build
intel-i7-11700k,4.0,6/4/2021 15:43,bestbuy,powerful cpu lot core little expensive though waited year upgrade wa worth
intel-i7-11700k,5.0,6/19/2022 3:02,bestbuy,cpu out perform f cpu very little oc
intel-i7-11700k,5.0,3/9/2022 19:52,bestbuy,great cpu th gen intel core thread great gaming
intel-i7-11700k,5.0,11/12/2021 9:04,bestbuy,far good power functionality need easy install set
intel-i7-11700k,5.0,10/1/2021 15:42,bestbuy,super fast reliable cpu needed one cant wait th good next year
intel-i7-11700k,5.0,12/4/2021 7:26,bestbuy,one fastest cpu available no issue price wa matched well competitor
intel-i7-11700k,5.0,1/5/2022 16:22,bestbuy,bought upgrade rig performance wa k
intel-i7-11700k,5.0,3/11/2022 16:11,bestbuy,good price powerful processor got pair z ultra
intel-i7-11700k,5.0,5/27/2022 16:32,bestbuy,great processor fast easy install recommended
intel-i7-11700k,4.0,9/17/2021 16:00,bestbuy,well built easy install love shutter video quality good
intel-i7-11700k,5.0,1/7/2022 16:11,bestbuy,nice product would recommend nice price also easy install
intel-i7-11700k,5.0,3/24/2022 17:26,bestbuy,very good processor no complaint
intel-i7-11700k,5.0,1/7/2022 15:58,bestbuy,doe job nicely plus fantastic price point value
intel-i7-11700k,5.0,1/7/2022 21:28,bestbuy,excellent highly recommend run great extremely fast
intel-i7-11700k,5.0,3/25/2022 17:05,bestbuy,great processor price buy without regret
intel-i7-11700k,5.0,10/22/2021 13:55,bestbuy,fast core cpu price best buy stock price match
intel-i7-11700k,5.0,2/12/2023 11:46,bestbuy,guidance assistance best buy staff very pleased item floor staff rock total tech rock computer build thing beauty
intel-i7-11700k,5.0,2/11/2022 16:34,bestbuy,extremely fast run cool aio fan
intel-i7-11700k,5.0,12/6/2022 2:49,bestbuy,bought christmas gift know going love one cant wait till install cpu motherboard experience flawlesness cpu offer
intel-i7-11700k,5.0,12/16/2021 9:55,bestbuy,working great far im used core th gen laptop th gen gaming pc fantastic thing run fast smooth ive got cpu usage monitor streamdeck even running game normally would locked laptop using cpu love
intel-i7-11700k,4.0,5/15/2022 8:03,bestbuy,good cpu except higher power draw useful especially overclocked otherwise enough gaming general us
intel-i7-11700k,5.0,12/10/2021 18:15,bestbuy,cpu performs great also very easy install
intel-i7-11700k,5.0,10/14/2022 15:44,bestbuy,great performance right cooling solution pretty good thermal im running z board clocked corsair hi stay around celsius even extended gaming session
intel-i7-11700k,5.0,10/17/2021 11:39,bestbuy,work advertised easy install good choice
intel-i7-11700k,4.0,12/11/2021 13:39,bestbuy,nice cpu went x liked new intel mobos bit better amd offering work great very fast overclocked power hungry
intel-i7-11700k,5.0,1/1/2022 11:26,bestbuy,computer part im not really technical know spilled water desk very small amount got pc enough fry bad boy needed new one although wasnt happy spending much replace multiple partsmy computer saved
intel-i7-11700k,4.0,12/6/2022 11:06,bestbuy,decent especially would buy again price le
intel-i7-11700k,5.0,2/6/2022 17:01,bestbuy,processor core component pc build mine best component igpu run game p fps also startup amazing timed second get gpu imagine build run great help processor
intel-i7-11700k,4.0,9/17/2021 9:05,bestbuy,pretty good cpu gaming lighter multithreaded task memory overclocking gear generally not good k v k seems major difference mhz core clock dont mind get potential k le
intel-i7-11700k,5.0,3/20/2023 22:55,bestbuy,cant go wrong budget build unlocked series clocking well great
intel-i7-11700k,5.0,2/28/2023 22:45,bestbuy,go clearance best processor motherboard handle far work great fast shipping
intel-i7-11700k,4.0,11/2/2021 7:01,bestbuy,every thing worked gave star get help random guy imployees not know abought pc part
intel-i7-11700k,4.0,3/27/2022 2:20,bestbuy,great price cpu not fast would expect still price pretty good
intel-i7-11700k,5.0,3/31/2023 15:43,bestbuy,great cpu fast working perfectly no overheating issue evem overclocked
intel-i7-11700k,5.0,2/11/2022 17:06,bestbuy,mr toby pickle wa geek wa personable professional highly skilled could not better service ever paying not enough thanks excellent work toby
intel-i7-11700k,4.0,12/19/2021 21:27,bestbuy,would not pay msrp pretty good discount get incredibly hot power hungry
intel-i7-11700k,5.0,8/20/2022 10:13,bestbuy,fast running cool temperature nothing else say ryzen x little bit powerful running very hot under load
intel-i7-11700k,4.0,3/18/2022 22:09,bestbuy,great cpu decent price got even cheaper via best buy price match
intel-i7-11700k,3.0,3/31/2023 16:15,bestbuy,thing run super hot make sure good liquid cooling set not much performance gain k single digit increase
intel-i7-11700k,5.0,4/1/2023 6:07,bestbuy,th gen cpu good performance work well fast
intel-i7-11700k,4.0,10/24/2021 0:47,bestbuy,got gamers bundle purchase l whixh wa cool upgraded k wa waiting awhile really feel improvement game notice inprovement not drastic k oc ghz noticed inatalling game task faster though wa expecting lightning fast speed purchased sale wa lowest seen far
intel-i7-11700k,5.0,1/9/2023 14:55,bestbuy,looking chip run series gpus dawg
intel-i7-11700k,5.0,7/9/2022 21:39,bestbuy,great item great power price came quick wa perfect condition upon arrival couldnt easier transaction
intel-i7-11700k,5.0,5/6/2022 19:29,bestbuy,upgraded home pc good processor easy set occassional lock probably setting overlooking
intel-i7-11700k,5.0,3/24/2023 17:52,bestbuy,gooooooooooooooooooooooooooooooooooooooooooooooood
intel-i7-11700k,5.0,12/29/2021 0:27,bestbuy,great cpu wa able get sale wa worth getting no problem noticed much better game running k
intel-i7-11700k,5.0,2/17/2023 16:26,bestbuy,great processor use daily should get
intel-i7-11700k,4.0,3/2/2022 19:14,bestbuy,doe job ideally youre better th gen
intel-i7-11700k,5.0,5/13/2022 16:43,bestbuy,good cpu run anything load wont ridiculously high not k get job done
intel-i7-11700k,5.0,9/26/2021 1:41,bestbuy,not worth price unless plan taking advantage thing processor example gen storage
intel-i7-11700k,5.0,12/10/2021 17:57,bestbuy,processor fantastic easily handle game application always fan help continue fan
intel-i7-11700k,5.0,2/25/2022 20:45,bestbuy,good processing power wa able get price match wa nice overclocks well no issue heat dissipation
intel-i7-11700k,5.0,11/20/2022 23:25,bestbuy,loved much bought second one another pc build very happy
intel-i7-11700k,5.0,10/13/2022 14:05,bestbuy,work fantastic great purchase run doesnt issue playing
intel-i7-11700k,5.0,11/5/2021 17:52,bestbuy,amazing unlocked cpu asus bios combination intel chip perfect match lga socket need liquid cpu cooler also run hot
intel-i7-11700k,5.0,11/13/2022 21:23,bestbuy,great upgrade wife pc out f huge difference
intel-i7-11700k,5.0,12/2/2022 19:00,bestbuy,always intel excellent quality performance best
intel-i7-11700k,5.0,6/4/2022 13:31,bestbuy,computer building bug bit built amd pc last year intel custom cooling build beckons
intel-i7-11700k,5.0,10/25/2022 3:27,bestbuy,big upgrade awesome deal bundle motherboard
intel-i7-11700k,5.0,12/6/2022 9:15,bestbuy,good cpu good cpu good cpu good cpu good cpu dhhsshhshssh
intel-i7-11700k,5.0,5/19/2022 12:13,bestbuy,pair good liquid cooler boost lock mhz ease cpu beast
intel-i7-11700k,5.0,12/20/2021 0:10,bestbuy,q brand doe motherboard use many watt psu upgrade gpu rtx without changing part
intel-i7-11700k,5.0,12/9/2022 19:12,bestbuy,perfect buy perfect amazing easy cheap
intel-i7-11700k,5.0,10/26/2022 14:22,bestbuy,cpu capable handling quite lot software thrown
intel-i7-11700k,5.0,1/15/2022 0:21,bestbuy,upgrade computer computer work much faster game run fps faster good cpu
intel-i7-11700k,5.0,9/13/2022 23:33,bestbuy,great product highly recommend work great shipping wa great
intel-i7-11700k,5.0,3/17/2022 4:25,bestbuy,intel make great cpu one work great msi motherboard highly recommend
intel-i7-11700k,5.0,1/11/2022 1:36,bestbuy,son upgraded intel core definitely see difference playing fortnite
intel-i7-11700k,5.0,12/24/2021 21:25,bestbuy,work great no problem could bought cheaper online chose best buy return policy
intel-i7-11700k,5.0,5/21/2022 11:27,bestbuy,perfect exactly wa looking also compatible setup
intel-i7-11700k,5.0,4/22/2022 18:25,bestbuy,installation wa breeze processor run well build component
intel-i7-11700k,5.0,1/23/2022 21:44,bestbuy,awesome looking upgrade core k im extremely happy
intel-i7-11700k,5.0,12/26/2021 1:01,bestbuy,great cpu doe eeverything need im music producer pc never ran better cpu
intel-i7-11700k,5.0,11/29/2021 5:38,bestbuy,quite upgrade easily ocd ghz z board also get pcie cpu
intel-i7-11700k,5.0,5/13/2022 17:46,bestbuy,cpu beast power thing
intel-i7-11700k,5.0,4/24/2022 13:35,bestbuy,plenty power need run great system happy purchase
intel-i7-11700k,5.0,2/25/2022 16:46,bestbuy,built desktop computer part doe exactly need
intel-i7-11700k,5.0,5/23/2022 2:43,bestbuy,nice work vary well computer not hard set
intel-i7-11700k,5.0,1/23/2022 11:18,bestbuy,great cpu very fast easily overclockable love core thread
intel-i7-11700k,3.0,6/18/2021 6:04,bestbuy,great didnt output perfromance ecpeteced
intel-i7-11700k,5.0,2/11/2022 6:16,bestbuy,solid cpu would buy again went form amd intel ill never go back
intel-i7-11700k,5.0,12/15/2021 17:33,bestbuy,best cpu ive purchased far issue getting worked out
intel-i7-11700k,5.0,11/5/2021 15:26,bestbuy,great processor z motherboard get pcie direct access nvme drive
intel-i7-11700k,5.0,11/19/2021 21:42,bestbuy,excellent demanding application handle modern future workload
intel-i7-11700k,5.0,5/23/2022 15:25,bestbuy,very good product definitely recommend everyone
intel-i7-11700k,5.0,1/14/2022 16:25,bestbuy,great processor super fast easy install doe supposed
intel-i7-11700k,5.0,1/14/2022 16:31,bestbuy,work best intended doesnt even get hot recommended
intel-i7-11700k,5.0,5/2/2022 18:09,bestbuy,easy install able overclok ghz
intel-i7-11700k,5.0,12/10/2021 17:12,bestbuy,great buy great product availability very happy purchase
intel-i7-11700k,5.0,2/10/2022 20:30,bestbuy,good cpu cheap build computer kid would recommend
intel-i7-11700k,5.0,4/29/2022 16:16,bestbuy,amazing one best item help build pc
intel-i7-11700k,5.0,1/21/2022 22:45,bestbuy,great processor excellent efficiency power no overclockneeded
intel-i7-11700k,5.0,3/4/2022 21:49,bestbuy,core good got sea day love
intel-i7-11700k,5.0,11/21/2021 3:25,bestbuy,recommend cpu th gen great enough power
intel-i7-11700k,5.0,2/11/2022 23:15,bestbuy,great quality super fast processor not super expensive
intel-i7-11700k,5.0,2/11/2022 20:12,bestbuy,work great bought build work amazing
intel-i7-11700k,5.0,3/18/2022 15:50,bestbuy,work great instruction clear concise
intel-i7-11700k,5.0,10/2/2021 18:30,bestbuy,very quick rank th percentile fast efficient
intel-i7-11700k,5.0,2/11/2022 16:27,bestbuy,work great used new computer build
intel-i7-11700k,5.0,2/20/2022 1:46,bestbuy,better amd work need todo
intel-i7-11700k,5.0,12/31/2021 15:51,bestbuy,great product pricel great product price
intel-i7-11700k,5.0,11/6/2021 0:16,bestbuy,intel always go cpu model not disappoint
intel-i7-11700k,5.0,10/28/2021 14:32,bestbuy,wa worth every penny love took pc next level
intel-i7-11700k,5.0,11/13/2021 20:45,bestbuy,very nice product great manufature highly recommend
intel-i7-11700k,5.0,10/22/2021 16:00,bestbuy,computer go much faster love vroom vroom
intel-i7-11700k,5.0,9/24/2021 19:03,bestbuy,great item computer would def recommend
intel-i7-11700k,4.0,12/18/2021 10:01,bestbuy,pretty fast cpu hard recommend gaming priced k bit shopping buy
intel-i7-11700k,4.0,3/19/2022 16:19,bestbuy,seems good cpu far voltage little high ghz
intel-i7-11700k,4.0,2/26/2022 4:52,bestbuy,work well wish faster whit
intel-i7-11700k,3.0,10/29/2021 12:39,bestbuy,not major upgrade th th series im disappointed thing gained wa pci bandwith z board
