Product,Rating,Date,Source,Review
intel-i5-12400f,5.0,"May 11, 2024",amazon,got never go above usage game play again always play p higher great
intel-i5-12400f,5.0,"February 9, 2024",amazon,bought cpu put budget build girlfriend cpu fantastic get solid fps absolutely no frame drop under fps fortnite overwatch many others cpu underpowered super imagine well would run something like also read wa expecting thermal issue stock cooler received water cooler ordered cooler no problem keeping cpu cool under load thing wa removed preapplied paste applied mx thermal paste overall great budget cpu gaming
intel-i5-12400f,5.0,"February 29, 2024",amazon,intel core f fairly good processor looking good performance budget real issue temperature fella pack lot heat stock cooler might not enough people already ordered air cooler see get temp under control
intel-i5-12400f,5.0,"January 15, 2024",amazon,good mid tier cpu run aaa game p paired gpu go option expensive e core isnt something need e core add heat raise tdp negative someone like doesnt need sweet spot intel socket lineup right
intel-i5-12400f,5.0,"May 19, 2024",amazon,tal cual la publicacin ha funcionado perfecto en este me que llevo con esta cpu
intel-i5-12400f,4.0,"March 7, 2024",amazon,est bien ha cumplido su funcin sin ningn problema solo que el disipador apesta
intel-i5-12400f,5.0,"December 29, 2023",amazon,intel no surprised didnt want break bank much needed upgrade gaming rig replaced cpuboardmemory very reasonable cheap price work perfectly much faster previous gen replaced
intel-i5-12400f,5.0,"March 1, 2024",amazon,great cpu
intel-i5-12400f,5.0,"March 26, 2024",amazon,everything seems good far
intel-i5-12400f,5.0,"March 26, 2024",amazon,good
intel-i5-12400f,5.0,"February 21, 2024",amazon,tiene un excelente rendimiento como todos los pro que requieren grficos dedicados lo nico malo aqu e su cooler de estock que no lo cubre por completo por lo que si necesitas parajeugos exigentes tendrs que poner uno de aire de buena calidad un lquido
intel-i5-12400f,5.0,"February 27, 2024",amazon,por el momento funciona perfectamente para la prestaciones que le dado fcil de instalar solo que no use su disipador de calor ya que use uno aparte mejor
intel-i5-12400f,5.0,"March 1, 2024",amazon,llego ante de tiempo en excelente estado muy bien empacadomuchas gracias
intel-i5-12400f,5.0,"January 15, 2024",amazon,never thought would praising intel money right jan best get money also bought really budget p gaming above
intel-i5-12400f,5.0,"December 13, 2023",amazon,core good almost video card market intel go wrong day intel really care long within budget building care processing last year no issue dont overclock wouldnt overclock wife pc dont feel like hearing disappointment voice
intel-i5-12400f,5.0,"February 24, 2024",amazon,la entrega fue rpida en perfecto estado
intel-i5-12400f,5.0,"February 26, 2024",amazon,recomiendo el artculo al vendedor
intel-i5-12400f,5.0,"February 26, 2024",amazon,im happy buy
intel-i5-12400f,5.0,"December 20, 2022",amazon,im honestly blown away performance th gen intel chip single core performance amazing important user multi core performance fantastic well nonf version workstation f gaming rig yes liked enough buy second one great use case paired rtx ti gaming time cpu load well under favorite game us processor lol reference game k maxed setting tv p p may load shifted cpu still wouldnt expect break sweat under title including aaa title buy confidence dont fall victim anyone telling need game not necessary unless maybe designer want one computer cpu horsepower work also game spare time
intel-i5-12400f,5.0,"December 29, 2023",amazon,dont pair something faster rx im xt bottleneck
intel-i5-12400f,5.0,"January 25, 2024",amazon,recomendado muy buena
intel-i5-12400f,5.0,"January 18, 2024",amazon,arrived time work described
intel-i5-12400f,5.0,"December 29, 2023",amazon,llego tiempo como se esperaba muy bien empaquetado no quejo de nada
intel-i5-12400f,5.0,"January 8, 2024",amazon,described excellent performance price
intel-i5-12400f,5.0,"December 30, 2023",amazon,intel work good heavy gamesand extremely fast pc
intel-i5-12400f,5.0,"December 17, 2023",amazon,gave grandson pc love
intel-i5-12400f,3.0,"February 7, 2024",amazon,blade fan wa broken arrive wa thrown box wa used
intel-i5-12400f,4.0,"August 19, 2023",amazon,stock temperature dissipator not best easily reach c fthe packaging wa somewhat damaged
intel-i5-12400f,5.0,"June 29, 2023",amazon,first not dedicated gpu make sure get nonf version f solid choice great time snag one lga motherboards use cpu also upgrade th gen maybe even th gen bios update need hold go th th gen f absolute terrific choice
intel-i5-12400f,5.0,"August 13, 2023",amazon,got replace performs even faster old core great gaming general use believe run cooler old highly recommend type gaming one favorite cpu
intel-i5-12400f,5.0,"November 22, 2023",amazon,easy install no issue booted right
intel-i5-12400f,5.0,"July 16, 2023",amazon,intel f really hit sweet spot performance price set mine msi pro bma motherboard not mess bios want play game run look great no bottlenecking best could spend
intel-i5-12400f,5.0,"September 23, 2023",amazon,very good chip graphic card bought rx xt watched many benchmarcks made buy im very happy performance
intel-i5-12400f,5.0,"July 12, 2023",amazon,easily best cpu value intel standard least gaming pc wont need current moment unless youre going super overkill spec simply arent compatible very obviously subject change time go work great rtx graphic card
intel-i5-12400f,5.0,"September 13, 2023",amazon,dont see anyone hate processor great performance well love excellent value alder lake generation
intel-i5-12400f,5.0,"August 23, 2023",amazon,bought cpu msi motherboard awesome gaming smooth performance doesnt overload problem run cool original fan got wa sale totally recommend processor totally recommend product
intel-i5-12400f,5.0,"August 12, 2023",amazon,medium could not loaded fast cpu im love response timing best bang bunch especially performs play lot high performance game stay degree great processor
intel-i5-12400f,5.0,"August 23, 2023",amazon,estoy muy gusto con el procesador e excelente para mi tareas diarias gaming edicin no tengo quejas de el igualmente puedes dejarle el disipador de stock que logras unas buenas temperaturas lo recomendara al
intel-i5-12400f,5.0,"November 1, 2023",amazon,longtime user intel processor great product
intel-i5-12400f,5.0,"October 2, 2023",amazon,buen artculo inclusive la misma caja lleg sin un rasguo no eh tenido problema con el procesador
intel-i5-12400f,5.0,"June 20, 2023",amazon,llevo unos me utilizndolo en mi computadora personal que uso para tareas varias para gaming nunca ha habido seales de temperaturas muy altas cabe destacar que est con su disipador de stockrinde muy bien desde el primer momento de usarlo aun pasado un tiempo sigue rindiendo excelentemente
intel-i5-12400f,5.0,"October 6, 2022",amazon,dont lot heavy gaming work well ive paired rtx havent issue running game however stock cpu fan doesnt seem fit motherboard well asus prime bma struggle keep cool playing intensive game plan replace different cooler soon anyway something keep mind think fan play nice motherboard should fine would also recommend replacing stock thermal paste use included fan
intel-i5-12400f,5.0,"October 27, 2023",amazon,buen producto
intel-i5-12400f,5.0,"September 24, 2023",amazon,fcil de instalar muy potente de buen rendimiento se recomienda
intel-i5-12400f,5.0,"June 8, 2023",amazon,built gaming pc daughter cpu handle everything put z mobo gb ram tb mvme ssd gave old gpu run game fps without coughing
intel-i5-12400f,5.0,"September 1, 2023",amazon,excelente inversion compaia para mi rtx el f que tena le haca cuello de botella
intel-i5-12400f,5.0,"June 5, 2023",amazon,buenas yo llevo m de aos comprando diferentes productos en amazon pero e la primera f que un pedido que haya llegado tan rpido para mi e una gran inversin adems la rapidez calidad del productos son intachables
intel-i5-12400f,5.0,"September 4, 2023",amazon,intel always performed well product processor excellent great buy
intel-i5-12400f,4.0,"August 17, 2022",amazon,cpu seems fine havent noticeable issue fan design terrible one locking pin peg wa bent outwards mine getting seat cpu properly wa nightmare almost wonder received used unitagain cpu fine youd probably better buy aftermarket cooler anyways better temp aesthetic wont deal clumsy design went stock cooler
intel-i5-12400f,5.0,"October 15, 2023",amazon,
intel-i5-12400f,4.0,"June 15, 2023",amazon,good
intel-i5-12400f,5.0,"June 8, 2023",amazon,bought gaming pc im building wasnt aware came fan two already bought another dont want others make mistake
intel-i5-12400f,5.0,"August 21, 2023",amazon,paired gtx ti gb ddr ram everything work perfectly
intel-i5-12400f,5.0,"August 31, 2023",amazon,needed above beyond
intel-i5-12400f,5.0,"July 27, 2023",amazon,sin problemas solo cambien el disipador de stock si van hacer tareas ma exigentes como jugar en configuraciones altas
intel-i5-12400f,5.0,"July 24, 2022",amazon,cpu great run fast great speed preforms good th gen complaint stock cooler not best max turbo get mid c low c under load idle around c stock cooler also very loud trying not overheat cpubut wa very easy fix issue got rd party reseller stock cooler everything wa fine cpu
intel-i5-12400f,3.0,"February 24, 2023",amazon,far cpu work expected included intel cpu cooler completely useless installation process obscure mounting system terrible basically plastic pop rivet hold fan motherboard cooler not work cpu temperature wa almost c motherboard would not let load software high temperature warning replaced intel unit market cooler work very well cpu temperature mid very disappointing experience think use amd processor next time
intel-i5-12400f,5.0,"August 24, 2023",amazon,muy rpido todo gracias
intel-i5-12400f,5.0,"July 8, 2022",amazon,cpu performs would expect come intels cpu fan used third party fan ventroo v extra fan strapped side heatsink pushpull idle temp around degree celsius under load gotten term performance havent ran many benchmark place average term userbenchark compared f sample
intel-i5-12400f,5.0,"March 15, 2023",amazon,bought hold seeing performance dont need core thread mb l cache faster th gen very impressed
intel-i5-12400f,5.0,"July 7, 2023",amazon,another steal item much better purchased local save lot money
intel-i5-12400f,5.0,"February 7, 2023",amazon,muy contento con la compra el procesador funciona perfectamente era la compra que le faltaba mi setup para aumentar la cantidad de fps ahora la grafica no hace cuello de botella todo muy estable llego ante de lo esperado sin problemas mi ciudad bogota
intel-i5-12400f,5.0,"April 19, 2023",amazon,llego semana ante de la fecha de entrega junto con el disipadorahora solo necesito una tarjeta madre para ver si funciona fuera de eso todo bien
intel-i5-12400f,5.0,"May 30, 2023",amazon,justo lo esperado luego de revisar cientos de review e investigar tom una muy buena decisin
intel-i5-12400f,4.0,"November 17, 2022",amazon,honestly thought second came return mean wa work beautiful something go wrong ill return
intel-i5-12400f,5.0,"July 2, 2023",amazon,encanta este procesador cumple con su funcion
intel-i5-12400f,4.0,"January 10, 2023",amazon,el precio se est elevando mucho para este procesador igual e muy bueno
intel-i5-12400f,5.0,"July 31, 2023",amazon,good quality
intel-i5-12400f,5.0,"April 15, 2023",amazon,excelente en todo sentido presentacin embalaje rendimiento tiempo de envo llegada cali colombia solo da producto muy recomendado
intel-i5-12400f,5.0,"May 15, 2023",amazon,rpido eficaz la hora de trabajar jugar sin ningn tipo de problemas
intel-i5-12400f,5.0,"May 7, 2023",amazon,el producto lleg un pocoquito aplastada la caja aun no lo probado
intel-i5-12400f,5.0,"April 3, 2023",amazon,buena compra no tuve ningn problema su funcionamiento e optimo hasta el da de hoy no tenido ningn problema buena compra
intel-i5-12400f,5.0,"April 26, 2023",amazon,work good doesnt get hot enough hot pocket cook microwave loud
intel-i5-12400f,5.0,"May 24, 2023",amazon,wa great price
intel-i5-12400f,5.0,"June 10, 2023",amazon,excelente procesador cumple con la expectativas
intel-i5-12400f,5.0,"August 6, 2022",amazon,upgraded son pc cpu winner great overall bang buck cpu us light gaming school work fast enough sweet spot priceperformance ratio thats perfect nice gaming machine
intel-i5-12400f,5.0,"May 14, 2023",amazon,e demasiado bueno para el precio dios
intel-i5-12400f,5.0,"July 16, 2023",amazon,medium could not loaded
intel-i5-12400f,5.0,"May 16, 2023",amazon,ha funcionado todo genial
intel-i5-12400f,5.0,"April 21, 2023",amazon,muy poderoso rpido para jugar trabajos del da da
intel-i5-12400f,5.0,"November 1, 2022",amazon,proslowest price get six th gen coresgreat performance uplift old run cool using overkill liquid cooler previous systemkeeps rtx fed nicelyconunable overclocknot free
intel-i5-12400f,5.0,"February 19, 2023",amazon,encanto para un inicio de armar un pc para todo juegos trabajos de diseo e una inversionrecomendado
intel-i5-12400f,4.0,"March 26, 2022",amazon,excellent qualityprice processor tdp w performs very well one drawback give star stock heatsink easily reach celsius heatsink
intel-i5-12400f,5.0,"December 1, 2022",amazon,important thing low tdp watt without compromising performance doe built gpu thus using le powerruns cool fast
intel-i5-12400f,5.0,"December 3, 2022",amazon,muy contento con este procesador en juegos rinde super bien calidad precio e excelente lo nico malo e el discipador stock que e malo si lo pueden cambiar e lo ideal
intel-i5-12400f,5.0,"July 22, 2022",amazon,cpu amazing highly recommend buy better cpu fan dont use stock fan come box useless loud dont cool anything im going say again buy better cpu fan
intel-i5-12400f,5.0,"March 9, 2023",amazon,amazing came quickly wa said wa
intel-i5-12400f,5.0,"March 17, 2023",amazon,una pasada este procesador e mucho poder
intel-i5-12400f,5.0,"July 9, 2022",amazon,packaging wa good opened fan fancooler wa intact processor black pin not read properly return lin not option overseas thats expensive
intel-i5-12400f,5.0,"March 2, 2023",amazon,probably best budget cpu market
intel-i5-12400f,4.0,"July 10, 2022",amazon,run anything throw one best budget cpu out
intel-i5-12400f,5.0,"October 6, 2022",amazon,llevo un poco m de me con este cpu no tenido ningn inconveniente corre muy bien en juegos edicin de video recomendado
intel-i5-12400f,5.0,"December 15, 2022",amazon,excelente muy estable rpidohice upgrade desde un este procesador se nota el cambio
intel-i5-12400f,5.0,"September 9, 2022",amazon,much faster old benchmark x faster added video card no built video output cpu performs very well
intel-i5-12400f,5.0,"July 16, 2022",amazon,k wa overclocked ghz cpu big step way powerful way core thread run cooler feel very future proof
intel-i5-12400f,5.0,"March 1, 2023",amazon,lleg sellado en buen estado falta probarlo
intel-i5-12400f,5.0,"November 14, 2022",amazon,others complaining loud due cooler leg easily broken not stick firmly cpu
intel-i5-12400f,3.0,"September 16, 2022",amazon,got cpu wa brown box bubble wrap around look fine didnt get fan lack official packaging kinda putting think cpu great buy different seller
intel-i5-12400f,5.0,"September 12, 2022",amazon,surprisingly fast chip made upgrading old core easy
intel-i5-12400f,5.0,"January 14, 2023",amazon,great performance gaming great temp air cooled
intel-i5-12400f,5.0,9 July 2023,amazon,great comms seller got tracking number day order delivered next day well protected packaging would definitely use seller again product exactly described
intel-i5-12400f,5.0,22 December 2022,amazon,very pleased cpu
intel-i5-12400f,5.0,"April 12, 2024",amazon,price hard get better
intel-i5-12400f,5.0,"March 10, 2024",amazon,ce un trs bon processeur peut manque un peut de puissance pour un grosse config mais pour le prix ce trs bon
intel-i5-12400f,5.0,"March 15, 2024",amazon,really good processor paired tieverything wa fine no problem
intel-i5-12400f,5.0,"February 28, 2024",amazon,very happy quality promptness delivery item not time use cpu yet update review issue
intel-i5-12400f,4.0,"February 5, 2024",amazon,cpu arrived good shape working great need good thing cooler one recieved cpu no blade fan
intel-i5-12400f,5.0,"January 4, 2024",amazon,im very happy purchase im not computer pro got friend recommendation online review managed put together small itx build modest price cpu helped keep cost relatively low im not heavy gamer nor anything thats super cpuintensive ive able play variety game run different software simultaneously work six month no problem far
intel-i5-12400f,5.0,"September 15, 2023",amazon,wow que cest rapide le cpu vient avec un ventilateur mont sur un refroidisseur
intel-i5-12400f,5.0,"July 30, 2023",amazon,perfect
intel-i5-12400f,4.0,"December 21, 2023",amazon,really fast apps not yet tested game digital software like photoshop went pretty smoothly like well behave window
intel-i5-12400f,2.0,"February 10, 2024",amazon,livr dans une boite trs endomage je nai pa encore eu le temp de linstaller jespre vraiment que le processeur nest pa endomag je vais mettre plus dinfos d que jen ai
intel-i5-12400f,5.0,"April 17, 2023",amazon,yeah not bad cpu doe gaming pretty well even render stuff blender
intel-i5-12400f,5.0,"July 22, 2023",amazon,proper cooling fan cpu doe not heat fast enough play current title robust enough productivity work video editing excellent bangforthebuck processor
intel-i5-12400f,5.0,"January 2, 2023",amazon,
intel-i5-12400f,5.0,"May 23, 2023",amazon,intel core core f processor outstanding choice anyone need powerful affordable cpu base clock speed ghz turbo boost frequency ghz handle demanding task game ease mb cache ensures fast data access six core twelve thread deliver excellent multitasking capability processor powerefficient compatible latest technology offer great value price highly recommendedwhen come value money core f clear winner competes admirably higherend processor come much affordable price point whether youre budgetconscious user someone looking maximize computing performance without breaking bank processor offer unbeatable combination power affordability
intel-i5-12400f,5.0,2024年1月20日に日本でレビュー済み,amazon,LGA1700シリーズで安定した性能に満足しています。
intel-i5-12400f,5.0,2024年1月3日に日本でレビュー済み,amazon,good
intel-i5-12400f,5.0,2024年4月19日に日本でレビュー済み,amazon,それ相応の、品物
intel-i5-12400f,5.0,2023年12月18日に日本でレビュー済み,amazon,マザボとあわせてcpuをi9 9900kから載せ替えました。性能面では9世代i9とは誤差の性能ですが、新品ということもあったのでかなり動作が快適になりました。配信などOBSを使うこともありますが今のところ不便は感じていません。良い買い物でした
intel-i5-12400f,5.0,2023年11月28日に日本でレビュー済み,amazon,使い心地が良いです、配達も速くて、また利用したいと思います！
intel-i5-12400f,5.0,2023年4月11日に日本でレビュー済み,amazon,LGA1700のCPUってこんなに速いの！？こりゃRTX30シリーズ以上つけないと勿体ないくらい
intel-i5-12400f,5.0,2023年2月28日に日本でレビュー済み,amazon,購入当時25000円以下になっていたので購入しました。以前から使っていたPC(i5-2600k)からそろそろ新調したいと思いこちらを購入しました。You Tubeで方の動画を見てi7-12400Fが自分の出せる金額の中でいいなと思いこちらを中心にパーツを検討しました。もう少し値段が出せる方はi5-13400Fの方が性能がいいと思いますが自分は10世代も前のCPUからの換装でしたのでこちらでも十分満足しています。今のところゲームをしていても安定していますしリテールクーラーでも十分冷えていますので良い買い物をしたと思っています。これからグラボもGTX1060から変えようと思っていますが2月末になってからまた値段が高騰してきている気がするのでRTXの4000番代のミドルクラスが出るまで様子を見ですね。主にやってるゲームがGGSTとモンハンライズ、APEXですが設定を落としてるので今のところ問題ないのですが、出来れば綺麗な画質でやりたいので早く出ないかな～。
intel-i5-12400f,5.0,2024年1月11日に日本でレビュー済み,amazon,i5-12400fは20000円切れば神cpuになれるのになぁ
intel-i5-12400f,5.0,2022年6月12日に日本でレビュー済み,amazon,値段の割にはそこそこゲームもできるので初めての自作ならこのぐらいの値段がいいのかな〜今のところ特に問題は無いですが付属のCPUファンのピンが個人的には苦手で上手く刺さらず手間取りました
intel-i5-12400f,5.0,2022年3月4日に日本でレビュー済み,amazon,RTX 3060と組み込み使用。簡易水冷を使用しているので高負荷でも冷え冷えです。コスパ最強のCPUですがグラボが相変わらず高いのが自作パソラーには辛いです。
intel-i5-12400f,1.0,novembro de 2023,amazon,no possui controladora de vdeo isso no permite utilizao de placas de vdeos onboard no est bem claro isso no produto em venda
intel-i5-12400f,5.0,"Jul, 2022",flipkart,allrounder processor best thing editing gaming streaming must recommended
intel-i5-12400f,5.0,"May, 2022",flipkart,thank
intel-i5-12400f,5.0,"Mar, 2023",flipkart,one best processor under price range purchased f k opinion one best intel processor price point
intel-i5-12400f,5.0,"Jan, 2023",flipkart,awesome product
intel-i5-12400f,5.0,"Dec, 2022",flipkart,superb better x
intel-i5-12400f,5.0,7 months ago,flipkart,good processor priceusing asus h e duse external air coolerstock cooler not good
intel-i5-12400f,5.0,"Jan, 2023",flipkart,product good packaging bad
intel-i5-12400f,5.0,"Apr, 2023",flipkart,very good genuine productbest under k range gaming editing etc main work editing grab offer integrated graphic help editing rendring
intel-i5-12400f,5.0,"Dec, 2022",flipkart,got genuine product shown
intel-i5-12400f,5.0,"Dec, 2022",flipkart,awesome original product delivery thank
intel-i5-12400f,5.0,"Dec, 2022",flipkart,good product
intel-i5-12400f,5.0,7 months ago,flipkart,genuine processor recieved packaging wa average delivery guy opened sealed box front verify took otp delivery good experiencethe processor very good medium usage p gaming upgrade th gen see very good improvement overall system performanceone thing note might want upgrade cooler use heavy workload use case stock cooler seems sufficient review
intel-i5-12400f,5.0,7 months ago,flipkart,packing good thanks seller flipkart
intel-i5-12400f,5.0,8 months ago,flipkart,very good upgradenote graphic card necessary
intel-i5-12400f,5.0,"Jan, 2023",flipkart,received original product mentioned
intel-i5-12400f,5.0,"Dec, 2022",flipkart,amazingi use everything gaming editing business many us
intel-i5-12400f,4.0,"Mar, 2023",flipkart,very good working prosessorbut without grafix card not screen show
intel-i5-12400f,5.0,19 days ago,flipkart,excellence processor price tag k motherboards costly working great asus hm e motherboard
intel-i5-12400f,5.0,28 days ago,flipkart,value money product powerfull cpu
intel-i5-12400f,5.0,8 months ago,flipkart,work great rtx
intel-i5-12400f,5.0,8 months ago,flipkart,great purchase satisfied open box one day delivery recommend looking buy
intel-i5-12400f,5.0,9 months ago,flipkart,great purchase got good deal considering market value waiting amd ryzen series processor sale
intel-i5-12400f,4.0,"Mar, 2023",flipkart,good processorpackaging better utilized no issue
intel-i5-12400f,5.0,"Mar, 2023",flipkart,exilent work
intel-i5-12400f,5.0,"Jan, 2023",flipkart,fantastic processor
intel-i5-12400f,5.0,"Jan, 2023",flipkart,very nice product service
intel-i5-12400f,5.0,"Dec, 2022",flipkart,best seal good product love thanx seller
intel-i5-12400f,5.0,"Oct, 2022",flipkart,best gaming processor under k simply brilliant
intel-i5-12400f,5.0,9 months ago,flipkart,capable perform heavy task
intel-i5-12400f,3.0,"Jan, 2023",flipkart,product good working fine good packaging delivery time dont know oem retail cputhe seller doe not mention type cpu
intel-i5-12400f,3.0,2 months ago,flipkart,go
intel-i5-12400f,5.0,1 day ago,flipkart,best every thing editing gaming streaming
intel-i5-12400f,4.0,8 days ago,flipkart,good
intel-i5-12400f,5.0,10 days ago,flipkart,every thing great intel sticker missing
intel-i5-12400f,1.0,18 days ago,flipkart,important note without graphic card no sinal cpu using processor asus hmotherboard combination not working without gpuyou buy separate gpu
intel-i5-12400f,4.0,23 days ago,flipkart,good
intel-i5-12400f,5.0,1 month ago,flipkart,working fine fast deliveryits good cpu
intel-i5-12400f,5.0,1 month ago,flipkart,fully trusted product
intel-i5-12400f,5.0,1 month ago,flipkart,good product
intel-i5-12400f,5.0,1 month ago,flipkart,work like charmupgraded core processor core threaded pc doe thing pretty darn fast
intel-i5-12400f,5.0,1 month ago,flipkart,gud
intel-i5-12400f,4.0,1 month ago,flipkart,very good packaging product safe thank flipkart
intel-i5-12400f,5.0,1 month ago,flipkart,product awesome thanks flipkart give product delivery product great
intel-i5-12400f,5.0,1 month ago,flipkart,great prr
intel-i5-12400f,5.0,1 month ago,flipkart,very happy intel pr
intel-i5-12400f,5.0,1 month ago,flipkart,fantastic processori love
intel-i5-12400f,1.0,1 month ago,flipkart,very bad
intel-i5-12400f,3.0,2 months ago,flipkart,value money
intel-i5-12400f,5.0,2 months ago,flipkart,good
intel-i5-12400f,5.0,2 months ago,flipkart,very good price
