Reviews,Date,Rating
complaint cpu use playing game run good want careful gpu pair cpu dont bottleneck great,"Jan 6, 2024 3:38 PM",5.0
son built gaming computer using cpu xt asrock motherboard ddr ram great cpu snappy play game great got sale le plus upgrade ability ever decides go th gen cpu need yet,"Apr 11, 2023 7:52 PM",5.0
research cpu founf one enough heavy multitasking gaming would highly recommend first time builder,"Jan 1, 2024 9:35 AM",5.0
great cpu exceptional value paid z mother board ddr ram upgrade amd r x huge improvement temperature hve came also,"Apr 18, 2022 7:55 AM",5.0
great budget processor handle anything thrown loved easily,"Apr 24, 2024 3:08 PM",5.0
tried true one generation next cant think single complaint stay cool get done,"Aug 16, 2023 4:50 AM",5.0
powerful cpu intel k unlocked core pp core excellent gaming productivity video editing paired right motherboard,"May 16, 2023 2:54 PM",5.0
havent set completely yet know great processor,"Jul 28, 2023 6:52 PM",5.0
loved good service excellent processor able build midrange one sold friend still,"Nov 26, 2023 3:28 AM",5.0
love cpu powerful paired rtx ti top knotch,"Jan 15, 2024 5:58 PM",5.0
great product put new gaming pc massive help store employee,"Nov 25, 2023 8:10 AM",5.0
responsive paired ti gb o beast along qith samsung pro nvme amd samsung evos,"Sep 25, 2023 2:49 PM",5.0
year ben working amazing recommend everyone,"Dec 2, 2023 4:00 PM",5.0
nervous getting dont know whybut ive k almost year powerhouse love anyway tried budget conscious build decided k instead k boy shocked sucker like lightning compared k support shiny new doodad motherboard nvme screaming ti actually getting warm reach potential im seriously impressed havent overclocked yet coming paired noctua dhs really didnt want stock needed cooling tower k stay upper teen low idle hasnt exceeded c load great processor would hesitate recommend buy,"Jun 11, 2022 11:40 PM",5.0
great product honest knew would excellent start,"Jul 14, 2023 7:32 PM",5.0
performance get feel like might one best price performance cpu could get without go used market,"Apr 26, 2023 2:27 PM",4.0
super fast using ryzen year anymore also pin worry bending break great diy builder,"Feb 10, 2023 2:15 PM",5.0
glad got heard one best cpu known gaming,"Dec 30, 2022 4:49 PM",5.0
reliable cpu intel k use work gaming built graphic mining ghz speed intel tuner,"Apr 15, 2022 4:43 PM",5.0
upgraded chip ram gpu upgrade running swell,"Mar 19, 2023 9:18 PM",5.0
amazing pickup sale coming th gen cpu thing like spaceship handle game easily battlefield call duty csgo etc would definitely recommend building pc cant see thing topped anytime soon price power consumption tad high pair good gpu youll never know difference,"Feb 2, 2024 3:47 PM",4.0
awesome price awesome performance hard beat budget gaming setup paired ti thing amazing job staying cool helping push anything throw,"Jul 13, 2023 3:09 PM",5.0
recently purchased k z tomahawk motherboard upgrade filemedia serverplex box overall ive really happy upgrade increase raw performance speed crazy compatibility topnotch ddr ddr pcie etc complaint much powerhungry chip previous setup would idle stay idle using watt setup idle w never stay thereits constantly bouncing based fulldays power usage figure consuming ish watt task note yet really dig advanced power setting hoping window intel would provide best case scenario time learning pc behavior hasnt happened yet also realize usage mightve better served nonk processor however ended purchasing guy le would paid increased performance le cost opted k still mad made choice,"Feb 25, 2022 4:28 PM",5.0
good cpu thing bought wife build almost year ago game keep k little different game really good cpu price everything need without bogging,"Jan 10, 2024 3:41 PM",5.0
got great price literally next day purchase raise lold hardbut great lil processor nontheless uhd integrated graphic great home medium server transcoding need core great performance creating vmsgood lowmid tieri honestly dont notice different pc k,"Feb 9, 2024 4:00 PM",5.0
great every say run mill game went th gen gen almost newest step,"Dec 8, 2023 3:42 PM",5.0
performance great price generation old chip make affordable happy purchase,"Nov 17, 2023 9:50 PM",5.0
excellent budget option perfect gaming productivity pair gpu wont bottleneck im software developer cpu hold pretty well find lot option mb pair,"Jun 12, 2023 10:43 AM",5.0
work great new msi board way faster processor last,"Jan 3, 2024 11:35 PM",5.0
work great mixture light heavy gaming cpu along component get job done,"Oct 17, 2023 10:02 AM",5.0
outstanding performance midfield processor handle everything built system plenty life low heat range plenty room upgrading hopefully ill get another year chip like last intel ik,"Jan 14, 2024 5:42 PM",5.0
far processor great im building gaming pc im getting gpu tomorrow mean time running processor fastest computer ive ever still learning computer part run game super graphically intensive rocket league get fps low setting fps phasmophobia low setting fps minecraft etc without gpu,"Apr 5, 2024 5:20 PM",5.0
love th gen perfect gaming stay pretty cool,"Oct 31, 2023 11:37 AM",5.0
solid cpu stable super hot powerful cpu cant really complain honestly k thats delidded got backup cpu im changing liquid metal k lol kind flex hate able use pc glue drying im changing liquid metal,"May 3, 2024 4:11 PM",5.0
great deal intel core ik desktop processor pe core ghz unlocked lga comparing cpu gaming great choice,"Feb 16, 2024 3:29 PM",5.0
debating k k price difference cpu minimal benchmark performance gaming went bad boy disappointed solid cpu get degree celsius evo good purchasing another,"Apr 29, 2024 2:26 PM",5.0
bought awhile ago still work great upgraded k much faster,"Jul 7, 2023 9:02 PM",5.0
im running thing h flow case msi za pro wifi ddr cl trident z noctua nhua cooler cb r basic turbo ratio overclock incredible ua full speed get low overclocked benchmark still stock pulling w instead w pull core drop temp around c le gaming exceptional single core great multi core thing performant last gen core processor intelamd look sweet spot youre mainly gaming even higher end card,"Apr 8, 2022 3:12 PM",5.0
work great used new pc build good value im using,"Jun 10, 2023 1:13 AM",5.0
although may genius come computer part know cpu capable far issue running rdr minecraft server window solitaire time unfortunately cooling system consist window unit paper fan powered handle overclocking well,"Jul 14, 2023 8:02 PM",5.0
great performance box bump cpu would yield noticeable result,"Feb 1, 2024 12:53 PM",5.0
great processor gaming warzone fortnite,"Mar 15, 2024 3:20 PM",5.0
cpu one best gaming plenty core handle gaming mutitask went k amd x price cheaper cpu also faster single threaded workload performance core plus efficiency core plenty gaming moderare workload year come also run fairly cool thermalright peerless assassin cpu cooler,"Sep 10, 2022 5:28 PM",5.0
use cpu build custom build worth price,"Feb 29, 2024 3:12 PM",5.0
much say im zero issue cpu im playing fallout mordhau c recording music via reaper watching movieslistening music cpu handling everything without issue,"Apr 21, 2024 4:01 PM",5.0
k ks overclock hwbotorg k beast great bin able stabilize cinebench r p core e core memory cmr r score pretty much comparable x thats thread cpu v thread cpu k fast sub gaming destroys x gaming get k game k ghz core,"Jun 17, 2022 10:30 PM",5.0
working great still bought old system finally died needed full replacement bought right gen came working perfectly fine still withthe game want play,"Aug 20, 2023 3:25 AM",5.0
great value cpu im happy build,"Feb 16, 2024 4:00 PM",5.0
great cpu modern strong decent video card capable play gay aaa modern game,"May 14, 2024 1:56 PM",5.0
price want intel build cant go wrong last gen,"Dec 22, 2023 5:21 PM",5.0
bad value definitely worth id say buy,"May 25, 2024 8:56 AM",5.0
great cpu fast great bang buck perfect gaming,"Dec 30, 2023 5:37 PM",5.0
cpu good really good price run well great brand,"Dec 2, 2023 8:48 PM",5.0
picked bad boy ryzen g x one simple reason local store stock well motherboard pair upgraded b series board paired coolermaster mm air cooler msi z board gpu comparing two system rx xt let board genie oc thing bumped clock ghz across pcores ghz ecores managed get ghz across pcores ghz across ecores however resulted unacceptable load temperature dropped overclock ghz ghz mv undervolt run cool quiet fast havent done much way cpu specific benchmarking say notable improvement gaming flatscreen vr particularly poorly optimized game like ark ecores quite fast right used gaming test arent dissimilar core turn hyper threading regularly assign ark server run background also offer amazing power saving typical load running server browser multiple tab open steam running background cpu average w tdp havent encountered issue window task scheduler window performance seems great im fairly certain bottleneck cpu onboard gpu bonus failsafe case gpu ever dy want something decent igpu get ryzen g wait next generation rdna core previous generation reason get k series chip overclocking ability time around ecores actually offer surprising appeal need extra thread may actually result net power saving dont run cpu load often dont see lot background stuff highly threaded task would probably perfectly happy putting extra money gpu nvme storage something get pretty similar gaming performance lot le money due high price z series board,"Feb 1, 2022 5:24 AM",5.0
bought cpu gaming pc handled every game played ease capable cpu,"Oct 20, 2023 4:47 PM",5.0
work intended havent issue preforms really well load,"Nov 24, 2023 12:49 PM",5.0
work extremely good never experienced issue first pc build,"Apr 26, 2024 7:24 PM",5.0
great gaming cpu market buy great gaming cpou awesome single thread boost long u great cooleri ghz mm aio great older game like arma hammer single core ofcourse great new game since core p core e core cpu run cool mine run low gaming itx formd mm slim fan mm fan pair cpu ddr mobo ur good since ddr mobo expensive useless,"Jan 10, 2022 4:52 PM",5.0
excellent chip recommended anyone building gaming rig,"Nov 24, 2023 12:19 PM",5.0
always intel rock gor sale great price power needed price winwin,"Apr 5, 2024 3:53 PM",5.0
cpu got best th generation price point rather going seven nine cost much cpu almost much performance come gaming,"Aug 15, 2022 11:38 PM",5.0
fantastic cpu work well multi tasking gaming,"Nov 11, 2023 2:43 PM",5.0
cpu helped improve frame rate significantly,"May 5, 2024 1:12 AM",5.0
moved k absolute cosmic leap performance ive year im extremely happy,"Jul 14, 2023 9:29 PM",5.0
intel ik fast havent overclocked run aaa title game ease low pricepoint make incredible first pc cpu,"Jun 8, 2023 5:27 PM",5.0
great cpu entry level gaming video editing,"May 9, 2024 5:51 AM",5.0
grandson told one product needed pc building gladly bought he great boy done lot happy picked quality product gifted thank,"Nov 10, 2023 6:56 PM",5.0
paired rtx gb ram msi z ddr run game max p,"Sep 13, 2023 11:26 AM",5.0
really fast processor came amazing deal,"Apr 26, 2024 12:22 PM",5.0
buy th gen switched one,"Apr 14, 2024 6:14 PM",5.0
youre able get sale amazing deal price,"Aug 21, 2023 11:36 AM",5.0
even though th gen cpu still fast great job gaming productivity task,"Jun 28, 2023 4:51 AM",5.0
great upgrade th gen cpu great grab sale,"Sep 22, 2023 4:39 PM",5.0
excellent quality price ration also ver stable application,"Apr 3, 2024 10:56 AM",5.0
good starter gaming pc definitely graphically inclined game need better cpu,"May 21, 2023 5:34 PM",5.0
work perfectly well intended purpose midtier gaming everyday task overclocked,"Jun 18, 2023 1:13 PM",5.0
good value cpu socket intel motherboard reasonable tdp requires upgrade cpu cooler overclocking,"May 26, 2023 8:05 AM",5.0
good cpu price fast speed program,"Feb 17, 2024 12:52 PM",4.0
nice product never problem fit perfect lotherboard,"Mar 28, 2024 12:23 PM",5.0
run anything toss without problem mine paired ti run well,"Jun 15, 2023 11:53 AM",5.0
beautiful amazing great product would buy,"Apr 9, 2024 5:28 PM",5.0
slays cinebench test great gaming excited overclock eventually,"Jul 9, 2023 9:18 AM",5.0
love processor fast snappy havent issue,"Jul 12, 2023 3:49 AM",5.0
work excellent price bought cpu first pc build disappointed,"May 20, 2023 1:58 PM",5.0
price better choice would go cpu time time,"Feb 29, 2024 1:22 AM",5.0
work good literally run game want,"Mar 24, 2024 6:39 AM",5.0
fast capable chip last good chunk year,"Jul 10, 2023 2:25 PM",5.0
excellent processor good performance prince recommend product,"May 20, 2023 1:34 PM",5.0
work perfectly fine cpu fast handle game,"Jun 23, 2023 10:32 PM",5.0
problem issue everything great except include cpu cooler,"Feb 10, 2024 10:10 AM",5.0
bought update little expensive worthy great performance l,"May 12, 2023 9:52 PM",5.0
good gaming cpu release even better deal almost two year later le gaming problem streaming course coding better cpu money sure need spend achieve high fps rtx gpu,"Aug 4, 2023 1:57 PM",5.0
great product recommended,"Mar 8, 2024 10:34 PM",5.0
intel cpu run great rtx ti pc budget build,"May 31, 2023 11:53 PM",5.0
work amazingly high speed sold good price,"May 26, 2023 11:15 PM",5.0
performance great perfect pc build,"May 12, 2023 4:19 PM",5.0
good value money would recommend,"May 23, 2023 11:13 AM",5.0
ikf efficient pricepreformance wise doesnt integrated graphic could annoying trying diagnose issue also superseded ikf ikf ikf cheaper whilst worse,"Jan 6, 2024 7:44 PM",4.0
good,"Feb 2, 2024 11:15 PM",5.0
straightforward employee explained product well purchasing problem,"Nov 10, 2023 4:12 PM",5.0
got son build computer great love,"Dec 16, 2023 7:24 PM",5.0
installed gigabyte b gaming x ax ddr since im overclocking board feature wanted good price paired gb ddr cl ram phanteks mp aio liquid cooler cpu temp never rose degree minute cpu usage stress test stock phantek fan noctua nfax pwm fan temp high stress test running man sky resolution ultra setting gtx vsync enabled fps never drop vsync disabled previous system usually cpu utilization gaming cpu utilization hovers around keep mind kf integrated intel gpu discreet card required worthwhile upgrade one im happy,"Oct 22, 2022 11:28 AM",5.0
great processor rtx gaming fps new game,"Dec 29, 2023 9:08 PM",5.0
able add easily existing system upgrade,"Dec 22, 2023 9:46 PM",5.0
easy install smell good everything need,"Dec 17, 2023 1:51 PM",5.0
big upgrade used youre fence sign buy,"Nov 10, 2023 3:23 PM",5.0
fantastic price performance cpu still support ddr overall system build price kept reasonable,"Oct 10, 2023 10:21 AM",5.0
definitely improvement th gen intel cpu play modern game well p fps ti would recommend cpu anybody want get high frame within p gameplay,"Apr 26, 2023 9:28 PM",5.0
amazing purchase completely eliminated bottleneck,"Dec 3, 2023 5:29 PM",5.0
amazing quality amazing build work amazing,"Dec 2, 2023 4:50 PM",5.0
refently upgraded f cpu great im using cordair hi aio kit keps stay steady c load idle around c,"Feb 5, 2023 1:32 AM",5.0
like product bought product,"Nov 26, 2023 10:34 AM",5.0
building first pc didnt want pay scalped gpu bought integrated graphic complaint far im able play game like overwatch without issue thats good enough,"Jun 28, 2022 4:18 PM",5.0
great processor great sale price upgraded ghz ive never issue intel processor since first pentium,"Jan 14, 2023 9:48 AM",5.0
excellent performance us lot watt processor push work worth cost downside builtin graphic good playing action game need separate video card gaming,"Apr 27, 2022 1:51 PM",5.0
lot say really overall great cpu far best bang buck primarily use pc game absolutely way go dont pay hundred small percentage extra power,"May 27, 2022 8:16 AM",5.0
fast processor easy install paired ddr ram work great,"Feb 23, 2024 3:45 PM",4.0
imtel core guess must good cause someone else purchase ended account,"Aug 18, 2023 8:07 PM",5.0
good cpu money everything need gaming photoshop video editing without spend money,"Dec 9, 2022 4:57 PM",5.0
great far definitely using max capability way faster powerful,"Jun 23, 2023 9:26 PM",5.0
processor amazing super quick sure buy sale,"Sep 3, 2023 1:08 PM",5.0
run great good buy would recommend anyone building new pc,"Aug 30, 2023 7:38 PM",5.0
managed snag price absolute steal able handle gaming office photo editing,"Jan 6, 2022 6:19 PM",5.0
best bang buck cpu market work flawlessly window great performance absolutely sacrifice cpu,"Mar 15, 2022 11:19 PM",5.0
cpu itx build perfect blend performance budget,"Feb 6, 2023 10:38 AM",5.0
great cpu fast handle anything thrown best cpu value even outshines th generation rx x,"Apr 27, 2022 11:18 AM",5.0
k beast competes much expensive x without temp issue running nhd never peak load,"Dec 29, 2021 4:42 PM",5.0
awsome chip fast upgraded k big differencegreat chip gaming wanted returned got k,"May 21, 2022 8:53 AM",5.0
bought upgrade desktop worth money computer run smooth thanks intel core,"Apr 14, 2023 4:40 PM",5.0
solid cpu definitely worth needed one build time good choice,"May 20, 2023 12:19 AM",5.0
work great especially new gaming want starter processor,"Jun 19, 2023 12:07 AM",5.0
best gaming cpu sub much else beat unless sidegrade something else looking forward seeing age,"Jun 5, 2022 4:52 PM",5.0
amazing cpu would buy another board,"Jul 20, 2023 5:48 PM",5.0
really good cpu everyday work,"Jul 17, 2023 4:16 PM",5.0
good ddddddddddddddddddddddddddddddddddddddddddddddddddddd,"Jul 21, 2023 8:05 AM",5.0
cpu get varies individual product mine performs well enough benchmark say underperforms,"Nov 17, 2023 7:38 PM",4.0
wish got thing sale overall worth every penny,"Jun 28, 2023 3:17 PM",5.0
nice product recommend people nice nice,"Jul 26, 2023 11:56 AM",5.0
computer x hotter figuratively literally run like champ,"May 27, 2023 9:56 AM",5.0
good customer service picking also amazing product good quality,"May 20, 2023 1:37 PM",5.0
literally best bang buck cpu buy right rtx super gpu heavily gpu bound highly dope,"Mar 19, 2022 8:00 AM",5.0
dave big help helped find right cpu motherboard bought,"May 8, 2023 4:17 PM",5.0
really great cpu great match thinking upgrading ik get ti,"Apr 17, 2022 11:43 AM",5.0
outstanding middle road processor upgrading,"Jun 10, 2022 5:11 PM",5.0
best bang buck cpu havent issue overclock amazing cpu,"Mar 18, 2022 10:33 PM",5.0
great budget cpu th gen intel core ghz fast,"Mar 9, 2022 7:53 PM",5.0
fast cpu defiantly worth money great gaming,"May 8, 2022 3:07 PM",5.0
great value price going go didnt enough ill upgrade later th gen far processor great never go usage apps game use glad product,"Dec 23, 2022 6:40 PM",5.0
best th gen cpu almost gaming performance cheaper,"Jan 14, 2022 4:37 PM",5.0
granted still dont issue bottlenecking anything like work great,"Aug 20, 2023 5:04 PM",4.0
fast processor run program fast great upgrade happy glad got k version video nvidia card died week able run basic video desktop wait replacement video card nvidia,"Aug 26, 2022 5:34 PM",5.0
work well overall performs expected cpu,"Jan 20, 2023 6:25 PM",5.0
bought thought order amazon stolen found sent different mailbox saw,"Jan 26, 2024 3:29 PM",3.0
amazing cpu price aio custom loop overclock get amazing result say play voltage able keep temp got mine running p core e core max temp reaching c,"Aug 5, 2022 8:02 PM",5.0
tremendous value outperforms th generation,"Jan 1, 2022 11:41 AM",5.0
absolutely blown away performance cpu paired zero bottleneck getting frame siege ultra setting cant go wrong cpu,"Nov 23, 2022 2:14 PM",5.0
game get cpu cant beat performance price check list game dont work though th gen processor something different core otherwise steal,"Dec 3, 2021 5:35 PM",5.0
really nice budget friendly cpu time giving review cpu pair nice z motherboard price point cpu worth,"Dec 16, 2022 4:22 AM",5.0
work great read performance efficiency core definitely performance upgrade old ik cpu cpu great start new pc build hopefully new motherboard upgradable future,"Mar 18, 2022 5:03 PM",5.0
ar building k k best marriage graphic card buying capacity never use great value especially sale,"Oct 3, 2022 3:07 PM",5.0
definitely competitive ryzen time waiting rocket lake get big boy k sufficient need right overclocks like champ,"Jul 24, 2022 6:53 AM",5.0
work well msi bm mortar ddr motherboard running window issue would recommend dont aftermarket cooler yet one even better value,"May 23, 2022 2:34 PM",5.0
possibly best overall processor buy right sure xd lead performance part also cost quite bit k,"Jun 17, 2022 7:26 PM",5.0
ran hot great cpu get would make sure get good air cooler beefy aio cooler,"Dec 29, 2022 10:57 AM",5.0
pretty good cou everything need streaming productivity gaming awesome,"Jan 13, 2023 5:48 PM",5.0
easy install really got ta mess something install wrong working great hasnt gone degree celsius playing god war ultra graphic,"Mar 24, 2022 11:29 PM",5.0
great th gen intel cpu offer great performance affordable price,"Feb 10, 2023 7:20 AM",5.0
pretty good cpu much better x would suggest x performance almost eve cheaper,"Feb 11, 2022 4:29 PM",5.0
work well everything need gaming ti rendering,"Feb 23, 2023 10:16 AM",5.0
pretty efficient proccessor go little expesnive worth,"Jan 17, 2023 7:12 AM",5.0
balue nice proccessore minimal diffrence th gen,"Jan 9, 2023 9:18 PM",5.0
amazingly fast easy cool single core performance bigger brother lower power,"Sep 30, 2022 4:05 PM",5.0
cpu perfect gaming price isnt bad well,"Feb 3, 2023 4:13 PM",5.0
much better old cpu also got whiplash booted pc,"Dec 18, 2022 6:46 PM",5.0
stock coming back gpus finally build end cycle gaming rig brainer price,"Jul 3, 2022 1:36 PM",5.0
work great could ask better product price,"Feb 3, 2023 8:51 AM",5.0
best cpu ive owned beat stock cpu easy overclock fast fast get worth,"Sep 10, 2022 8:47 PM",5.0
used cpu multiple build happy used gaming pc,"Apr 1, 2022 6:02 PM",5.0
got upgrade k got sale pleased,"Oct 21, 2022 6:38 PM",5.0
best cpu market right price amazing amount core best priced cpu,"Apr 7, 2022 1:00 PM",5.0
overclocked loving frame rn rdr halo deathloop flawless,"Dec 13, 2021 12:23 PM",4.0
new th gen cpu quirk im impressed speed horsepower k provides,"Jul 22, 2022 4:21 PM",5.0
issue far run cool basic air cooler great chip gaming productivity task like videoaudio editing,"Feb 24, 2022 11:34 PM",5.0
good budget cpu performs well almost everygwme,"Jan 31, 2023 10:36 PM",5.0
im sure great processor however returned could get cpu cooler provided intel didnt want mickey mouse non intel cooler non intel cooler doesnt cool cpu non useable non returnable junkbox item ended returning cpu mother board buying computer put together socket lga cpu cooler available supplied can not recommend item,"Jun 30, 2022 8:01 AM",5.0
processor fast used integrated graphic couple month play game run smoothly,"Apr 9, 2022 9:15 AM",5.0
meet project need enough requirement want opting,"Dec 17, 2021 4:16 PM",5.0
great professor decent price say,"Nov 28, 2022 11:15 AM",5.0
processor really fast great good bang buck upgrade window take advantage biglittle core,"Feb 26, 2022 4:18 PM",5.0
great cpu delivered fast run fast hand best value performance cpu ever made far satisfied,"Feb 18, 2022 4:14 PM",5.0
really reason go gaming cpu pack enough performance gaming issue need good cooler puppy run hot even corsair icue hi elite capellix cpu cooler run hotter id like,"Feb 1, 2022 12:16 PM",4.0
super fast workstation use price point really accessible well highly recommend upgrade new build,"Mar 1, 2022 9:07 PM",5.0
best cpu right money definitely get youre build,"Jul 1, 2022 4:05 PM",5.0
impressive performance really put great power come game,"Jul 9, 2022 11:02 AM",5.0
really fast tend use gaming schoolwork get job done,"Jul 21, 2022 5:19 PM",5.0
good cpu processor met expectation recommend,"Sep 23, 2022 6:21 PM",5.0
work great htpc build stay cool proper heatsink,"Aug 22, 2022 11:40 PM",5.0
great cpu gaming bought one first pc,"Oct 11, 2022 6:38 PM",5.0
amazing processor gaming productivity pc,"Oct 7, 2022 11:36 AM",5.0
using ryzen since owned multiple amd cpu x x decided switch intel better window compatibility new z build working far complaint issue whatsoever im really looking forward seeing raptor lake offer later year,"Aug 19, 2022 7:24 AM",5.0
smooth cool used gaming web browsing,"Sep 9, 2022 9:16 PM",5.0
x alot cooling issue yes gave high gaming performance however switched performance yet stay cool sure people say cpu run hot load boost watt like ryzen im already happy,"Dec 7, 2022 11:18 AM",5.0
granddaughter loved gaming laptop christmas present,"Jul 29, 2022 4:03 PM",5.0
bought cpu daily desktop work play game edit video clip masterliquid pl flux peak temperature hasnt exceeded c idle temp c oc performance stable past week dont play game probably embedded gpu enough daily use issue using embedded one two week new rtx gpu delivered,"Apr 16, 2022 7:54 PM",5.0
new king mainstream gaming cpu intel finally year managed deliver good cpu also competitive good value money take youre mainstream gaming content creator better stick amd ryzen,"Jan 21, 2022 12:11 PM",5.0
amazing cpu price performance can not beat,"May 6, 2022 8:42 AM",5.0
wow cpu almost fast faster k great value intel,"Apr 10, 2022 9:33 AM",5.0
best value money bar none core thread whats like amazing processor,"Dec 24, 2021 4:49 PM",5.0
decent cpu never problem booting suppose never overclock find needed k using mini itx motherboard inside corsair ca hold standard atx motherboard along mini itx motherboard yes case beast heavy,"Jul 30, 2022 8:12 AM",5.0
thing beast walk circle around ik clocked speed,"Jan 28, 2022 6:48 PM",5.0
upgraded k man tell difference,"May 13, 2022 6:45 PM",5.0
easily satisfied performance requirement people,"Apr 16, 2022 3:53 PM",5.0
