Reviews,Date,Rating
amazing cpu gaming work also amazing,"Feb 19, 2022 10:37 PM",5.0
amazing chip huge upgrade intel finest love,"Mar 19, 2022 11:26 AM",5.0
cpu lightning fast capable drawback center almost entirely around ecores ecores run shortage issue daytoday play first issue ran computer would load window without booting bios restarting first everytime went turn computer either hard reset computer would go straight bios disable fast boot load bios restart computer longest time couldnt even figure wrong eventually though came idea maybe ecores old rocket lake ryzen cpu fine number task even ram using ddr z motherboard sure enough turning ecores fixed booting issue others another issue monitor registering audio coming tv hooked hdmi cable certain gpu problem switched girlfriend gpu extra gpus lying around exact issue use one display period well turned ecores noticed audio actually back tv monitor tested monitor sure enough worked like intended morale story would completely skip ecore cpu go looking game extra money isnt worth probably end turning anyway defeat entire purpose feel,"Jul 13, 2022 1:19 PM",2.0
much needed upgrade th gen intel cpu blazing fast,"Feb 12, 2022 1:44 AM",5.0
processor outperforms old ik also ik price performance ratio extremely good wanting budget intel build processor way go,"Apr 10, 2022 1:49 PM",5.0
best bang buck great clock speed performance,"Jan 29, 2022 9:10 AM",5.0
definitely worth game run smooth would recommend,"Jan 20, 2022 7:13 PM",5.0
product readily available best buy checked place would available sometime january christmas gift,"Jan 13, 2023 11:10 AM",5.0
processor graphic processor built built graphic processor nice building trouble shooting,"Feb 25, 2023 7:58 AM",5.0
easy install youll buy fan intel cpu ending k dont provide went noctua nhlixx low profile cooler,"Jan 29, 2022 2:46 PM",5.0
perfect need maybe little overkill wanted future proof bit went th gen smooth buttery performance im gamer perfect,"Sep 30, 2022 5:37 PM",5.0
intel core ik desktop processor pe core ghz unlocked lga series chipset w excellent,"Feb 9, 2023 2:33 PM",5.0
another great cpu intel cant go wrong k really k th th gen family wont regret purchase,"Nov 23, 2022 4:34 PM",5.0
excellent processor capable unlocking gave reading ghz core clock speed even though say core mean price enormous,"Jul 7, 2022 12:35 AM",5.0
impressed th gen core processor best leap intel made year running amd year building pc always look next better faster thing,"Mar 26, 2022 12:14 AM",5.0
still using day since bought really awesome cpu even rtx swapped bottlenecked overall,"Aug 3, 2022 12:24 AM",5.0
wasnt broken seems acting like ik really needed,"Mar 30, 2023 7:32 PM",5.0
performs well window gaming fully tested overclocking yet waiting get bracket liquid cooler still wish came stock cooler especially new socket type,"Nov 26, 2021 8:39 AM",5.0
great cpu run really fast upgrading k would nice came cooler im fine getting good one,"Dec 23, 2021 1:11 AM",4.0
work good problem install took second boot,"Feb 17, 2023 4:27 PM",5.0
best deal right get fast last long time pair decent mobo gb ram nice gpu great system,"May 31, 2022 4:06 PM",5.0
good processor better choice compare,"Apr 1, 2023 3:30 AM",5.0
dont forget buy cooler doesnt come stock cooler stated knew forgot moment go back buy one lol,"Apr 9, 2022 10:15 PM",5.0
work well month running work asus zplus wifi ti good budget build solid cheap gaming,"Jul 30, 2022 7:10 PM",5.0
good product good price agent helped get price match could shop,"Mar 4, 2022 3:44 PM",4.0
decided go team blue girlfriend new gaming rig build boy thing disappoint,"Apr 1, 2022 6:37 PM",5.0
youre making budget buildhell even youre isbprobably best bang buck gaming processor,"Aug 9, 2022 4:19 PM",5.0
issue component even though older generation really satisfied performance far,"Aug 28, 2022 6:30 PM",5.0
snappy responsive normally intel person one good,"Dec 21, 2022 4:37 PM",5.0
great performance low cost paired fe bottleneck system whatsoever,"Sep 28, 2022 4:05 PM",5.0
work expected quick shipping fair price always,"Feb 4, 2023 6:55 PM",5.0
really strong reliable great price especially holiday,"Jan 1, 2023 2:10 AM",5.0
thing beast cpu currently paired ti running great,"Mar 18, 2022 7:27 PM",5.0
great processor really easy install definitely worth,"Jan 23, 2023 5:14 AM",5.0
good work expected like lot gaming,"Dec 24, 2022 3:35 PM",5.0
honestly best cpu ever purchased lifetime,"Jan 13, 2023 4:36 PM",5.0
first time building pc worked great msi za motherboard installed,"Sep 23, 2022 3:40 PM",5.0
couldnt go wrong plain simple box love blue work,"Oct 26, 2022 1:11 AM",5.0
working building pc one part son needed,"Dec 30, 2022 5:43 PM",5.0
extremely good product like fact built gpu easily boot computer,"Jul 29, 2022 7:25 PM",5.0
run great upgraded would highly recommend,"Oct 24, 2022 4:48 PM",5.0
first build intel processor worked great,"Oct 31, 2022 8:38 AM",5.0
newegg sent horrible malfunctioning one went local bestbuy bought one easy,"Apr 29, 2022 5:44 PM",5.0
great processor got programming amazing multiprocessing,"Jul 19, 2022 12:10 PM",5.0
fair price excellent product love shopping best buy,"Oct 21, 2022 4:06 PM",5.0
nothing better price point gaming,"Nov 25, 2022 7:50 AM",5.0
bought upgrade son computer really move great purchase,"Aug 26, 2022 3:20 PM",5.0
easy install trouble far would recommend anyone building pc,"Jun 30, 2022 7:00 PM",5.0
king budget get x dont look back igpu decent play low p fps,"Feb 22, 2022 12:46 AM",5.0
love fact run cool doesnt need lot fan power keep cool,"Oct 21, 2022 7:40 PM",3.0
amazing run great problem already seeing big difference prior one,"Apr 28, 2022 3:56 PM",5.0
solid performer support ddr gamer dont need,"May 20, 2022 4:36 PM",5.0
best budget gaming cpu paird w ti beast p,"Aug 6, 2022 5:15 AM",5.0
great processor mid tier gaming pc recommend,"Sep 21, 2022 3:26 PM",5.0
banger cpu excited intel competitive amd riding tail,"Feb 11, 2022 7:18 PM",5.0
issue solid performance dont forget grab cooler come one,"Apr 22, 2022 6:11 PM",5.0
awesome product problem installing would recommend,"Aug 27, 2022 7:52 AM",5.0
amazing jump performance hold next year,"Mar 31, 2022 5:27 PM",5.0
perfect processor pc build shipped perfectly quick,"Jun 14, 2022 8:14 AM",5.0
loved,"May 14, 2022 4:25 AM",5.0
fantastic cpu bottle neck paired ti fe,"Jun 25, 2022 7:46 PM",5.0
awesome cpu powerful also underpowered,"Jun 27, 2022 2:47 PM",5.0
running smooth meeting requirement,"Jul 22, 2022 4:21 PM",5.0
processor advertised effectively,"Feb 27, 2022 1:49 AM",5.0
work great delivered super fast worked great,"Apr 29, 2022 4:07 PM",5.0
k good enough gaming productivity budget,"Mar 18, 2022 7:49 PM",5.0
mine doa bought ryzen xd instead probably wont ever intel,"Jan 14, 2024 10:05 AM",1.0
big upgrade intel generation excited new motherboards,"Jan 6, 2022 4:51 PM",5.0
sick nasty gamesplay cool good cccccccccccc,"Feb 25, 2022 5:25 PM",5.0
intel came promised,"Jan 8, 2022 8:08 AM",5.0
customer rep chris bessins great work,"Dec 20, 2021 2:08 PM",5.0
cost value kept star best buy want minimum character keep short simple,"Sep 9, 2022 4:39 PM",4.0
solid cpu intel coming back major way year negativity,"Jan 9, 2023 9:28 AM",4.0
th gen intel cpu th gen intel significant improvement generation make hard recommend guess certain circumstance go youd better ryzenm series th gen intel,"Nov 18, 2022 5:01 PM",3.0
didnt come stock cooler amazing chip price,"Apr 9, 2022 3:31 AM",4.0
aight greatest get job done,"May 5, 2022 3:14 PM",4.0
good cpu graphic video card market suck good luck,"Dec 20, 2021 3:50 PM",4.0
expensive sale especially alder lake still many issue memory,"May 17, 2022 8:22 PM",3.0
work really good love allows play game want play,"Feb 16, 2024 11:00 PM",5.0
really good value performance would buy would recommend anyone one strict budget,"Aug 11, 2023 3:21 PM",5.0
work perfectly personal pc build matched spec needed wanted,"Jan 6, 2024 11:36 PM",5.0
great cpu gaming even multithreaded workload outperforms previous gen application driver havent even fully matured yet youre lucky even find assuming lack affordable z board want depth review performance check gamers nexus cpu over probably best priceperformance ratio user yield diminishing return gaming considered alternative youre intensive multithreaded workload take advantage thread extra efficiency core nice alternative virtual thread multitasking power draw bit high class cpu testing dont run hot use small form factor case beefy aircooler im passing c benchmark stresstesting major downside currently bug denuvo game though id blame bad denuvo software lack cheap compatible motherboards either wait b h series board come try get bundle dealsale one cheaper z board,"Dec 17, 2021 2:34 PM",5.0
incredible performance price cpu thay oc mhz easy safe awesome people complaining heat good cpu cooler defenitly fine super pleased thing intel certianly taken back crown time,"Nov 8, 2021 11:48 AM",5.0
great cpu gaming p need buy fan cpu cpu air fan cooler around strong enough keep cpu cooled even overclocked,"Feb 10, 2023 3:57 PM",5.0
fast processor assemble computer daughter know philosophy either assemble cheap one regret later assemble middle cost useful later opted one useful used onboard graphic since processor support completely satisfied product,"Aug 19, 2022 4:30 PM",5.0
hi speed without heat power consumption work,"Apr 1, 2022 4:49 PM",5.0
vey good cpu mid tier high tier build,"Aug 12, 2022 9:01 AM",5.0
good came well packaged worked well,"Mar 11, 2022 8:34 PM",5.0
